idDrink,strDrink,strCategory,strAlcoholic,strGlass,strInstructions,strDrinkThumb,strTags,dateModified
12402,Tom Collins,Ordinary Drink,Alcoholic,Collins glass,"In a shaker half-filled with ice cubes, combine the gin, lemon juice, and sugar. Shake well. Strain into a collins glass alomst filled with ice cubes. Add the club soda. Stir and garnish with the cherry and the orange slice.",https://www.thecocktaildb.com/images/media/drink/7cll921606854636.jpg,,2015-08-18 15:21:22
12988,Mulled Wine,Punch / Party Drink,Alcoholic,Collins Glass,"Simmer 3 cups water with, sugar, cloves, cinnamon sticks, and lemon peel in a stainless steel pot for 10 minutes. Add wine heat to a ""coffee temperature"" (DO NOT BOIL) then add the brandy.",https://www.thecocktaildb.com/images/media/drink/iuwi6h1504735724.jpg,Christmas,2017-09-06 23:08:44
178321,Amaretto fizz,Cocktail,Alcoholic,Collins glass,"Mix Amaretto, orange juice and sparkling wine in a jug. Add a strip orange zest to each glass, if you like.",https://www.thecocktaildb.com/images/media/drink/92h3jz1582474310.jpg,Christmas,
11013,Alaska Cocktail,Ordinary Drink,Alcoholic,Cocktail glass,"Stir all ingredients with ice, strain contents into a cocktail glass. Drop in a twist of lemon and serve.",https://www.thecocktaildb.com/images/media/drink/wsyryt1483387720.jpg,"Beach,Chilli",2017-01-02 20:08:40
12704,Limeade,Other / Unknown,Non alcoholic,Highball glass,"In a large glass, put the lime juice and sugar, and stir well. Add cold seltzer water to fill. Put the lime peels in the glass. Drink. Repeat until limes or soda run out.",https://www.thecocktaildb.com/images/media/drink/5jdp5r1487603680.jpg,,2017-02-20 15:14:40
13581,410 Gone,Ordinary Drink,Alcoholic,Collins Glass,Mix together and enjoy!,https://www.thecocktaildb.com/images/media/drink/xtuyqv1472669026.jpg,,2016-08-31 19:43:46
11020,Algonquin,Ordinary Drink,Alcoholic,Cocktail glass,"Combine and shake all ingredients with ice, strain contents into a cocktail glass, and serve.",https://www.thecocktaildb.com/images/media/drink/uwryxx1483387873.jpg,,2017-01-02 20:11:13
14622,Arctic Fish,Punch / Party Drink,Alcoholic,Beer pilsner,"Fill glass with ice and fish, add vodka, grape soda and orange juice. DO NOT STIR!!!!! Serve well chilled.",https://www.thecocktaildb.com/images/media/drink/ttsvwy1472668781.jpg,,2016-08-31 19:39:41
13625,Screaming Orgasm,Ordinary Drink,Alcoholic,Cocktail glass,"Pour first vodka, then Bailey's, then Kahlua into a cocktail glass over crushed ice. Stir. Caution: use only high quality vodka. Cheap vodka can cause the Bailey's to curdle. Test your brand of vodka by mixing 1 Tsp each of vodka and Bailey's first.",https://www.thecocktaildb.com/images/media/drink/x894cs1504388670.jpg,,2017-09-02 22:44:30
15521,Swedish Coffee,Coffee / Tea,Alcoholic,Coffee Mug,Pour the coffee in an ordinary coffee cup. Add the aquavit. Add sugar by taste. Stir and have a nice evening (morning),https://www.thecocktaildb.com/images/media/drink/ywtrvt1441246783.jpg,,2015-09-03 03:19:43
12864,Apple Cider Punch,Punch / Party Drink,Optional alcohol,Collins Glass,"If you use the whole all spice and cloves, tie them in cheesecloth. Heat the mixture. Stir occasionally. If you want an alcoholic drink, rum would be nice.",https://www.thecocktaildb.com/images/media/drink/xrqxuv1454513218.jpg,,2016-02-03 15:26:58
11124,Boomerang,Ordinary Drink,Alcoholic,Cocktail glass,"In a mixing glass half-filled with ice cubes, combine the gin, vermouth, bitters, and maraschino liqueur. Stir well. Strain into a cocktail glass and garnish with the cherry.",https://www.thecocktaildb.com/images/media/drink/3m6yz81504389551.jpg,,2017-09-02 22:59:12
13086,Atomic Lokade,Ordinary Drink,Alcoholic,Collins Glass,"In a shaker, place lemonade, vodka, blue Curacao, and triple sec together. Shake with ice and strain into glass. Add sugar to taste",https://www.thecocktaildb.com/images/media/drink/n3zfrh1493067412.jpg,,2017-04-24 21:56:52
12668,Egg Cream,Other / Unknown,Non alcoholic,Coffee mug,"Mix syrup and milk in a fountain glass. Add soda water, serve with a straw.",https://www.thecocktaildb.com/images/media/drink/mvis731484430445.jpg,,2017-01-14 21:47:26
17118,Arctic Mouthwash,Punch / Party Drink,Alcoholic,Cocktail glass,Blend all ingredients in a blender on high until ice is finely crushed. It should be of a slushy consistency. Pour immediately and serve.,https://www.thecocktaildb.com/images/media/drink/wqstwv1478963735.jpg,,2016-11-12 15:15:35
14374,Absolut Evergreen,Other / Unknown,Alcoholic,Collins Glass,"Mix, pour over ice and top up with Bitter Lemon.",https://www.thecocktaildb.com/images/media/drink/wrxrxp1472812609.jpg,,2016-09-02 11:36:49
12790,Absinthe #2,Homemade Liqueur,Alcoholic,Jar,"Mix together and let sit a few days. Strain through a coffee filter. To serve mix 1 part absinthe to 4 parts water, add ice, enjoy.",https://www.thecocktaildb.com/images/media/drink/uxxtrt1472667197.jpg,,2016-08-31 19:13:17
14560,A.D.M. (After Dinner Mint),Cocktail,Alcoholic,Irish coffee cup,shake vigorously,https://www.thecocktaildb.com/images/media/drink/ruxuvp1472669600.jpg,,2016-08-31 19:53:20
13198,Quick F**K,Shot,Alcoholic,Shot glass,"In a shot glass add 1/3 Kahlua first. Then 1/3 Miduri, topping it off with a 1/3 bailey's irish cream",https://www.thecocktaildb.com/images/media/drink/wvtwpp1478963454.jpg,,2016-11-12 15:10:54
11338,English Highball,Ordinary Drink,Alcoholic,Highball glass,"Pour brandy, gin, and sweet vermouth into a highball glass over ice cubes. Fill with carbonated water. Add the twist of lemon peel, stir, and serve. (Ginger ale may be substituted for carbonated water, if preferred.)",https://www.thecocktaildb.com/images/media/drink/dhvr7d1504519752.jpg,,2017-09-04 11:09:12
17209,Barracuda,Ordinary Drink,Alcoholic,Margarita glass,"Shake pour ingredients with ice. Strain into glass, top with Sparkling wine.",https://www.thecocktaildb.com/images/media/drink/jwmr1x1504372337.jpg,"IBA,NewEra",2017-09-02 18:12:17
13499,Oreo Mudslide,Ordinary Drink,Alcoholic,Collins Glass,"Blend Vodka, Kahlua, Bailey's, ice-cream and the Oreo well in a blender. Pour into a large frosted glass. Garnish with whipped cream and a cherry.",https://www.thecocktaildb.com/images/media/drink/tpwwut1468925017.jpg,,2016-07-19 11:43:37
17060,24k nightmare,Shot,Alcoholic,Shot glass,"Add over ice,shake and pour.",https://www.thecocktaildb.com/images/media/drink/yyrwty1468877498.jpg,,2016-07-18 22:31:38
17015,Irish Russian,Beer,Alcoholic,Highball glass,Add the ingredients in the order listed in the recipe. Care must be taken when adding the Guinness to prevent an excess of foam. Do Not add ice.,https://www.thecocktaildb.com/images/media/drink/swqurw1454512730.jpg,,2016-02-03 15:18:50
12214,Singapore Sling,Ordinary Drink,Alcoholic,Hurricane glass,Pour all ingredients into cocktail shaker filled with ice cubes. Shake well. Strain into highball glass. Garnish with pineapple and cocktail cherry.,https://www.thecocktaildb.com/images/media/drink/7dozeg1582578095.jpg,"IBA,ContemporaryClassic",2015-08-18 14:58:08
12910,Egg Nog #4,Punch / Party Drink,Optional alcohol,Punch bowl,"In a small mixer bowl beat egg yolks till blended. Gradually add 1/4 cup sugar, beating at high speed till thick and lemon colored. Stir in milk, stir in rum, bourbon, vanilla, and salt. Chill thoroughly. Whip cream. Wash beaters well. In a large mixer bowl beat egg whites till soft peaks form. Gradually add remaining 1/4 cup sugar, beating to stiff peaks. Fold yolk mixture and whipped cream into egg whites. Serve immediately. Sprinkle nutmeg over each serving. Serve in a punch bowl or another big bowl. NOTE: For a nonalcoholic eggnog, prepare Eggnog as above, except omit the bourbon and rum and increase the milk to 3 cups.",https://www.thecocktaildb.com/images/media/drink/wpspsy1468875747.jpg,,2016-07-18 22:02:27
178353,Apple Highball,Cocktail,Alcoholic,Highball glass,"Add ice in a highball glass. Rub a wedge of fresh lime around rim and place it in the glass. Add a shot of Apple schnapps, a shot of Courvoisier and top up with ginger ale.",https://www.thecocktaildb.com/images/media/drink/66mt9b1619695719.jpg,"Classy, Spicy",
178335,Lazy Coconut Paloma,Cocktail,Alcoholic,Highball glass,Mix the coconut liqueur (preferably tequila) with the grapefruit juice and top with soda water. Garnish with a large grapefruit slice against the inside of the glass.,https://www.thecocktaildb.com/images/media/drink/rytuex1598719770.jpg,"Lazy, Sharp",
15092,Pysch Vitamin Light,Ordinary Drink,Non alcoholic,Collins Glass,Shake with ice.,https://www.thecocktaildb.com/images/media/drink/xsqsxw1441553580.jpg,,2015-09-06 16:33:00
17135,Citrus Coke,Soft Drink,Alcoholic,Highball Glass,Pour half of coke in a glass. Then add Bacardi and top it off with the remaining coke. Stir and drink up!,https://www.thecocktaildb.com/images/media/drink/uyrvut1479473214.jpg,,2016-11-18 12:46:54
11019,Alfie Cocktail,Ordinary Drink,Alcoholic,Cocktail glass,"Combine and shake all ingredients with ice, strain into a cocktail glass, and serve.",https://www.thecocktaildb.com/images/media/drink/ypxsqy1483387829.jpg,Alcoholic,2017-01-02 20:10:29
12097,Rum Toddy,Ordinary Drink,Alcoholic,Old-fashioned glass,Dissolve powdered sugar in water in an old-fashioned glass. Add rum and one ice cube and stir. Add the twist of lemon peel and serve.,https://www.thecocktaildb.com/images/media/drink/athdk71504886286.jpg,,2017-09-08 16:58:06
17114,Ruby Tuesday,Cocktail,Alcoholic,Highball glass,Pour gin and cranberry into a highball filled with ice cubes. Add grenadine and stir.,https://www.thecocktaildb.com/images/media/drink/qsyqqq1441553437.jpg,,2015-09-06 16:30:37
17065,Caribbean Boilermaker,Beer,Alcoholic,Beer pilsner,Pour the Corona into an 18oz beer glass pour the rum into the beer.,https://www.thecocktaildb.com/images/media/drink/svsxsv1454511666.jpg,,2016-02-03 15:01:06
14181,Cafe Savoy,Coffee / Tea,Alcoholic,Coffee mug,"Fill mug almost to top with coffee.Add milk, triple sec and brandy. Stir.",https://www.thecocktaildb.com/images/media/drink/vqwptt1441247711.jpg,,2015-09-03 03:35:11
178331,Bounty Hunter,Cocktail,Alcoholic,Margarita glass,"Add the spirits into a shaker as well as the pineapple juice, strain into a Margarita glass. Top with Prosecco and garnish with Blueberries.",https://www.thecocktaildb.com/images/media/drink/t8bgxl1596018175.jpg,,
11391,Frozen Pineapple Daiquiri,Ordinary Drink,Alcoholic,Cocktail Glass,Combine all ingredients with 1 cup of crushed ice in an electric blender. Blend at a low speed for a short length of time. Pour into a cocktail glass and serve.,https://www.thecocktaildb.com/images/media/drink/k3aecd1582481679.jpg,,2017-09-06 23:14:57
17241,Zombie,Cocktail,Alcoholic,Hurricane glass,"Blend at high speed for no more than 5 seconds.

Pour into a glass, add ice cubes to fill, then add the garnish.

*Donn’s mix: Bring 3 crushed cinnamon sticks, 1 cup of sugar and 1 cup of water to a boil, stirring until the sugar is dissolved.

Simmer for 2 minutes, then remove from the heat and let sit for at least 2 hours before straining into a clean glass bottle.

Then add 1 part of the syrup and 2 parts of fresh grapefruit juice together.",https://www.thecocktaildb.com/images/media/drink/2en3jk1509557725.jpg,,2017-11-01 17:35:26
14608,Cream Soda,Cocktail,Alcoholic,Highball glass,Pour 1oz of Spiced Rum into a highball glass with ice. Fill with Ginger Ale.,https://www.thecocktaildb.com/images/media/drink/yqstxr1479209367.jpg,,2016-11-15 11:29:27
17188,Mary Pickford,Cocktail,Alcoholic,Cocktail glass,Shake and strain into a chilled large cocktail glass,https://www.thecocktaildb.com/images/media/drink/f9erqb1504350557.jpg,"IBA,Classic",2017-09-02 12:09:17
12656,Banana Strawberry Shake,Shake,Non alcoholic,Highball Glass,Blend all together in a blender until smooth.,https://www.thecocktaildb.com/images/media/drink/vqquwx1472720634.jpg,,2016-09-01 10:03:54
13162,Afternoon,Coffee / Tea,Alcoholic,Collins Glass,"Build into a suiting glass, with no ice. Cream on top if wanted. Served directly.",https://www.thecocktaildb.com/images/media/drink/vyrurp1472667777.jpg,,2016-08-31 19:22:57
17219,Yellow Bird,Cocktail,Alcoholic,Cocktail glass,Shake and strain into a chilled cocktail glass,https://www.thecocktaildb.com/images/media/drink/2t9r6w1504374811.jpg,"IBA,NewEra",2017-09-02 18:53:31
15511,Baby Eskimo,Shake,Alcoholic,Collins Glass,"Leave ice-cream out for about 10 minutes. Add ingredients in order, stir with chopstick (butter knife or spoon works too). Consume immediately and often. Nice and light, great for following a heavy drink.",https://www.thecocktaildb.com/images/media/drink/wywrtw1472720227.jpg,,2016-09-01 09:57:07
14752,Kiwi Lemon,Ordinary Drink,Alcoholic,Highball glass,Mix in highball glass. Stirr. Garnish with slice of kiwi.,https://www.thecocktaildb.com/images/media/drink/tpupvr1478251697.jpg,,2016-11-04 09:28:17
12316,Strawberry Daiquiri,Ordinary Drink,Alcoholic,Cocktail glass,Pour all ingredients into shaker with ice cubes. Shake well. Strain in chilled cocktail glass.,https://www.thecocktaildb.com/images/media/drink/deu59m1504736135.jpg,,2017-09-06 23:15:36
12564,Apple Karate,Cocktail,Non alcoholic,Highball Glass,"Place all ingredients in the blender jar - cover and whiz on medium speed until well blended. Pour in one tall, 2 medium or 3 small glasses and drink up.",https://www.thecocktaildb.com/images/media/drink/syusvw1468876634.jpg,,2016-07-18 22:17:14
17228,Addison,Cocktail,Alcoholic,Martini Glass,Shake together all the ingredients and strain into a cold glass.,https://www.thecocktaildb.com/images/media/drink/yzva7x1504820300.jpg,,2017-09-07 22:38:20
16942,Zipperhead,Shot,Alcoholic,Whiskey sour glass,"Fill glass with rocks, add straw before putting in liquor. Then add the ingredients in order, trying to keep layered as much as possible (i.e. Chambord on bottom, then Vodka, Then soda on top).",https://www.thecocktaildb.com/images/media/drink/r2qzhu1485620235.jpg,,2017-01-28 16:17:15
13683,Apple Slammer,Shot,Alcoholic,Shot glass,"pour into a shot glass and present to consumer, they are expected to cover the top of the shotglass with thier palm, raise the glass, slam it on the bar and the swallow quickly.",https://www.thecocktaildb.com/images/media/drink/09yd5f1493069852.jpg,,2017-04-24 22:37:32
11000,Mojito,Cocktail,Alcoholic,Highball glass,Muddle mint leaves with sugar and lime juice. Add a splash of soda water and fill the glass with cracked ice. Pour the rum and top with soda water. Garnish and serve with straw.,https://www.thecocktaildb.com/images/media/drink/metwgh1606770327.jpg,"IBA,ContemporaryClassic,Alcoholic,USA,Asia,Vegan,Citrus,Brunch,Hangover,Mild",2016-11-04 09:17:09
13032,Spiced Peach Punch,Punch / Party Drink,Non alcoholic,Collins Glass,"Combine peach nectar, orange juice and brown sugar in a large saucepan. Tie cinnamon and cloves in a small cheesecloth bag. Drop into saucepan. Heat slowly, stirring constantly, until sugar dissolves. Simmer 10 minutes. Stir in lime juice. Serve in hot mugs.",https://www.thecocktaildb.com/images/media/drink/qxvypq1468924331.jpg,,2016-07-19 11:32:11
178344,Figgy Thyme,Cocktail,Alcoholic,Highball glass,"In a lewis bag, crush up some ice like a baller/maniac (@glacioice). Pour your precious ice into a collins glass. In a cocktail shaker, muddle the figs and thyme together. Add honey vodka, lemon juice, and a large ice cube (@glacioice). Shake until well chilled, and strain into glass. Add tonic water and finally 2 dashes of angostura bitters. Garnish with sliced figs and thyme.",https://www.thecocktaildb.com/images/media/drink/pbw4e51606766578.jpg,"Christmas,Sweet",
17079,Baby Guinness,Shot,Alcoholic,Shot glass,"Pour Kahlua, almost filling shot glass. Then, carefully pour Baileys, using wall of shot glass. This will give the ""Guinness"" its ""head"".",https://www.thecocktaildb.com/images/media/drink/rvyvxs1473482359.jpg,,2016-09-10 05:39:19
12138,Scotch Cobbler,Ordinary Drink,Alcoholic,Old-fashioned glass,"Pour scotch, brandy, and curacao over ice in an old-fashioned glass. Add the orange slice, top with the mint sprig, and serve.",https://www.thecocktaildb.com/images/media/drink/1q7coh1504736227.jpg,,2017-09-06 23:17:07
13497,Green Goblin,Beer,Alcoholic,Pint glass,"Cider First, Lager then Curacao",https://www.thecocktaildb.com/images/media/drink/qxprxr1454511520.jpg,,2016-02-03 14:58:40
17838,Adonis Cocktail,Ordinary Drink,Alcoholic,Cocktail glass,"Stir all ingredients with ice, strain contents into a cocktail glass, and serve.",https://www.thecocktaildb.com/images/media/drink/xrvruq1472812030.jpg,,2016-09-02 11:27:11
15194,Amaretto Shake,Ordinary Drink,Alcoholic,Collins Glass,Combine all ingredients in a blender and blend at high speed until smooth. Serve in chilled glass garnished with bittersweet chocolate shavings.,https://www.thecocktaildb.com/images/media/drink/xk79al1493069655.jpg,,2017-04-24 22:34:16
17837,Adam,Ordinary Drink,Alcoholic,Cocktail glass,"In a shaker half-filled with ice cubes, combine all of the ingredients. Shake well. Strain into a cocktail glass.",https://www.thecocktaildb.com/images/media/drink/v0at4i1582478473.jpg,"Alcoholic,Holiday",2016-09-02 11:29:29
14978,Rum Punch,Punch / Party Drink,Alcoholic,Punch bowl,Mix all ingredients in a punch bowl and serve.,https://www.thecocktaildb.com/images/media/drink/wyrsxu1441554538.jpg,,2015-09-06 16:48:58
12196,Sidecar,Ordinary Drink,Alcoholic,Cocktail glass,Pour all ingredients into cocktail shaker filled with ice. Shake well and strain into cocktail glass.,https://www.thecocktaildb.com/images/media/drink/x72sik1606854964.jpg,"IBA,Classic",2015-08-18 15:07:32
11408,Gin Daisy,Ordinary Drink,Alcoholic,Old-fashioned glass,"In a shaker half-filled with ice cubes, combine the gin, lemon juice, sugar, and grenadine. Shake well. Pour into an old-fashioned glass and garnish with the cherry and the orange slice.",https://www.thecocktaildb.com/images/media/drink/z6e22f1582581155.jpg,,2016-11-10 23:19:04
12130,Scooter,Ordinary Drink,Alcoholic,Cocktail glass,"Shake all ingredients well with cracked ice, strain into a cocktail glass, and serve.",https://www.thecocktaildb.com/images/media/drink/twuptu1483388307.jpg,,2017-01-02 20:18:27
12460,Vodka And Tonic,Ordinary Drink,Alcoholic,Highball glass,"Pour vodka into a highball glass over ice cubes. Fill with tonic water, stir, and serve.",https://www.thecocktaildb.com/images/media/drink/lmj2yt1504820500.jpg,,2017-09-07 22:41:40
17226,Adam & Eve,Cocktail,Alcoholic,Cocktail glass,Shake together all the ingredients and strain into a cold glass.,https://www.thecocktaildb.com/images/media/drink/vfeumw1504819077.jpg,,2017-09-07 22:17:58
12658,Banana Strawberry Shake Daiquiri,Shake,Non alcoholic,Cocktail Glass,Blend all together in a blender until smooth.,https://www.thecocktaildb.com/images/media/drink/uvypss1472720581.jpg,,2016-09-01 10:03:01
178323,Passion Fruit Martini,Cocktail,Alcoholic,Cocktail glass,Pour all ingredients into a glass and stir. Garnish with half a passion fruit piece.,https://www.thecocktaildb.com/images/media/drink/6trfve1582473527.jpg,,
17217,Vampiro,Ordinary Drink,Alcoholic,Old-Fashioned glass,"Vampiros may be made in a tall glass or an old fashioned glass. Bartenders may first ""rim"" the glass with Kosher Salt, which is done by placing a layer of Kosher Salt on a chopping board, moistening the glass' rim with lime juice or water, and then placing the upside down glass rim onto the Kosher Salt, so that the salt sticks to the moistened rim. The second step is to fill half the glass with ice and add one or two shooter glasses full of high quality Tequila. The next stage is to add the flavouring elements. This is done by squeezing a fresh lime into the glass, adding a few grains of salt, adding citrus-flavoured soda pop, until the glass is 4/5 full, and then adding spicy Viuda de Sanchez (or orange juice, lime juice and pico de gallo). The final step is to stir the ingredients so that the flavours are properly blended.",https://www.thecocktaildb.com/images/media/drink/yfhn371504374246.jpg,"IBA,NewEra",2017-09-02 18:44:06
13501,ABC,Shot,Alcoholic,Shot glass,Layered in a shot glass.,https://www.thecocktaildb.com/images/media/drink/tqpvqp1472668328.jpg,,2016-08-31 19:32:08
13068,Brave Bull Shooter,Shot,Alcoholic,Shot glass,Pour Tabasco into bottom of shot glass and fill with tequila.,https://www.thecocktaildb.com/images/media/drink/yrtypx1473344625.jpg,,2016-09-08 15:23:45
178358,Mango Mojito,Cocktail,Alcoholic,Jar,"Squeeze the juice from 1½ limes and blend with the mango to give a smooth purée.
Cut the rest of the limes into quarters, and then cut each wedge in half again. Put 2 pieces of lime in a highball glass for each person and add 1 teaspoon of caster sugar and 5-6 mint leaves to each glass. Squish everything together with a muddler or the end of a rolling pin to release all the flavours from the lime and mint.
Divide the mango purée between the glasses and add 30ml white rum and a handful of crushed ice to each one, stirring well to mix everything together. Top up with soda water to serve and garnish with extra mint, if you like.",https://www.thecocktaildb.com/images/media/drink/wfqmgm1630406820.jpg,Fruity,
12744,Microwave Hot Cocoa,Cocoa,Non alcoholic,Coffee mug,"Combine sugar, cocoa, salt and hot water in 1-quart micro-proof measuring cup (or coffee mug). Microwave at HIGH (100%) for 1 to 1 1/2 minutes or until boiling. Add milk, sitr and microwave an additonal 1 1/2 to 2 minutes or until hot. Stir in vanilla, blend well.",https://www.thecocktaildb.com/images/media/drink/8y4x5f1487603151.jpg,,2017-02-20 15:05:51
16289,Apple Grande,Punch / Party Drink,Alcoholic,Punch Bowl,Chill both ingredients!! Mix in a tumbler and enjoy!,https://www.thecocktaildb.com/images/media/drink/wqrptx1472668622.jpg,,2016-08-31 19:37:02
17020,Auburn Headbanger,Shot,Alcoholic,Shot glass,Mix in spread glass over ice. Strain and pour in shot glass. Sit down before shotting. ENJOY!!,https://www.thecocktaildb.com/images/media/drink/vw7iv91493067320.jpg,,2017-04-24 21:55:20
13751,Cuba Libra,Ordinary Drink,Alcoholic,Highball glass,Fill tall glass with ice cubes. Add rum. Rub cut edge of lime on rim of glass then squeeze juice into glass. Fill with Coca-Cola. Garnish with lime slice. Enjoy!,https://www.thecocktaildb.com/images/media/drink/ck6d0p1504388696.jpg,,2017-09-02 22:44:56
178362,Vodka Slime,Cocktail,Alcoholic,Highball glass,"Fill glass with ice. Add vodka, 7-up then finish with the lime juice.",https://www.thecocktaildb.com/images/media/drink/apex461643588115.jpg,,
11205,California Lemonade,Ordinary Drink,Alcoholic,Collins glass,Shake all ingredients (except carbonated water) with ice and strain into a collins glass over shaved ice. Fill with carbonated water and stir. Decorate with slices of orange and lemon. Add the cherry and serve with a straw.,https://www.thecocktaildb.com/images/media/drink/q5z4841582484168.jpg,,2016-08-28 18:47:04
12786,Thai Iced Tea,Coffee / Tea,Non alcoholic,Highball glass,"Combine Thai tea (i.e., the powder), boiling water, and sweetened condensed milk, stir until blended. Pour into 2 tall glasses filled with ice cubes. Garnish with mint leaves. Makes 2 servings.",https://www.thecocktaildb.com/images/media/drink/trvwpu1441245568.jpg,,2015-09-03 02:59:28
15615,Chocolate Monkey,Shake,Optional alcohol,Parfait glass,"blend liqeuors with ice-cream, milk and syrup. pour into parfait glass, top with whipped cream and garnish with banana and cherry.",https://www.thecocktaildb.com/images/media/drink/tyvpxt1468875212.jpg,,2016-07-18 21:53:32
11016,Brandy Alexander,Ordinary Drink,Alcoholic,Whiskey Glass,Shake all ingredients (except nutmeg) with ice and strain contents into a cocktail glass. Sprinkle nutmeg on top and serve.,https://www.thecocktaildb.com/images/media/drink/mlyk1i1606772340.jpg,"Nutty,Dairy",2017-01-02 20:09:06
13026,Sangria The  Best,Punch / Party Drink,Alcoholic,Pitcher,"Mix wine, sugar and fruit, and let sit in the fridge for 18-24 hours. The mixture will have a somewhat syrupy consistency. Before serving stir in brandy and cut the mixture with soda water until it have a thinner, more wine like consistency. Serve from a pitcher in wine glasses.",https://www.thecocktaildb.com/images/media/drink/vysywu1468924264.jpg,,2016-07-19 11:31:04
14167,Vodka Martini,Ordinary Drink,Alcoholic,Cocktail glass,"Shake the vodka and vermouth together with a number of ice cubes, strain into a cocktail glass, add the olive and serve.",https://www.thecocktaildb.com/images/media/drink/qyxrqw1439906528.jpg,,2015-08-18 15:02:08
178342,Gin and Soda,Cocktail,Alcoholic,Highball glass,"Pour the Gin and Soda water into a highball glass almost filled with ice cubes.
Stir well.
Garnish with the lime wedge.",https://www.thecocktaildb.com/images/media/drink/nzlyc81605905755.jpg,"Clear,Alcoholic",
11728,Martini,Cocktail,Alcoholic,Cocktail glass,"Straight: Pour all ingredients into mixing glass with ice cubes. Stir well. Strain in chilled martini cocktail glass. Squeeze oil from lemon peel onto the drink, or garnish with olive.",https://www.thecocktaildb.com/images/media/drink/71t8581504353095.jpg,,2017-09-02 12:51:35
11007,Margarita,Ordinary Drink,Alcoholic,Cocktail glass,"Rub the rim of the glass with the lime slice to make the salt stick to it. Take care to moisten only the outer rim and sprinkle the salt on it. The salt should present to the lips of the imbiber and never mix into the cocktail. Shake the other ingredients with ice, then carefully pour into the glass.",https://www.thecocktaildb.com/images/media/drink/5noda61589575158.jpg,"IBA,ContemporaryClassic",2015-08-18 14:42:59
