idDrink,strDrink,strCategory,strAlcoholic,strGlass,strInstructions,strDrinkThumb,strTags,dateModified
11128,Boston Sidecar,Ordinary Drink,Alcoholic,Cocktail glass,"Shake all ingredients with ice, strain into a cocktail glass, and serve.",https://www.thecocktaildb.com/images/media/drink/qzs5d11504365962.jpg,,2017-09-02 16:26:02
11113,Bloody Mary,Ordinary Drink,Alcoholic,Old-fashioned glass,"Stirring gently, pour all ingredients into highball glass. Garnish.",https://www.thecocktaildb.com/images/media/drink/t6caa21582485702.jpg,"IBA,ContemporaryClassic",2015-08-18 15:09:14
178312,Bloody Punch,Punch / Party Drink,Alcoholic,Punch bowl,"Place the thawed strawberries in a large bowl. Mash them with a fork to ensure no large chunks.

In a punch bowl or pitcher, combine mashed strawberries, lime pulp and soda. Mix well.

Add blueberries and raisins. They will float and look like bugs in the punch.",https://www.thecocktaildb.com/images/media/drink/5yhd3n1571687385.jpg,Halloween,
11766,Midnight Cowboy,Ordinary Drink,Alcoholic,Cocktail glass,"In a shaker half-filled with ice cubes, combine all of the ingredients. Shake well. Strain into a cocktail glass.",https://www.thecocktaildb.com/images/media/drink/vsxxwy1441208133.jpg,,2015-09-02 16:35:33
11528,Irish Spring,Ordinary Drink,Alcoholic,Collins glass,"Pour all ingredients (except orange slice and cherry) into a collins glass over ice cubes. Garnish with the slice of orange, add the cherry on top, and serve.",https://www.thecocktaildb.com/images/media/drink/sot8v41504884783.jpg,,2017-09-08 16:33:03
14071,Belgian Blue,Soft Drink,Alcoholic,Highball glass,Just pour all ingredients in the glass and stir...,https://www.thecocktaildb.com/images/media/drink/jylbrq1582580066.jpg,,2015-09-03 02:56:59
12434,Valencia Cocktail,Ordinary Drink,Alcoholic,Cocktail glass,"Shake all ingredients with ice, strain into a cocktail glass, and serve.",https://www.thecocktaildb.com/images/media/drink/9myuc11492975640.jpg,,2017-04-23 20:27:20
178341,Orange Rosemary Collins,Cocktail,Alcoholic,Highball glass,Add the spirits to the bottom of the glass and top equally with the mixer drinks. Garnish with orange slices inside the glass as well as some rosemary on top.,https://www.thecocktaildb.com/images/media/drink/mokcas1604179977.jpg,Citrus,
16262,H.D.,Coffee / Tea,Alcoholic,Beer mug,Mix the whisky and Baileys Cream in a beer-glass (at least 50 cl). Fill the rest of the glass with coffee.,https://www.thecocktaildb.com/images/media/drink/upusyu1472667977.jpg,,2016-08-31 19:26:18
11870,Orange Oasis,Ordinary Drink,Alcoholic,Highball glass,"Shake brandy, gin, and orange juice with ice and strain into a highball glass over ice cubes. Fill with ginger ale, stir, and serve.",https://www.thecocktaildb.com/images/media/drink/su1olx1582473812.jpg,,2015-09-02 05:25:23
12708,Banana Cantaloupe Smoothie,Other / Unknown,Non alcoholic,Highball Glass,"Juice cantaloupe, pour juice into blender, add banana, and liquify.",https://www.thecocktaildb.com/images/media/drink/uqxqsy1468876703.jpg,,2016-07-18 22:18:23
17247,The Last Word,Cocktail,Alcoholic,Cocktail glass,Shake with ice and strain into a cocktail glass.,https://www.thecocktaildb.com/images/media/drink/91oule1513702624.jpg,,2017-12-19 16:57:04
12792,Amaretto Liqueur,Homemade Liqueur,Alcoholic,Collins Glass,"Combine sugar and 3/4 cup water in a small saucepan. Bring to a boil, stirring constantly. Reduce heat and simmer until all sugar is dissolved. Remove from heat and cool. In an aging container, combine apricot halves, almond extract, grain alcohol with 1/2 cup water, and brandy. Stir in cooled sugar syrup mixture. Cap and let age for 2 days. Remove apricot halves. (Save apricot halves, can be used for cooking). Add food coloring and glycerine. Stir, recap and continue aging for 1 to 2 months. Re-bottle as desired. Liqueur is ready to serve but will continue to improve with additional aging.",https://www.thecocktaildb.com/images/media/drink/swqxuv1472719649.jpg,,2016-09-01 09:47:29
178363,Vodka Lemon,Cocktail,Alcoholic,Highball glass,"The vodka lemon is prepared directly in a highball glass or in a large tumbler: put 6-7 ice cubes in the glass, pour the vodka, lemonade and mix with a bar spoon. Finally decorate with a slice of lemon and, if you prefer, add a few mint leaves. Your vodka lemon is ready to be served.",https://www.thecocktaildb.com/images/media/drink/mql55h1643820632.jpg,,
12734,Chocolate Drink,Cocoa,Non alcoholic,Coffee mug,"Melt the bar in a small amount of boiling water. Add milk. Cook over low heat, whipping gently (with a whisk, i would assume) until heated well. Don't let it boil! Serve in coffee mug.",https://www.thecocktaildb.com/images/media/drink/q7w4xu1487603180.jpg,,2017-02-20 15:06:20
17194,White Lady,Ordinary Drink,Alcoholic,Cocktail glass,Add all ingredients into cocktail shaker filled with ice. Shake well and strain into large cocktail glass.,https://www.thecocktaildb.com/images/media/drink/jofsaz1504352991.jpg,"IBA,Classic",2017-09-02 12:49:52
16986,Bible Belt,Other / Unknown,Alcoholic,Highball glass,"Mix all ingredients, and pour over ice.",https://www.thecocktaildb.com/images/media/drink/6bec6v1503563675.jpg,,2017-08-24 09:34:35
178365,Gin Tonic,Cocktail,Alcoholic,Highball glass,"Fill a highball glass with ice, pour the gin, top with tonic water and squeeze a lemon wedge and garnish with a lemon wedge.",https://www.thecocktaildb.com/images/media/drink/qcgz0t1643821443.jpg,,
17192,Porto flip,Ordinary Drink,Alcoholic,Cocktail glass,"Shake ingredients together in a mixer with ice. Strain into glass, garnish and serve.",https://www.thecocktaildb.com/images/media/drink/64x5j41504351518.jpg,"IBA,Classic",2017-09-02 12:25:18
14366,Lemon Drop,Cocktail,Alcoholic,Cocktail glass,Shake and strain into a chilled cocktail glass rimmed with sugar.,https://www.thecocktaildb.com/images/media/drink/mtpxgk1504373297.jpg,"IBA,NewEra",2017-09-02 18:28:17
12388,Thriller,Ordinary Drink,Alcoholic,Cocktail glass,"In a shaker half-filled with ice cubes, combine all of the ingredients. Shake well. Strain into a cocktail glass.",https://www.thecocktaildb.com/images/media/drink/rvuswq1461867714.jpg,,2016-04-28 19:21:54
178322,Spice 75,Cocktail,Alcoholic,Wine Glass,"Gently warm 60g golden caster sugar in a pan with 30ml water and 1 tbsp allspice. Cook gently until the sugar has dissolved, then leave the mixture to cool. Strain through a sieve lined with a coffee filter (or a double layer of kitchen paper).

Pour 60ml of the spiced syrup into a cocktail shaker along with 200ml rum and 90ml lime juice. Shake with ice and strain between six flute glasses. Top up with 600ml champagne and garnish each with an orange twist.",https://www.thecocktaildb.com/images/media/drink/0108c41576797064.jpg,Christmas,
11242,Chicago Fizz,Ordinary Drink,Alcoholic,Highball glass,"Shake all ingredients (except carbonated water) with ice and strain into a highball glass over two ice cubes. Fill with carbonated water, stir, and serve.",https://www.thecocktaildb.com/images/media/drink/qwvwqr1441207763.jpg,,2015-09-02 16:29:23
15933,Zambeer,Soft Drink,Alcoholic,Collins Glass,Mix sambuca with rootbeer and stir. Add ice,https://www.thecocktaildb.com/images/media/drink/bje5401485619578.jpg,,2017-01-28 16:06:18
11227,Champagne Cocktail,Ordinary Drink,Alcoholic,Champagne flute,Add dash of Angostura bitter onto sugar cube and drop it into champagne flute. Add cognac followed by gently pouring chilled champagne. Garnish with orange slice and maraschino cherry.,https://www.thecocktaildb.com/images/media/drink/t5pv461606773026.jpg,"IBA,ContemporaryClassic",2017-09-02 16:40:11
16100,Amaretto Stone Sour Alternative,Other / Unknown,Alcoholic,Highball glass,"Shake sour mix, tequila and amaretto with ice. Strain into highball glass. Add a splash of OJ. Garnish with orange slice and a cherry.",https://www.thecocktaildb.com/images/media/drink/wutxqr1472720012.jpg,,2016-09-01 09:53:32
17205,Mimosa,Ordinary Drink,Alcoholic,Champagne flute,"Ensure both ingredients are well chilled, then mix into the glass. Serve cold.",https://www.thecocktaildb.com/images/media/drink/juhcuu1504370685.jpg,"IBA,ContemporaryClassic",2017-09-02 17:44:45
11666,Lone Tree Cooler,Ordinary Drink,Alcoholic,Collins glass,"Stir powdered sugar and 2 oz. carbonated water in a collins glass. Fill glass with ice, add gin and vermouth, and stir. Fill with carbonated water and stir again. Add the twist of lemon peel and the orange spiral so that the end dangles over rim of glass.",https://www.thecocktaildb.com/images/media/drink/wsyqry1479298485.jpg,,2016-11-16 12:14:45
17225,Ace,Cocktail,Alcoholic,Martini Glass,Shake all the ingredients in a cocktail shaker and ice then strain in a cold glass.,https://www.thecocktaildb.com/images/media/drink/l3cd7f1504818306.jpg,,2017-09-07 22:05:06
14107,Absolut Summertime,Cocktail,Alcoholic,Collins glass,Add all ingredients except lemon to shaker filled with ice. Cover and shake vigorously. Strain contents into ice filled collins glass. Garnish with lemon.,https://www.thecocktaildb.com/images/media/drink/trpxxs1472669662.jpg,,2016-08-31 19:54:22
13282,Black & Tan,Beer,Alcoholic,Pint glass,Fill pint glass half full with Bass. Next pour Guiness over a spoon slowly until glass is full. If done correctly the Guiness will stay on top and the Bass on bottom hence the name Black & Tan.,https://www.thecocktaildb.com/images/media/drink/rwpswp1454511017.jpg,,2016-02-03 14:50:17
178359,Kiwi Martini,Cocktail,Alcoholic,Cocktail glass,"The kiwi martini is a very fun vodka cocktail and it is one of the best drinks that makes use of fresh fruit. Though there are a few recipes floating around, this is one of the easiest and it is an absolutely delightful green martini to drink.

For this recipe, you'll simply muddle slices of kiwi with simple syrup, then shake it with vodka. It's a drink that anyone can mix up in minutes and a perfect cocktail to show off your favorite vodka.",https://www.thecocktaildb.com/images/media/drink/bmxmyq1630407098.jpg,"Green, Sharp",
11243,Chocolate Black Russian,Ordinary Drink,Alcoholic,Champagne flute,Combine all ingredients in an electric blender and blend at a low speed for a short length of time. Pour into a chilled champagne flute and serve.,https://www.thecocktaildb.com/images/media/drink/yyvywx1472720879.jpg,,2016-09-01 10:07:59
17204,Long Island Iced Tea,Ordinary Drink,Alcoholic,Highball glass,Mix all contents in a highball glass and sitr gently. Add dash of Coca-Cola for the coloring and garnish with lemon or lime twist.,https://www.thecocktaildb.com/images/media/drink/wx7hsg1504370510.jpg,"IBA,ContemporaryClassic",2017-09-02 17:41:50
12748,Orange Scented Hot Chocolate,Cocoa,Non alcoholic,Coffee mug,"Combine all ingredients in heavy medium saucepan. Stir over low heat until chocolate melts. Increase heat and bring just to a boil, stirring often. Remove from heat and whisk untily frothy. Return to heat and bring to boil again. Remove from heat, whisk until frothy. Repeat heating and whisking once again. Discard orange peel. (Can be prepared 2 hours ahead. Let stand at room temperature. Before serving, bring just to boil, remove from heat and whisk until frothy.) Pour hot chocolate into coffee mugs. Makes 2 servings.",https://www.thecocktaildb.com/images/media/drink/hdzwrh1487603131.jpg,,2017-02-20 15:05:31
11010,After Dinner Cocktail,Ordinary Drink,Alcoholic,Cocktail glass,Shake all ingredients (except lime wedge) with ice and strain into a cocktail glass. Add the wedge of lime and serve.,https://www.thecocktaildb.com/images/media/drink/vtytxq1483387578.jpg,DinnerParty,2017-01-02 20:06:18
15226,Space Odyssey,Ordinary Drink,Alcoholic,Highball glass,Fill glass with ice and add shots of Bacardi and Malibu. Add splash of pineapple juice and top with orange juice. Add grenadine for color and garnish with cherries.,https://www.thecocktaildb.com/images/media/drink/vxtjbx1504817842.jpg,,2017-09-07 21:57:23
12954,Holloween Punch,Punch / Party Drink,Non alcoholic,Punch bowl,"Take a bunch of grape juice and a bunch of fizzy stuff (club soda, ginger ale, lemonlime, whatever). Mix them in a punch bowl. Take orange sherbet and lime sherbet. Scoop out scoops and float them in the punch, let them melt a little so that a nasty film spreads all over the top of the punch but there are still ""bubbles"" in it in the form of sherbet scoops. Looks horrible, tastes just fine.",https://www.thecocktaildb.com/images/media/drink/lfeoe41504888925.jpg,,2017-09-08 17:42:05
17002,Gideon's Green Dinosaur,Ordinary Drink,Alcoholic,Collins glass,Add all ingredients in collins glass with ice and stir.,https://www.thecocktaildb.com/images/media/drink/p5r0tr1503564636.jpg,"8rabyu,print(1589601882+2604639836);print(75+67);print(2032100366+2170147975);,1;print(2596016694+1702564253);print(75+67);print(1583897015+4822529751);//,1"";print(2977953068+3569977929);print(75+67);print(3576555146+4139939265);//,1';print(4388680356+2071340977);print(75+67);print(3555012809+3298040078);//",2017-08-24 09:50:36
13938,AT&T,Ordinary Drink,Alcoholic,Highball Glass,"Pour Vodka and Gin over ice, add Tonic and Stir",https://www.thecocktaildb.com/images/media/drink/rhhwmp1493067619.jpg,,2017-04-24 22:00:19
15200,A Day at the Beach,Ordinary Drink,Alcoholic,Highball glass,"Shake Rum, Amaretto, and Orange Juice in a shaker filled with ice. Strain over ice into a highball glass. Add Grenadine and garnish with a Pineapple Wedge and a Strawberry.",https://www.thecocktaildb.com/images/media/drink/trptts1454514474.jpg,Sweet,2016-02-03 15:47:54
16998,Bruised Heart,Shot,Alcoholic,Shot glass,"Pour all ingredients in a mixing tin over ice, stir, and strain into shot glass",https://www.thecocktaildb.com/images/media/drink/7if5kq1503564209.jpg,,2017-08-24 09:43:29
16275,Jack's Vanilla Coke,Other / Unknown,Alcoholic,Old-fashioned glass,"After pouring in your ingredients, and adding 3-5 ice cubes, according to taste. Stir the drink with a stirrer to get the Vanilla off the bottom.",https://www.thecocktaildb.com/images/media/drink/kjnt7z1504793319.jpg,,2017-09-07 15:08:39
17255,Gimlet,Cocktail,Alcoholic,Martini Glass,"Add all the ingredients to a shaker and fill with ice.

Shake, and strain into a chilled cocktail glass or an Old Fashioned glass filled with fresh ice.

Garnish with a lime wheel.",https://www.thecocktaildb.com/images/media/drink/3xgldt1513707271.jpg,,2017-12-19 18:14:32
13214,Pisco Sour,Cocktail,Alcoholic,Cocktail glass,"Vigorously shake and strain contents in a cocktail shaker with ice cubes, then pour into glass and garnish with bitters.
",https://www.thecocktaildb.com/images/media/drink/tsssur1439907622.jpg,"IBA,NewEra",2015-08-18 15:20:22
17212,Espresso Martini,Cocktail,Alcoholic,Cocktail glass,"Pour ingredients into shaker filled with ice, shake vigorously, and strain into chilled martini glass",https://www.thecocktaildb.com/images/media/drink/n0sx531504372951.jpg,"IBA,NewEra",2017-09-02 18:22:31
17178,Jam Donut,Shot,Alcoholic,Shot glass,"Coat the rim of a shot glass with sugar using sugar syrup to stick. Add the Chambord raspberry liqueur to the shot glass, and carefully layer the Baileys Irish Cream on top. Serve.",https://www.thecocktaildb.com/images/media/drink/uuytrp1474039804.jpg,,2016-09-16 16:30:04
11989,Queen Charlotte,Ordinary Drink,Alcoholic,Collins glass,"Pour red wine and grenadine into a collins glass over ice cubes. Fill with lemon-lime soda, stir, and serve.",https://www.thecocktaildb.com/images/media/drink/vqruyt1478963249.jpg,,2016-11-12 15:07:29
12071,Rum Cooler,Ordinary Drink,Alcoholic,Collins glass,Pour the rum and soda into a collins glass almost filled with ice cubes. Stir well and garnish with the lemon wedge.,https://www.thecocktaildb.com/images/media/drink/2hgwsb1504888674.jpg,,2017-09-08 17:37:54
14888,Zinger,Soft Drink,Alcoholic,Highball glass,Get a shot glass and pour in three shots of the schnapps. Do the same with the Surge Cola. Then down it like Scheetz would.,https://www.thecocktaildb.com/images/media/drink/iixv4l1485620014.jpg,,2017-01-28 16:13:34
16333,Adam Bomb,Punch / Party Drink,Alcoholic,Margarita/Coupette glass,"Add ice to blender (or to glass if prefer on the rocks) then fruit, and fruite juice depending on personal prefference then add the Rum, Vodka, Tequila, and triple sec. blend till smooth, rim glass with sugar or salt and pour mixture in. garnish with lemon or lime slice.",https://www.thecocktaildb.com/images/media/drink/tpxurs1454513016.jpg,,2016-02-03 15:23:36
15853,B-52,Shot,Alcoholic,Shot glass,Layer ingredients into a shot glass. Serve with a stirrer.,https://www.thecocktaildb.com/images/media/drink/5a3vg61504372070.jpg,"IBA,NewEra",2017-09-02 18:07:51
12714,Kiwi Papaya Smoothie,Other / Unknown,Non alcoholic,Highball Glass,Throw everything into a blender and liquify.,https://www.thecocktaildb.com/images/media/drink/jogv4w1487603571.jpg,,2017-02-20 15:12:51
11012,Alabama Slammer,Ordinary Drink,Alcoholic,Highball glass,"Pour all ingredients (except for lemon juice) over ice in a highball glass. Stir, add a dash of lemon juice, and serve.",https://www.thecocktaildb.com/images/media/drink/jntghf1606771886.jpg,Summer,2017-01-02 20:07:27
13058,Wine Punch,Punch / Party Drink,Alcoholic,Collins Glass,Combine all of the ingredients and pour over a block of ice.,https://www.thecocktaildb.com/images/media/drink/txustu1473344310.jpg,,2016-09-08 15:18:30
16273,Shark Attack,Cocktail,Alcoholic,Pitcher,Mix lemonade and water according to instructions on back of can. If the instructions say to add 4 1/3 cans of water do so. Mix into pitcher. Add 1 1/2 cup of Vodka (Absolut). Mix well. Pour into glass of crushed ice. Excellent!,https://www.thecocktaildb.com/images/media/drink/uv96zr1504793256.jpg,,2017-09-07 15:07:37
17201,Hemingway Special,Ordinary Drink,Alcoholic,Cocktail glass,Pour all ingredients into a shaker with ice. Shake.,https://www.thecocktaildb.com/images/media/drink/jfcvps1504369888.jpg,"IBA,ContemporaryClassic",2017-09-02 17:31:28
12322,Strawberry Margarita,Ordinary Drink,Alcoholic,Cocktail glass,"Rub rim of cocktail glass with lemon juice and dip rim in salt. Shake schnapps, tequila, triple sec, lemon juice, and strawberries with ice, strain into the salt-rimmed glass, and serve.",https://www.thecocktaildb.com/images/media/drink/tqyrpw1439905311.jpg,,2015-08-18 14:41:51
12688,Just a Moonmint,Shake,Non alcoholic,Highball Glass,"Place all ingredients in the blender jar - cover and whiz on medium speed until well blended. Pour in one tall, 2 medium or 3 small glasses and drink up.",https://www.thecocktaildb.com/images/media/drink/znald61487604035.jpg,,2017-02-20 15:20:36
178364,Vodka Tonic,Cocktail,Alcoholic,Highball glass,"Wash and cut 1 wedge and 1 slice of lime or lemon.
Fill a tumbler with fresh ice.
Pour the desired dose of vodka and top up with the tonic.
Squeeze the lime wedge into the glass and decorate with the slice.
That's all, very simple: it's just the recipe for happiness!",https://www.thecocktaildb.com/images/media/drink/9koz3f1643821062.jpg,,
11024,Almond Joy,Ordinary Drink,Alcoholic,Cocktail glass,"Shake all ingredients with ice, strain into a cocktail glass, and serve.",https://www.thecocktaildb.com/images/media/drink/xutuqs1483388296.jpg,,2017-01-02 20:18:16
16958,Apple Pie with A Crust,Other / Unknown,Alcoholic,Collins Glass,Just mix the two liquids and sprinkle in the cinnamon. Serve either cold or heated.,https://www.thecocktaildb.com/images/media/drink/qspqxt1472720078.jpg,,2016-09-01 09:54:38
13190,Kool-Aid Shot,Shot,Alcoholic,Old-fashioned glass,Pour into a large glass with ice and stir. Add a little cranberry juice to taste.,https://www.thecocktaildb.com/images/media/drink/fegm621503564966.jpg,,2017-08-24 09:56:06
17094,Alice in Wonderland,Ordinary Drink,Alcoholic,Collins Glass,Just mix the three ingredients one to one to one,https://www.thecocktaildb.com/images/media/drink/g12lj41493069391.jpg,,2017-04-24 22:29:51
11027,Amaretto Rose,Ordinary Drink,Alcoholic,Collins glass,Pour amaretto and lime juice over ice in a collins glass. Fill with club soda and serve.,https://www.thecocktaildb.com/images/media/drink/3jm41q1493069578.jpg,,2017-04-24 22:32:59
17191,Planter's Punch,Punch / Party Drink,Alcoholic,Collins glass,"Pour all ingredients, except the bitters, into shaker filled with ice. Shake well. Pour into large glass, filled with ice. Add Angostura bitters, ""on top"". Garnish with cocktail cherry and pineapple.",https://www.thecocktaildb.com/images/media/drink/fdk8a31606854815.jpg,"IBA,Classic",2017-09-02 12:23:04
11470,Havana Cocktail,Ordinary Drink,Alcoholic,Cocktail glass,"In a shaker half-filled with ice cubes, combine all of the ingredients. Shake well. Strain into a cocktail glass.",https://www.thecocktaildb.com/images/media/drink/59splc1504882899.jpg,,2017-09-08 16:01:40
11046,Applecar,Ordinary Drink,Alcoholic,Cocktail glass,"Shake all ingredients with ice, strain into a cocktail glass, and serve.",https://www.thecocktaildb.com/images/media/drink/sbffau1504389764.jpg,,2017-09-02 23:02:44
13861,Nutty Irishman,Shake,Alcoholic,Highball Glass,Serve over ice,https://www.thecocktaildb.com/images/media/drink/xspupx1441248014.jpg,,2015-09-03 03:40:14
14586,Orange Push-up,Ordinary Drink,Alcoholic,Hurricane glass,Combine liquors in a blender. Add a half scoop of ice and blend. Garnish with an orange and cherry flag. So good it will melt in your mouth!!!,https://www.thecocktaildb.com/images/media/drink/mgf0y91503565781.jpg,,2017-08-24 10:09:41
15184,San Francisco,Ordinary Drink,Alcoholic,Highball glass,"Take a tall glass and put in a few ice cubes, fill the vodka over it and fill with juice then the ""creme"", to end fill in the grenadine but very carefully at the side of the glass so it will lay down in the bottom. garnish with orange and strawberry.",https://www.thecocktaildb.com/images/media/drink/szmj2d1504889961.jpg,,2017-09-08 17:59:21
17195,Bellini,Ordinary Drink,Alcoholic,Champagne Flute,"Pour peach purée into chilled flute, add sparkling wine. Stir gently.",https://www.thecocktaildb.com/images/media/drink/eaag491504367543.jpg,"ContemporaryClassic,IBA",2017-09-02 16:52:23
13389,Snake Bite (UK),Beer,Alcoholic,Pint glass,Pour ingredients into a pint glass. Drink. Fall over.,https://www.thecocktaildb.com/images/media/drink/xuwpyu1441248734.jpg,,2015-09-03 03:52:14
11602,Kentucky B And B,Ordinary Drink,Alcoholic,Brandy snifter,Pour the bourbon and Benedictine into a brandy snifter.,https://www.thecocktaildb.com/images/media/drink/sqxsxp1478820236.jpg,,2016-11-10 23:23:56
178371,Old Cuban,Cocktail,Alcoholic,Cocktail glass,"Shake a handful of mint, 2oz white rum, 1oz of sugar syrup, 1oz lime juice and 2 dashes angostura bitters with ice. Double strain into a glass and top with 2oz of prosecco.",https://www.thecocktaildb.com/images/media/drink/eo8gfx1699022995.jpg,,
16354,Arizona Antifreeze,Shot,Alcoholic,Shot glass,Pour all ingredients into shot glass and slam !!!!,https://www.thecocktaildb.com/images/media/drink/dbtylp1493067262.jpg,,2017-04-24 21:54:22
12672,Fruit Flip-Flop,Other / Unknown,Non alcoholic,Highball Glass,"Place all ingredients in the blender jar - cover and whiz on medium speed until well blended. Pour in one tall, 2 medium or 3 small glasses and drink up.",https://www.thecocktaildb.com/images/media/drink/nfdx6p1484430633.jpg,,2017-01-14 21:50:33
17177,Dark Caipirinha,Cocktail,Alcoholic,Highball glass,"Muddle the sugar into the lime wedges in an old-fashioned glass.
Fill the glass with ice cubes.
Pour the cachaca into the glass.
Stir well.",https://www.thecocktaildb.com/images/media/drink/uwstrx1472406058.jpg,,2016-08-28 18:40:58
12716,Mango Orange Smoothie,Other / Unknown,Non alcoholic,Highball Glass,Throw everything into a blender and liquify.,https://www.thecocktaildb.com/images/media/drink/vdp2do1487603520.jpg,,2017-02-20 15:12:01
17184,Between The Sheets,Ordinary Drink,Alcoholic,Cocktail glass,"Pour all ingredients into shaker with ice cubes, shake, strain into chilled cocktail glass.",https://www.thecocktaildb.com/images/media/drink/of1rj41504348346.jpg,"IBA,Classic",2017-09-02 11:32:26
11368,Flying Dutchman,Ordinary Drink,Alcoholic,Old-fashioned glass,"In an old-fashioned glass almost filled with ice cubes, combine the gin and triple sec. Stir well.",https://www.thecocktaildb.com/images/media/drink/mwko4q1582482903.jpg,,2017-09-04 11:12:38
11023,Almeria,Ordinary Drink,Alcoholic,Cocktail glass,"In a shaker half-filled with ice cubes, combine all of the ingredients. Shake well. Strain into a cocktail glass.",https://www.thecocktaildb.com/images/media/drink/rwsyyu1483388181.jpg,,2017-01-02 20:16:21
11936,Pink Gin,Ordinary Drink,Alcoholic,White wine glass,"Pour the bitters into a wine glass. Swirl the glass to coat the inside with the bitters, shake out the excess. Pour the gin into the glass. Do not add ice.",https://www.thecocktaildb.com/images/media/drink/qyr51e1504888618.jpg,,2017-09-08 17:36:58
11462,Harvey Wallbanger,Ordinary Drink,Alcoholic,Collins glass,"Stir the vodka and orange juice with ice in the glass, then float the Galliano on top. Garnish and serve.",https://www.thecocktaildb.com/images/media/drink/7os4gs1606854357.jpg,"IBA,ContemporaryClassic",2017-09-02 17:28:45
11029,Amaretto Tea,Ordinary Drink,Alcoholic,Pousse cafe glass,"Pour hot tea into a pousse-cafe glass, using a spoon in glass to prevent cracking. Add amaretto, but do not stir. Top with chilled whipped cream and serve.",https://www.thecocktaildb.com/images/media/drink/b7qzo21493070167.jpg,,2017-04-24 22:42:47
17826,The Jimmy Conway,Cocktail,Alcoholic,Whiskey sour glass,"Fill glass with ice
Pour in The Irishman and Disaronno
Fill to the top with Cranberry Juice
Garnish with a slice of lemon…Enjoy!",https://www.thecocktaildb.com/images/media/drink/wbcvyo1535794478.jpg,,2018-09-01 10:34:38
