name,category,amazon_link,total_mentions,subreddit_mentions
"Kidde FA110 Multi Purpose Fire Extinguisher 1A10BC, 1 Pack",Home & Kitchen,https://www.amazon.com/Kidde-FA110-Purpose-Extinguisher-1A10BC/dp/B00002ND64/ref=sr_1_3?s=home-garden&amp;ie=UTF8&amp;qid=1480980182&amp;sr=1-3&amp;keywords=fire+hydrant,7,1
TERRO T300 Liquid Ant Baits - 6 Pack,"Patio, Lawn & Garden",https://www.amazon.com/TERRO-Killer-Liquid-Baits-pre-filled/dp/B000HJBKMQ,4,1
The City That Became Safe: New York's Lessons for Urban Crime and Its Control (Studies in Crime and Public Policy),Books,https://www.amazon.com/City-That-Became-Safe-Lessons/dp/0199324166,1,1
"Tonyko Fiberglass Fire Blanket for Emergency Surival, Flame Retardant Protection and Heat Insulation with Various Sizes",Sports & Outdoors,https://www.amazon.com/Tonyko-Fiberglass-Fire-Blanket-39-inch/dp/B01FOILJEI/ref=pd_sim_60_71?_encoding=UTF8&amp;pd_rd_i=B01FOILJEI&amp;pd_rd_r=WV66BW1G5F9PZPD5VNXH&amp;pd_rd_w=jLOOs&amp;pd_rd_wg=bn6b6&amp;psc=1&amp;refRID=WV66BW1G5F9PZPD5VNXH,1,1
Oakland: The Story of a City,Books,https://www.amazon.com/Oakland-Story-City-Beth-Bagwell/dp/096400870X,1,1
Prairie Radical A Journey Through the Sixties,Books,https://www.amazon.com/Prairie-Radical-Journey-Through-Sixties/dp/0918828201,1,1
name,category,amazon_link,total_mentions,subreddit_mentions
100 Things A's Fans Should Know & Do Before They Die (100 Things...Fans Should Know),Books,https://www.amazon.com/Things-Fans-Should-Know-Before/dp/1629370681,1,1
"MLB Oakland Athletics Authentic On Field Road 59FIFTY Cap, Green",Sports & Outdoors,https://www.amazon.com/Oakland-Athletics-Authentic-Field-59FIFTY/dp/B002TIPKBA/ref=sr_1_15?ie=UTF8&amp;qid=1433574571&amp;sr=8-15&amp;keywords=oakland+a,1,1
name,category,amazon_link,total_mentions,subreddit_mentions
"NFL Oakland Raiders Men's Woven Polyester Grid Necktie, One Size, Multicolor",Sports & Outdoors,https://www.amazon.com/dp/B00UPJTO6C/ref=cm_sw_r_other_apa_JjZmybCGZB94Z,2,2
"Badasses: The Legend of Snake, Foo, Dr. Death, and John Madden's Oakland Raiders",Books,https://www.amazon.com/gp/product/0061834319,2,1
"Rock Hard, Throw Deep",CDs & Vinyl,https://www.amazon.com/Rock-Hard-Throw-Hairy-Brother/dp/B00005OSWC/ref=cm_cr_arp_d_product_top?ie=UTF8,1,1
"The Silo BLACK Oakland Lynch ""Beast Mode"" T-Shirt",Sports & Outdoors,https://www.amazon.com/Silo-BLACK-Oakland-Lynch-T-Shirt/dp/B0722JX8TX/ref=redir_mobile_desktop?_encoding=UTF8&amp%3Bpsc=1&ref_=ya_aw_oh_bia_dp,1,1
name,category,amazon_link,total_mentions,subreddit_mentions
Getting High: The Adventures of Oasis,Books,https://www.amazon.com/Getting-High-Adventures-Paolo-Hewitt/dp/1911413708,1,1
name,category,amazon_link,total_mentions,subreddit_mentions
Free Lunch: How the Wealthiest Americans Enrich Themselves at Government Expense (and Stick You with the Bill),Books,https://www.amazon.com/Free-Lunch-Wealthiest-Themselves-Government/dp/1591842484,1,1
"The Fine Print: How Big Companies Use ""Plain English"" to Rob You Blind",Books,https://www.amazon.com/Fine-Print-Companies-Plain-English/dp/1591846536/ref=redir_mobile_desktop?_encoding=UTF8&amp%3BrefRID=1BN2BNG7B1P4KN259KBF&ref_=pd_aw_fbt_14_img_2,1,1
Perfectly Legal: The Covert Campaign to Rig Our Tax System to Benefit the Super Rich--and Cheat E verybody Else,Books,https://www.amazon.com/dp/B0028QRMUK,1,1
name,category,amazon_link,total_mentions,subreddit_mentions
Objective-C Programming: The Big Nerd Ranch Guide (Big Nerd Ranch Guides),Books,https://www.amazon.com/Objective-C-Programming-Ranch-Guide-Guides/dp/0321706285,1,1
name,category,amazon_link,total_mentions,subreddit_mentions
A Companion to Ayn Rand (Blackwell Companions to Philosophy),Books,https://www.amazon.com/Companion-Rand-Blackwell-Companions-Philosophy/dp/1405186844,1,1
Objectivism: The Philosophy of Ayn Rand (Ayn Rand Library),Books,https://www.amazon.com/Objectivism-Philosophy-Ayn-Rand-Library/dp/0452011019/,1,1
Traveling to Tondo: A Tale of the Nkundo of Zaire (Dragonfly Paperback),Books,https://www.amazon.com/Traveling-Tondo-Nkundo-Dragonfly-Paperback/dp/067985309X,1,1
name,category,amazon_link,total_mentions,subreddit_mentions
Xavier: The Renegade Angel Season 1 & 2,Movies & TV,https://www.amazon.com/Xavier-Renegade-Angel-Season-Various/dp/B002GSXKRO,1,1
"Nightmare of Ecstasy: Life and Art of Edward D. Wood, Jr.",Books,https://www.amazon.com/Nightmare-Ecstasy-Life-Edward-Wood/dp/0922915040/,1,1
The Maxx Volume 1 (Wildstorm/DC Comics)),Books,https://www.amazon.com/Maxx-Wildstorm-DC-Comics/dp/1401201245,1,1
The Adventures of Buckaroo Banzai Across the Eighth Dimension,Movies & TV,https://www.amazon.com/Adventures-Buckaroo-Banzai-Across-Dimension/dp/B00005JKEX/,1,1
The Annotated Archy and Mehitabel (Penguin Classics),Books,https://www.amazon.com/Annotated-Archy-Mehitabel-Penguin-Classics/dp/014303975X/ref=sr_1_fkmr0_3?ie=UTF8&amp;qid=1497577095&amp;sr=8-3-fkmr0&amp;keywords=archie+mehitabel,1,1
Amazing Stories: Season 2,Movies & TV,https://www.amazon.com/Amazing-Stories-Season-2/dp/B01KHUXO64/,1,1
name,category,amazon_link,total_mentions,subreddit_mentions
The Practical Psychic Self Defense Handbook: A Survival Guide,Books,https://www.amazon.com/Practical-Psychic-Self-Defense-Handbook/dp/1571746390/ref=sr_1_2?s=books&amp;ie=UTF8&amp;qid=1429402006&amp;sr=1-2&amp;keywords=psychic+self+defense+bruce,3,3
Hermetic Magic: The Postmodern Papyrus of Abaris,Books,https://www.amazon.com/Hermetic-Magic-Postmodern-Papyrus-Abaris/dp/0877288283/ref=sr_1_1?s=books&amp;ie=UTF8&amp;qid=1459138051&amp;sr=1-1,3,2
The Complete Magician's Tables,Books,https://www.amazon.com/Complete-Magicians-Tables-Stephen-Skinner/dp/0738711640,2,2
Ecstasies: Deciphering the Witches' Sabbath,Books,https://www.amazon.com/Ecstasies-Deciphering-Witches-Carlo-Ginzburg/dp/0226296938/,3,1
The Most Dangerous Book in the World: 9/11 as Mass Ritual,Books,https://www.amazon.com/The-Most-Dangerous-Book-World/dp/1937584178/ref=sr_1_1?ie=UTF8&amp;qid=1355502572&amp;sr=8-1&amp;keywords=the+most+dangerous+book+in+the+world,2,1
Protection and Reversal Magick (Beyond 101),Books,https://www.amazon.com/Protection-Reversal-Magick-Witchs-Defense/dp/1564148793/ref=pd_bxgy_b_img_a,2,1
The Lesser Key of Solomon,Books,https://www.amazon.com/Lesser-Key-Solomon-Joseph-Peterson/dp/157863220X/ref=sr_1_11?s=books&amp;ie=UTF8&amp;qid=1429090391&amp;sr=1-11&amp;keywords=goetia,2,1
"Spiritual Protection: A Safety Manual for Energy Workers, Healers, and Psychics",Books,https://www.amazon.com/Spiritual-Protection-Workers-Healers-Psychics/dp/1601631243/ref=sr_1_1?ie=UTF8&amp;qid=1465858185&amp;sr=8-1&amp;keywords=sophie+reicher,2,1
Postmodern Magic: The Art of Magic in the Information Age,Books,https://www.amazon.com/Postmodern-Magic-Art-Information-Age/dp/0738706639,2,1
Magic: The Complete Course,Books,https://www.amazon.com/Magic-Complete-Course-Joshua-Jay/dp/0761149872/ref=sr_1_4?s=books&amp;ie=UTF8&amp;qid=1475604083&amp;sr=1-4&amp;keywords=magic+trick,2,1
Taoist Yoga: Alchemy & Immortality,Books,https://www.amazon.com/Taoist-Yoga-Kuan-Charles-Luk/dp/0877280673,2,1
The Middle Pillar: The Balance Between Mind and Magic,Books,https://www.amazon.com/Middle-Pillar-Balance-Between-Magic/dp/1567181406,1,1
The Secret Teachings of All Ages (Reader's Edition),Books,https://www.amazon.com/Secret-Teachings-All-Ages-Readers/dp/1585422509/ref=sr_1_1?s=books&amp;ie=UTF8&amp;qid=1468834459&amp;sr=1-1&amp;keywords=the+secret+teachings+of+all+ages,1,1
Semitic Magic; Its Origins and Development,Books,https://www.amazon.com/Semitic-Magic-Its-Origins-Development/dp/1230291148,1,1
The Magus: A Complete System of Occult Philosophy,Books,https://www.amazon.com/Magus-Complete-System-Occult-Philosophy/dp/0877289425/ref=sr_1_3?s=books&amp;ie=UTF8&amp;qid=1429088411&amp;sr=1-3&amp;keywords=the+magus,1,1
Warrior of the Light: A Manual,Books,https://www.amazon.com/Warrior-Light-Manual-Paulo-Coelho/dp/0060527986/ref=sr_1_1?ie=UTF8&amp;qid=1474402825&amp;sr=8-1&amp;keywords=manual+warrior+of+the+light,1,1
Secrets of the Magickal Grimoires: The Classical Texts of Magick Deciphered,Books,https://www.amazon.com/Secrets-Magickal-Grimoires-Classical-Deciphered/dp/0738703036/ref=sr_1_2?s=books&amp;ie=UTF8&amp;qid=1429089604&amp;sr=1-2&amp;keywords=secrets+magickal,1,1
"The Necronomicon: Selected Stories and Essays Concerning the Blasphemous Tome of the Mad Arab (Call of Cthulhu Horror Fiction, 6034)",Books,https://www.amazon.com/The-Necronomicon-Selected-Concerning-Blasphemous/dp/156882162X,1,1
The Picatrix Liber Atratus Edition,Books,https://www.amazon.com/Complete-Picatrix-Classic-Astrological-Atratus/dp/1257767852/ref=sr_1_1?s=books&amp;ie=UTF8&amp;qid=1429088928&amp;sr=1-1&amp;keywords=picatrix,1,1
"The Golden Dawn: The Original Account of the Teachings, Rites & Ceremonies of the Hermetic Order (Llewellyn's Golden Dawn Series)",Books,https://www.amazon.com/Golden-Dawn-Teachings-Ceremonies-Llewellyns/dp/0875426638/ref=sr_1_1?s=books&amp;ie=UTF8&amp;qid=1429089946&amp;sr=1-1&amp;keywords=the+golden+dawn,1,1
Three Books of Occult Philosophy (Llewellyn's Sourcebook),Books,https://www.amazon.com/Three-Occult-Philosophy-Llewellyns-Sourcebook/dp/0875428320/ref=sr_1_1?s=books&amp;ie=UTF8&amp;qid=1429088310&amp;sr=1-1&amp;keywords=occult+philosophy,1,1
The Key of Solomon the King: Clavicula Salomonis,Books,https://www.amazon.com/Key-Solomon-King-Clavicula-Salomonis/dp/087728931X/ref=sr_1_1?s=books&amp;ie=UTF8&amp;qid=1429090463&amp;sr=1-1&amp;keywords=key+of+solomon,1,1
The Way of the Shaman,Books,https://www.amazon.com/Way-Shaman-Michael-Harner/dp/0062503731/ref=la_B000APPHVW_1_1?s=books&amp;ie=UTF8&amp;qid=1422709429&amp;sr=1-1,1,1
The Key to Solomon's Key: Is This the Lost Symbol of Masonry?,Books,https://www.amazon.com/The-Key-Solomons-Symbol-Masonry/dp/1888729287,1,1
Magical Use of Thought Forms: A Proven System of Mental & Spiritual Empowerment,Books,https://www.amazon.com/Magical-Use-Thought-Forms-Empowerment/dp/1567180841,1,1
The Red Book: A Reader's Edition (Philemon),Books,https://www.amazon.com/Red-Book-Readers-Philemon/dp/0393089088,1,1
The Sacred Prostitute: Eternal Aspect of the Feminine (Studies in Jungian Psychology by Jungian Analysts),Books,https://www.amazon.com/Sacred-Prostitute-Feminine-Psychology-Analysts/dp/0919123317,1,1
Gateways Through Stone and Circle,Books,https://www.amazon.com/Gateways-Through-Stone-Circle-Chassan/dp/0983063931,1,1
Crowley Thoth Small Tarot,Books,https://www.amazon.com/Crowley-Thoth-Small-Tarot-Aleister/dp/0880793082/ref=sr_1_3_twi_car_2?ie=UTF8&amp;qid=1458939173&amp;sr=8-3&amp;keywords=used+tarot+decks,1,1
"Zen Mind, Beginner's Mind: Informal Talks on Zen Meditation and Practice",Books,https://www.amazon.com/Zen-Mind-Beginners-Shunryu-Suzuki/dp/1590308492,1,1
The Celtic Golden Dawn: An Original & Complete Curriculum of Druidical Study,Books,https://www.amazon.com/The-Celtic-Golden-Dawn-Curriculum/dp/0738731552,1,1
Modern Magick: Twelve Lessons in the High Magickal Arts,Books,https://www.amazon.com/gp/product/0738715786/ref=pd_lpo_sbs_dp_ss_1?pf_rd_p=1944687662&amp;pf_rd_s=lpo-top-stripe-1&amp;pf_rd_t=201&amp;pf_rd_i=0738704717&amp;pf_rd_m=ATVPDKIKX0DER&amp;pf_rd_r=1BGKGDTM56856NYMT3K0,1,1
"The Reiki Sourcebook, Revised and Expanded",Books,https://www.amazon.com/Reiki-Sourcebook-Revised-Expanded/dp/1846941814/ref=asap_bc?ie=UTF8,1,1
Mind-Reach: Scientists Look at Psychic Abilities (Studies in Consciousness),Books,https://www.amazon.com/Mind-Reach-Scientists-Psychic-Abilities-Consciousness/dp/1571744142,1,1
Calcium Magnesium - Instant Cal Mag C - WARNING: You may Sleep Better - Feel Less Stress - Feel Calm and Relaxed - for Super Fast Absorption To Blood Muscles & Bones,"Health, Household & Baby Care",https://www.amazon.com/Instant-Cal-Mag-magnesium-absorption/dp/B00ENHRB44/,1,1
The Old Straight Track: The Classic Book on Ley Lines,Books,https://www.amazon.com/The-Old-Straight-Track-Classic/dp/0349137072,1,1
The Lost Keys of Freemasonry (Dover Occult),Books,https://www.amazon.com/Lost-Keys-Freemasonry-Dover-Occult/dp/0486473775,1,1
How To Make Your Daydreams Come true,Books,https://www.amazon.com/Make-Your-Daydreams-Come-true/dp/1438288530,1,1
Astral Dynamics: The Complete Book of Out-of-Body Experiences,Books,https://www.amazon.com/Astral-Dynamics-Out-Body-Experiences/dp/1571746161,1,1
"Witchcraft Medicine: Healing Arts, Shamanic Practices, and Forbidden Plants",Books,https://www.amazon.com/Witchcraft-Medicine-Shamanic-Practices-Forbidden/dp/0892819715/ref=sr_1_1?s=books&amp;ie=UTF8&amp;qid=1449692610&amp;sr=1-1&amp;keywords=witchcraft+medicine,1,1
The Crowley Tarot: The Handbook to the Cards,Books,https://www.amazon.com/Crowley-Tarot-Handbook-Cards/dp/0880797150,1,1
The Thelemic Cookbook: Cooking with Correspondences,Books,https://www.amazon.com/Thelemic-Cookbook-Cooking-Correspondences/dp/0996627200/ref=sr_1_1?ie=UTF8&amp;qid=1477003478&amp;sr=8-1&amp;keywords=thelema+cookbook,1,1
"Letters from the Devil's Forest: An Anthology of Writings on Traditional Witchcraft, Spiritual Ecology and Provenance Traditionalism",Books,https://www.amazon.com/Letters-Devils-Forest-Traditional-Traditionalism/dp/1500796360/ref=pd_bxgy_14_2?ie=UTF8&amp;refRID=1QMXC1XS1MTRWS6DP8RP,1,1
Chiron: Rainbow Bridge Between the Inner & Outer Planets (Llewellyn's Modern Astrology Library),Books,https://www.amazon.com/Chiron-Rainbow-Between-Llewellyns-Astrology/dp/087542094X/ref=sr_1_1?ie=UTF8&amp;qid=1422481156&amp;sr=8-1&amp;keywords=chiron+barbara+hand+clow&amp;pebp=1422481160768&amp;peasin=087542094X,1,1
Secret Rituals of the O.T.O.,Books,https://www.amazon.com/Secret-Rituals-T-Francis-King/dp/0852071116,1,1
The Poison Diaries,Books,https://www.amazon.com/Poison-Diaries-Jane-Duchess-Northumberland/dp/0810993147/,1,1
Fairy-Faith in Celtic Countries (Library of the Mystic Arts),Books,https://www.amazon.com/Fairy-Faith-Celtic-Countries-Library-Mystic/dp/0806511605,1,1
The Chicken Qabalah of Rabbi Lamed Ben Clifford: Dilettante's Guide to What You Do and Do Not Need to Know to Become a Qabalist,Books,https://www.amazon.com/Chicken-Qabalah-Rabbi-Lamed-Clifford/dp/1578632153,1,1
A Treatise on Angel Magic: Maghum Opus Hermetic Sourceworks,Books,https://www.amazon.com/Treatise-Angel-Magic-Hermetic-Sourceworks/dp/1578633753/,1,1
Tarot Apokalypsis Kit,Books,https://www.amazon.com/Tarot-Apokalypsis-Kit-Kim-Huggens/dp/0738749826,1,1
The Book of Oberon: A Sourcebook of Elizabethan Magic,Books,https://www.amazon.com/Book-Oberon-Sourcebook-Elizabethan-Magic/dp/0738743348,1,1
Grimoire for the Green Witch: A Complete Book of Shadows,Books,https://www.amazon.com/Grimoire-Green-Witch-Complete-Shadows/dp/0738702870/ref=pd_sim_14_2?ie=UTF8&amp;dpID=51nDc927WZL&amp;dpSrc=sims&amp;preST=_AC_UL160_SR125,1,1
Theurgy and the Soul: The Neoplatonism of Iamblichus (2nd edition),Books,https://www.amazon.com/Theurgy-Soul-Neoplatonism-Iamblichus-2nd/dp/1621380637/ref=sr_1_1?ie=UTF8&amp;qid=1477761054&amp;sr=8-1&amp;keywords=Neoplatonism+of+Iamblichus,1,1
"The Zen of Magic Squares, Circles, and Stars: An Exhibition of Surprising Structures across Dimensions",Books,https://www.amazon.com/Zen-Magic-Squares-Circles-Stars/dp/0691115974/ref=sr_1_1?ie=UTF8&amp;qid=1503174253&amp;sr=8-1&amp;keywords=the+zen+of+magic+squares,1,1
A course in Miracles : Combined Volume,Books,https://www.amazon.com/Course-Miracles-Foundation-Inner-Peace/dp/1883360269/,1,1
"Daoist Magical Incantations, Hand Seals, and Star Stepping",Books,https://www.amazon.com/Daoist-Magical-Hand-Seal-Training/dp/1885246412,1,1
The Lesser Banishing Ritual of the Pentagram,Books,https://www.amazon.com/Lesser-Banishing-Ritual-Pentagram/dp/1905713959/ref=tmm_pap_swatch_0?_encoding=UTF8&amp;qid=1450121520&amp;sr=8-2,1,1
Craft of the Untamed: An Inspired Vision of Traditional Witchcraft,Books,https://www.amazon.com/Craft-Untamed-Inspired-Traditional-Witchcraft/dp/1906958114/ref=sr_1_2?s=books&amp;ie=UTF8&amp;qid=1449692768&amp;sr=1-2&amp;keywords=traditional+witchcraft,1,1
Alchemy & Mysticism,Books,https://www.amazon.com/Alchemy-Mysticism-Alexander-Roob/dp/3836549360/ref=redir_mobile_desktop?_encoding=UTF8&pc_redir=T1&ref_=redir_mdp_mobile,1,1
"The Secret Teachings of All Ages: An Encyclopedic Outline of Masonic,  Hermetic, Qabbalistic and Rosiccucian Symbolical Philosophy- Reduced Size Hardbound in Color",Books,https://www.amazon.com/Secret-Teachings-All-Ages-Encyclopedic/dp/0893145483/ref=redir_mobile_desktop?_encoding=UTF8&amp%3Bkeywords=0893145483&amp%3Bpi=AC_SX236_SY340_FMwebp_QL65&amp%3Bqid=1482375666&amp%3Bsr=8-1&ref_=mp_s_a_1_1,1,1
The Llewellyn Practical Guide To Psychic Self-Defense & Well Being (Llewelyn Practical Guides),Books,https://www.amazon.com/Llewellyn-Practical-Psychic-Self-Defense-Llewelyn/dp/0875421903,1,1
Original Cause: The Unseen Role of Denial,Books,https://www.amazon.com/Original-Cause-Unseen-Role-Denial/dp/B0006EN214,1,1
The Dead Tell Tales,Books,https://www.amazon.com/Dead-Tell-Tales-Lucy-Swan/dp/1492251461/,1,1
Story of Edgar Cayce: There Is a River,Books,https://www.amazon.com/Story-Edgar-Cayce-There-River/dp/0876043759/ref=sr_1_4?s=books&amp;ie=UTF8&amp;qid=1434864124&amp;sr=1-4&amp;keywords=edgar+cayce,1,1
Enochian Vision Magick: An Introduction and Practical Guide to the Magick of Dr. John Dee and Edward Kelley,Books,https://www.amazon.com/Enochian-Vision-Magick-Introduction-Practical/dp/1578633826,1,1
"Enochian Evocation of Dr. John Dee, The",Books,https://www.amazon.com/Enochian-Evocation-Dr-John-Dee/dp/1578634539,1,1
The Secret of the Golden Flower: A Chinese Book of Life,Books,https://www.amazon.com/Secret-Golden-Flower-Chinese-Book/dp/0156799804,1,1
Think and GrThink and Grow Rich: The Landmark Bestseller Now Revised and Updated for the 21st Century,Books,https://www.amazon.com/Think-Grow-Rich-Landmark-Bestseller/dp/1585424331/ref=asap_bc?ie=UTF8,1,1
776 1/2: Tables for Practical Ceremonial,Books,https://www.amazon.com/776-Practical-Ceremonial-James-Eshelman/dp/0970449623,1,1
"The Interlinear Bible: Hebrew-Greek-English (English, Hebrew and Greek Edition)",Books,https://www.amazon.com/Interlinear-Bible-Hebrew-Greek-English-English-Hebrew/dp/1565639774,1,1
Red Gold  Peak Performance Techniques of the Russian and East German Olympic Victors,Books,https://www.amazon.com/Performance-Techniques-Russian-Olympic-Victors/dp/087477490X,1,1
"Pacts with the Devil: A Chronicle of Sex, Blasphemy & Liberation",Books,https://www.amazon.com/Pacts-Devil-Chronicle-Blasphemy-Liberation/dp/193515026X,1,1
Enochian Magic for Beginners: The Original System of Angel Magic (For Beginners (Llewellyn's)),Books,https://www.amazon.com/Enochian-Magic-Beginners-Original-Llewellyns/dp/1567187471,1,1
Faeries: Deluxe Collector's Edition,Books,https://www.amazon.com/Faeries-Collectors-Edition-Brian-Froud/dp/0810995867,1,1
"Asian Tofu: Discover the Best, Make Your Own, and Cook It at Home",Books,https://www.amazon.com/Asian-Tofu-Discover-Best-Make/dp/1607740257,1,1
The Miracle of New Avatar Power,Books,https://www.amazon.com/Miracle-New-Avatar-Power/dp/0135853729,1,1
"Hermetica: The Greek Corpus Hermeticum and the Latin Asclepius in a New English Translation, with Notes and Introduction",Books,https://www.amazon.com/Hermetica-Hermeticum-Asclepius-Translation-Introduction/dp/0521425433/ref=sr_1_1?ie=UTF8&amp;qid=1468428448&amp;sr=8-1&amp;keywords=brian+copenhaver+hermetica,1,1
The Occult,Books,https://www.amazon.com/Occult-Colin-Wilson/dp/1842931075,1,1
What If Everybody Did That?,Books,https://www.amazon.com/What-If-Everybody-Did-That/dp/0761456864,1,1
The Complete Enochian Dictionary: A Dictionary of the Angelic Language As Revealed to Dr. John Dee and Edward Kelley,Books,https://www.amazon.com/The-Complete-Enochian-Dictionary-Language/dp/1578632544,1,1
The Original I Ching Oracle: The Pure and Complete Texts with Concordance,Books,https://www.amazon.com/Original-Ching-Oracle-Complete-Concordance/dp/1842931261/,1,1
name,category,amazon_link,total_mentions,subreddit_mentions
The Mindfulness Workbook for OCD: A Guide to Overcoming Obsessions and Compulsions Using Mindfulness and Cognitive Behavioral Therapy (New Harbinger Self-Help Workbooks),Books,https://www.amazon.com/The-Mindfulness-Workbook-OCD-Compulsions/dp/1608828786,1,1
name,category,amazon_link,total_mentions,subreddit_mentions
2017 NATIONAL CHAMPIONSHIP ALABAMA CRIMSON TIDE SHIRT (LARGE),"Clothing, Shoes & Jewelry",https://www.amazon.com/gp/product/B01N9Q5A4S/ref=oh_aui_detailpage_o00_s00?ie=UTF8&amp;psc=1,2,1
name,category,amazon_link,total_mentions,subreddit_mentions
Expecting Better: Why the Conventional Pregnancy Wisdom Is Wrong--and What You Really Need to Know,Books,https://www.amazon.com/Expecting-Better-Conventional-Pregnancy-Wrong/dp/0143125702/ref=sr_1_1?s=books&amp;ie=UTF8&amp;qid=1485373536&amp;sr=1-1&amp;keywords=expecting+better,6,1
"Starburst FaveREDs Fruit Chews Candy, 14 ounce (6 Bags)",Grocery & Gourmet Food,https://www.amazon.com/Starburst-FaveREDs-Fruit-Chews-Candy/dp/B0041285XC,2,1
"Graco Pack 'n Play Playard On The Go, Pasadena",Baby,https://www.amazon.com/gp/product/B004Y9AKZI/ref=oh_aui_detailpage_o00_s00?ie=UTF8&amp;psc=1,2,1
Newborn Baby Boys Girls Snuggle this Muggle Short Sleeve Bodysuit Shirt and Striped Pants Outfit with Hat,"Clothing, Shoes & Jewelry",https://www.amazon.com/dp/B06XP8CCN4/ref=cm_sw_r_cp_api_sAmgzb7XSV2KN,1,1
HOFISH 3PACK Full Bust Seamless Nursing Maternity Bras Bralette S-XL with Extra Bra Extenders & Clips,"Clothing, Shoes & Jewelry",https://www.amazon.com/gp/product/B01LVXYYOX/ref=oh_aui_detailpage_o00_s00?ie=UTF8&amp;th=1&amp;psc=1,1,1
HARHAY Women's Maternity Knee Length Sleeveless Lace Tank Dress 606,"Clothing, Shoes & Jewelry",https://www.amazon.com/HARHAY-Womens-Maternity-Length-Sleeveless/dp/B01N05VP4P,1,1
Kindred Bravely The Angelina Ultra Soft Maternity & Nursing Nightgown Dress,"Clothing, Shoes & Jewelry",https://www.amazon.com/dp/B01GDCG1DS/ref=cm_sw_r_cp_apa_lS.KzbX4XQ9V7,1,1
Kinsa Sesame Street Elmo Smart Ear Thermometer,Amazon Launchpad,https://www.amazon.com/dp/B01H5QL8L6/ref=cm_sw_r_cp_apa_GP.Kzb4VQN9D2,1,1
Safety 1st Sleepy Baby Nail Clipper,Baby,https://www.amazon.com/Safety-1st-Sleepy-Baby-Clipper/dp/B001579YRM,1,1
Boudreaux's Butt Paste Diaper Rash Ointment - Maximum Strength - Contains 40% Zinc Oxide - Pediatrican Recommended - Paraben and Preservative-Free - 4 Ounce,"Health, Household & Baby Care",https://www.amazon.com/dp/B00569GU18/ref=cm_sw_r_cp_apa_.Q.KzbG1R3BVA,1,1
Takeya ThermoFlask 2 Pack,Sports & Outdoors,https://www.amazon.com/dp/B01D7NIOWW/ref=cm_sw_r_cp_apa_A3Rszb1BSBVQG,1,1
name,category,amazon_link,total_mentions,subreddit_mentions
Cable Matters SuperSpeed USB 3.0 Type A Male to Female Extension Cable in Black 10 Feet,Electronics,https://www.amazon.com/dp/B00C7SA21U,10,7
"Inateck Superspeed 4 Ports PCI-E to USB 3.0 Expansion Card - Interface USB 3.0 4-Port Express Card Desktop with 15 Pin SATA Power Connector, [ Include with A 4pin to 2x15pin Cable + A 15pin to 2x 15pin SATA Y-Cable ]",Electronics,https://www.amazon.com/gp/product/B00B6ZCNGM/ref=oh_aui_search_detailpage?ie=UTF8&amp;psc=1,5,4
Thrustmaster T-Flight Hotas X Flight Stick,Video Games,https://www.amazon.com/gp/product/B001CXYMFS,17,3
4 Port PCI Express (PCIe) SuperSpeed USB 3.0 Card Adapter w/ 4 Dedicated 5Gbps Channels - UASP - SATA / LP4 Power,Electronics,https://www.amazon.com/Express-SuperSpeed-Adapter-Dedicated-Channels/dp/B00HJZEA2S/,5,3
"CableCreation Gold (Long 16FT) Super Speed USB 3.0 Active Extension Cable, USB 3.0 Extender USB A-Male to A-Female Cable, 5Meter/16ft, Black",Electronics,https://www.amazon.com/gp/product/B0179MXKU8/ref=oh_aui_detailpage_o05_s00?ie=UTF8&amp;psc=1,3,3
Oculus Rift + ASUS Oculus Ready G11CD-WS51 Desktop PC Bundle,Electronics,https://www.amazon.com/gp/product/B01BHFI4XG/ref=as_li_qf_sp_asin_il_tl?ie=UTF8&amp;camp=1789&amp;creative=9325&amp;creativeASIN=B01BHFI4XG&amp;linkCode=as2&amp;tag=3dpricom-20&amp;linkId=YBA5JO5QHXJBTLEB,3,3
"Cable Matters 2 Pack, SuperSpeed USB 3.0 Type A Male to Female Extension Cable in Black 6 Feet",Electronics,https://www.amazon.com/Cable-Matters-SuperSpeed-Female-Extension/dp/B00CFL6ARO?ie=UTF8&amp;psc=1&amp;redirect=true&amp;ref_=oh_aui_detailpage_o03_s00,3,3
Panasonic K-KJ17MCA4BA Advanced Individual Cell Battery Charger Pack with 4AA eneloop 2100 Cycle Rechargeable Batteries (4 pack),Electronics,https://www.amazon.com/dp/B00JHKSMJU/,29,2
Microsoft Xbox Wireless Adapter for Windows,Video Games,https://www.amazon.com/Microsoft-Xbox-Wireless-Adapter-Windows-one/dp/B00ZB7W4QU/,17,2
"Thrustmaster VG T300 Ferrari Alcantara Edition Racing Wheel for PS4, PS3 and PC",Video Games,https://www.amazon.com/gp/product/B015KJ0SES/ref=pd_lpo_sbs_dp_ss_3?pf_rd_p=1944687622&amp;pf_rd_s=lpo-top-stripe-1&amp;pf_rd_t=201&amp;pf_rd_i=B004J6KRD6&amp;pf_rd_m=ATVPDKIKX0DER&amp;pf_rd_r=0ET5925JQKKMT3HMJ4TA,7,2
Logitech G920 Dual-motor Feedback Driving Force Racing Wheel with Responsive Pedals for Xbox One,Electronics,https://www.amazon.com/Logitech-Driving-Force-Racing-Wheel/dp/B00Z0UWV98/ref=sr_1_2?ie=UTF8&amp;qid=1502822751&amp;sr=8-2&amp;keywords=logitech+wheel+g920,4,2
PlayStation 4 Camera (Old Model),Video Games,https://www.amazon.com/PlayStation-4-Camera/dp/B00BGAA3S2/ref=pd_sim_sbs_147_1?ie=UTF8&amp;dpID=21mYp5efcXL&amp;dpSrc=sims&amp;preST=_AC_UL160_SR160,3,2
VideoSecu 2 Pack 2-6 inch Metal Wall Ceiling Mounts Adjustable Pan Tilt Video Camera Mounting Brackets with Ceiling Clip for CCTV DVR Home Installation Surveillance System 1SG,Electronics,https://www.amazon.com/gp/product/B001D49TU4/ref=oh_aui_detailpage_o09_s00?ie=UTF8&amp;psc=1,3,2
"Inateck PCI-E to USB 3.0 5-Port PCI Express Card and 15-Pin Power Connector, Mini PCI-E USB 3.0 Hub Controller Adapter, with Internal USB 3.0 20-PIN Connector - Expand Another Two USB 3.0 Ports",Electronics,https://www.amazon.com/gp/product/B00FPIMJEW,3,2
Cable Matters 2-Pack High Speed HDMI Extension Cable with Ethernet 10 Feet - 3D and 4K Resolution Ready,Electronics,https://www.amazon.com/gp/product/B00JJ517VI,3,2
