name,category,amazon_link,total_mentions,subreddit_mentions
"Orgain Organic 25g Protein Shake, Creamy Chocolate Fudge, 11 Ounce, 12 Count",Grocery & Gourmet Food,https://www.amazon.com/Orgain-Protein-Nutritional-Creamy-Chocolate/dp/B00I6CRPQQ,1,1
name,category,amazon_link,total_mentions,subreddit_mentions
Mrs. Sherlock Holmes: The True Story of New York City's Greatest Female Detective and the 1917 Missing Girl Case That Captivated a Nation,Books,https://www.amazon.com/Mrs-Sherlock-Holmes-Detective-Captivated/dp/1250072247,1,1
"Poilu: The World War I Notebooks of Corporal Louis Barthas, Barrelmaker, 1914-1918",Books,https://www.amazon.com/Poilu-Notebooks-Corporal-Barrelmaker-1914-1918/dp/0300212488,1,1
"Wilson's Ghost: Reducing The Risk Of Conflict, Killing, And Catastrophe In The 21st Century",Books,https://www.amazon.com/Wilsons-Ghost-Reducing-Conflict-Catastrophe/dp/1586481436,1,1
name,category,amazon_link,total_mentions,subreddit_mentions
"Bushnell Trophy TRS-25 Red Dot Sight Riflescope, 1 x 25mm (tilted front lens)",Sports & Outdoors,https://www.amazon.com/Bushnell-Trophy-TRS-25-Reticle-Riflescope/dp/B00200E0HM/ref=sr_1_1?ie=UTF8&amp;qid=1452103990&amp;sr=8-1&amp;keywords=bushnell+trs+25,2,1
Tech Sight's TSR200 Adjustable Aperture Sight for the Ruger 10/22 Rifles,Sports & Outdoors,https://www.amazon.com/Tech-Sights-TSR200-Adjustable-Aperture/dp/B0047X82V0,1,1
Primary Arms MD-AD Micro Dot - Removable Base - NV Compatible w/ Flip Caps,Sports & Outdoors,https://www.amazon.com/dp/B00P8DVP7Q/ref=cm_sw_r_awd_jnKSvbF4PJD6M,1,1
name,category,amazon_link,total_mentions,subreddit_mentions
US Army Survival Manual: FM 21-76,Books,https://www.amazon.com/US-Army-Survival-Manual-21-76/dp/0967512395/ref=sr_1_1?ie=UTF8&amp;qid=1455911549&amp;sr=8-1&amp;keywords=survival+FM21-76,2,1
"Rothco G.I. Type O.D. D-Cell Flashlights, Olive Drab",Tools & Home Improvement,https://www.amazon.com/gp/product/B000PJA2VS/ref=pd_lpo_sbs_dp_ss_1?pf_rd_p=1944687642&amp;pf_rd_s=lpo-top-stripe-1&amp;pf_rd_t=201&amp;pf_rd_i=B002HZTJUI&amp;pf_rd_m=ATVPDKIKX0DER&amp;pf_rd_r=0WG3N5DF6FWH48D7KD5B,1,1
"Northern Lights 6"" Yellow 12-hour Lightstick, set of 4",Toys & Games,https://www.amazon.com/Northern-Lights-Yellow-12-hour-Lightstick/dp/B004JW7E68/ref=sr_1_7?ie=UTF8&amp;qid=1455909951&amp;sr=8-7&amp;keywords=6,1,1
Fox Outdoor Products P-38 GI Can Opener,Sports & Outdoors,https://www.amazon.com/Made-Issue-Stainless-Steel-Opener/dp/B004WXTYTE,1,1
White Mountain Puzzles Cat Fish - 550 Piece Jigsaw Puzzle,Toys & Games,https://www.amazon.com/White-Mountain-Puzzles-Cat-Fish/dp/B0051VMSB2/ref=cm_cr_pr_product_top?ie=UTF8,1,1
SE 881MA 3-in-1 Multi-Function Hatchet,Sports & Outdoors,https://www.amazon.com/SE-Hatchet-Multi-use-Rubberized-Handle/dp/B008L958Z4/ref=sr_1_14?s=outdoor-recreation&amp;ie=UTF8&amp;qid=1455908983&amp;sr=1-14&amp;keywords=hatchet,1,1
8GB USB Flash Drive with Bottle Opener Shape 8G Memory Stick U Disk - Silver,Electronics,https://www.amazon.com/Flash-Drive-Bottle-Opener-Memory/dp/B00AYST2S4,1,1
"UST 4-in-1 Survival Tool, Orange",Sports & Outdoors,https://www.amazon.com/UST-4-in-1-Survival-Tool-Orange/dp/B00OHAW9U8/ref=sr_1_9?ie=UTF8&amp;qid=1455909975&amp;sr=8-9&amp;keywords=compass+whistle,1,1
Eiffel Tower Puzzle 250 Piece,Toys & Games,https://www.amazon.com/Re-Marks-Eiffel-Tower-Puzzle/dp/B0030CI28W/ref=sr_1_7?s=toys-and-games&amp;ie=UTF8&amp;qid=1453488630&amp;sr=1-7&amp;keywords=Eiffel+Tower+puzzle,1,1
name,category,amazon_link,total_mentions,subreddit_mentions
Grip Strengthener - Best Hand Exerciser for Increasing Hand Wrist Forearm and Finger Strength - Adjustable Resistance Range 22 to 88 Lbs - Ideal for Athletes Musicians and Hand Rehabilitation,Sports & Outdoors,https://www.amazon.com/Strengthener-Increasing-Adjustable-Resistance-Rehabilitation/dp/B00K64XUCK,1,1
Time for Treats Manual Snow Cone Maker by VICTORIO VKP1101,Home & Kitchen,https://www.amazon.com/Treats-Manual-Maker-VICTORIO-VKP1101/dp/B002S0JYRA/],1,1
name,category,amazon_link,total_mentions,subreddit_mentions
"Ozeri Pronto Digital Multifunction Kitchen and Food Scale, Elegant Black",Home & Kitchen,https://www.amazon.com/gp/product/B004164SRA/ref=oh_aui_detailpage_o02_s00?ie=UTF8&amp;psc=1,30,4
"Skater Japanese Modern/Traditional Compartmental Bento Box, 870ml, Chopsticks",Home & Kitchen,https://www.amazon.com/Skater-Japanese-Traditional-Compartmental-Chopsticks/dp/B001OC78JO,5,3
Appetite for Reduction: 125 Fast and Filling Low-Fat Vegan Recipes,Books,https://www.amazon.com/Appetite-Reduction-Filling-Low-Fat-Recipes/dp/1600940498/ref=sr_1_1?ie=UTF8&amp;qid=1459276404&amp;sr=8-1&amp;keywords=appetite+for+reduction,7,2
Paderno World Cuisine Spiral Vegetable Slicer / Countertop-Mounted Plastic Spiralizer Basic incl. 3 Different Blades Made of Stainless Steel,Home & Kitchen,https://www.amazon.com/gp/product/B0007Y9WHQ/ref=as_li_qf_sp_asin_il_tl?ie=UTF8&amp;camp=1789&amp;creative=9325&amp;creativeASIN=B0007Y9WHQ&amp;linkCode=as2&amp;tag=steakitc-20,7,2
"Protein Plus, Roasted All Natural Peanut Flour, 32 oz (907 g)",Grocery & Gourmet Food,https://www.amazon.com/dp/B0052OOYOW/,4,2
"Dr. McDougall's Right Foods Vegan Black Bean & Lime Soup, 3.4-Ounce Cups (Pack of 6)",Grocery & Gourmet Food,https://www.amazon.com/Dr-McDougalls-Right-Foods-3-4-Ounce/dp/B000FFIEL2/ref=sr_1_1_a_it?ie=UTF8&amp;qid=1486421419&amp;sr=8-1&amp;keywords=dr.+mcdougall,2,2
"Master Pan Non-Stick Divided Grill/Fry/Oven Meal Skillet, 15"", Black",Home & Kitchen,https://www.amazon.com/Master-Pan-Non-Stick-Divided-Skillet/dp/B00Y3ESSQC/ref=pd_sim_79_1?ie=UTF8&amp;dpID=41EEY4z-8kL&amp;dpSrc=sims&amp;preST=_AC_UL320_SR320,6,1
"Explore Asia Organic Black Bean Spaghetti, 7.05-Ounce Pouch",Grocery & Gourmet Food,https://www.amazon.com/Explore-Asia-Organic-Spaghetti-7-05-Ounce/dp/B0078DU1CY/ref=sr_1_1?s=grocery&amp;ie=UTF8&amp;qid=1422490696&amp;sr=1-1&amp;keywords=black+bean+spaghetti,4,1
"Cheddar Cheese Powder by Hoosier Hill Farm, 1 lb",Grocery & Gourmet Food,https://www.amazon.com/Cheddar-Cheese-Hoosier-Hill-Farm/dp/B008GG9ZS8/ref=pd_lpo_325_bs_lp_t_2?_encoding=UTF8&amp;refRID=JKFDQ26P6VSYAWH1NVRQ&amp;th=1,4,1
"WillPowder Sodium Citrate, 16-Ounce Jar",Grocery & Gourmet Food,https://www.amazon.com/WillPowder-Sodium-Citrate-16-Ounce-Jar/dp/B00250Y9Y6/ref=sr_1_4?ie=UTF8&amp;qid=1444272329&amp;sr=8-4&amp;keywords=sodium+citrate,4,1
"The Willpower Instinct: How Self-Control Works, Why It Matters, and What You Can Do to Get More of It",Books,https://www.amazon.com/Willpower-Instinct-Self-Control-Works-Matters/dp/1583335080/ref=sr_1_2?ie=UTF8&amp;qid=1427825886&amp;sr=8-2&amp;keywords=willpower,4,1
"Cuisinart CSB-75BC Smart Stick  200 Watt 2 Speed Hand Blender, Brushed Chrome",Home & Kitchen,https://www.amazon.com/dp/B00ARQVM5O/ref=cm_sw_r_cp_api_aesDzbEK807QZ,4,1
Spiral Slicer Spiralizer Complete Bundle - Vegetable Spiralizer and Cutter - Zucchini Pasta Noodle Spaghetti Maker,Home & Kitchen,https://www.amazon.com/dp/B00J19AR7W/ref=cm_sw_r_awd_HyPkvb08GZMDN,3,1
"NOW Foods Xanthan Gum Powder, 6-Ounce",Grocery & Gourmet Food,https://www.amazon.com/NOW-Foods-Xanthan-Ounce-Bottle/dp/B0014UH7J2/ref=sr_1_1?ie=UTF8&amp;qid=1422260491&amp;sr=8-1&amp;keywords=xanthan+gum,3,1
JFC - Nori Komi Furikake (Rice Seasoning) 1.7 Ounce Jar,Grocery & Gourmet Food,https://www.amazon.com/JFC-Nori-Furikake-Seasoning-Ounce/dp/B0006G5KEY,3,1
Presto 04820 PopLite Hot Air Popper,Home & Kitchen,https://www.amazon.com/Presto-04820-PopLite-Hot-Popper/dp/B00006IUWA,3,1
"Ka-Me Rice Crackers, Original, 3.5 Ounce Packages (Pack of 12)",Grocery & Gourmet Food,https://www.amazon.com/Ka-Me-Crackers-Original-Ounce-Packages/dp/B000EPP56U?th=1,2,1
"Bell Plantation Powdered PB2 Bundle: 1 Peanut Butter and 1 Chocolate Peanut Butter, 1 lb Jar (2-pack)","Health, Household & Baby Care",https://www.amazon.com/PB2-Bundle-Peanut-Butter-Chocolate/dp/B00JBCGYMG/ref=sr_1_1_a_it?ie=UTF8&amp;qid=1471501898&amp;sr=8-1&amp;keywords=pb2,2,1
Tajín Clásico Seasoning 5 oz,Grocery & Gourmet Food,https://www.amazon.com/Tajin-Fruit-Snack-Seasoning-5-0/dp/B0000GL6RK,2,1
"PB2 Powdered Peanut Butter,6.5 oz",Grocery & Gourmet Food,https://www.amazon.com/PB2-Powdered-Peanut-Butter-6-5/dp/B002GJ9JWS,2,1
"Polar Ice PI125200CT 125 Count Plastic Jello Shot Cups with Lids, 2-Ounce",Home & Kitchen,https://www.amazon.com/Polar-Ice-PI125200CT-Plastic-2-Ounce/dp/B00OFX5DSM/ref=sr_1_1?ie=UTF8&amp;qid=1451884483&amp;sr=8-1&amp;keywords=disposable+dressing+containers,2,1
"Chicago Metallic Lasagna Trio Pan, 12-Inch by 15-Inch by 3-Inch (11-1/2-Inch by 2-1/2-Inch Cavities)",Home & Kitchen,https://www.amazon.com/Chicago-Metallic-Lasagna-12-Inch-Cavities/dp/B0028RY0VI/ref=sr_1_6?ie=UTF8&amp;qid=1470872879&amp;sr=8-6&amp;keywords=divided+baking+sheet,2,1
Camp Chef Sushezi Roller Kit - Sushi Rolls Made Easy,Amazon Launchpad,https://www.amazon.com/Camp-Chef-Sushezi-Roller-Kit/dp/B001P8J1GU,2,1
"AccuWeight Digital Multifunction Food Meat Scale with LCD Display Perfect for Baking Kitchen Cooking, 11lb Capacity by 0.1oz, Tempered Glass surface, Black",Home & Kitchen,https://www.amazon.com/AccuWeight-Digital-Multifunction-Capacity-Tempered/dp/B013WU0CZW/ref=redir_mobile_desktop?_encoding=UTF8&amp%3BdpID=412f9lTrm5L&amp%3BdpPl=1&amp%3Bkeywords=food%20scale&amp%3Bpi=AC_SX236_SY340_QL65&amp%3Bqid=1497196543&amp%3Bref=plSrch&amp%3Bsr=8-6&ref_=mp_s_a_1_6,2,1
"PB2 Powdered Peanut Butter Bundle, 16 oz (Pack of 2)",Grocery & Gourmet Food,https://www.amazon.com/PB2-Powdered-Peanut-Butter-Bundle/dp/B00ABKWSTA,2,1
Marukome Miso Easy Original - 13.8 oz,Grocery & Gourmet Food,https://www.amazon.com/gp/product/B008CF99MU,1,1
Progressive International Multi Slicer,Home & Kitchen,https://www.amazon.com/gp/product/B00004RDD4,1,1
"Roland Curry Sauce, Tikka Masala, 70 Ounce",Grocery & Gourmet Food,https://www.amazon.com/Roland-Curry-Sauce-Tikka-Masala/dp/B011OJU2B2/ref=redir_mobile_desktop?_encoding=UTF8&amp%3Bkeywords=tikka%20masala%20sauce&amp%3Bqid=1492481678&amp%3Bsr=8-2&ref_=mp_s_a_1_2_a_it,1,1
"Kernel Season's Parmesan & Garlic Popcorn Seasoning, 2.85 Ounce Shakers (Pack of 6)",Grocery & Gourmet Food,https://www.amazon.com/Kernel-Seasons-Parmesan-Popcorn-Seasoning/dp/B000ILK9QG,1,1
"Quest Nutrition Protein Chips  Salt & Vinegar, 1.2oz Bag 8 Count","Health, Household & Baby Care",https://www.amazon.com/Quest-Nutrition-Protein-Chips-Vinegar/dp/B00OJA7HWQ?th=1,1,1
"Easy to Prepare, No Boiling, Shirataki Magic Noodles [6-pk], Non-GMO, Gluten-Free, No Drain/Rinse needed, Vegan, Konjac, Konnyaku, Low Carb, Low Calories, Instant",Grocery & Gourmet Food,https://www.amazon.com/gp/product/B01LKV699S/ref=oh_aui_detailpage_o08_s00?ie=UTF8&amp;th=1,1,1
Milumia Women's Vintage Floral Print Split Wrap Maxi Dress,"Clothing, Shoes & Jewelry",https://www.amazon.com/dp/B01GZNZP3W/ref=cm_sw_r_cp_api_6vgIzbGVXP3WB,1,1
Earth Balance Vegan Cheddar Flavor Squares - 6 oz - 2 Pack,Grocery & Gourmet Food,https://www.amazon.com/Earth-Balance-Cheddar-Flavor-Squares/dp/B00KI36634,1,1
"Powdered Peanut Butter (Salted Caramel, 16 Oz) PB Trimmed",Grocery & Gourmet Food,https://www.amazon.com/Powdered-Peanut-Caramel-PB-Trimmed/dp/B017MPJSD0/ref=sr_1_sc_1_s_it?s=grocery&amp;ie=UTF8&amp;qid=1496461158&amp;sr=1-1-spell&amp;keywords=pbtrimmed&amp;th=1,1,1
Frog and Toad Are Friends,Books,https://www.amazon.com/Frog-Toad-Friends-Arnold-Lobel/dp/0064440206,1,1
"Yoctosun Head Mount Magnifier with 2 LED Professional Jeweler's Loupe Light Bracket and Headband are Interchangeable 5 Replaceable Lenses: 1.0X, 1.5X, 2.0X, 2.5X, 3.5X (Upgraded Version)",Toys & Games,https://www.amazon.com/gp/product/B01H8808H6/ref=oh_aui_detailpage_o07_s00?ie=UTF8&amp;psc=1,1,1
Microwave Air Popcorn Popper - Silicone Popcorn Maker Bowl for Home - Free of PVC & BPA - Healthy Instant Kernels Popping - Save on Popcorn Machine and Bags,Home & Kitchen,https://www.amazon.com/Microwave-Air-Popcorn-Popper-Silicone/dp/B01J5NXHBG/,1,1
Yogi Teas Tea Chai Rooibos Org,"Health, Household & Baby Care",https://www.amazon.com/Yogi-Chai-Rooibos-Caffeine-Free/dp/B0019LU5LS,1,1
"Mushroom House Dried Shiitake Mushroom Slices, 1 Pound",Grocery & Gourmet Food,https://www.amazon.com/Mushroom-House-Dried-Shiitake-Slices/dp/B00PXRL3D8/ref=sr_1_1?ie=UTF8&amp;qid=1436020676&amp;sr=8-1&amp;keywords=shiitake+mushroom,1,1
"Miyasaka Miso Soup Value Pack, Toku30, 12.2 Ounce",Grocery & Gourmet Food,https://www.amazon.com/dp/B013H9GUHW/ref=cm_sw_r_other_apa_gkFPxbH37MM5A],1,1
Veggie Bacon Bits and Dips- VEGi vegan bacon,Grocery & Gourmet Food,https://www.amazon.com/Veggie-Bacon-Dips-vegan-bacon/dp/B018CCLARE,1,1
"Jovial Foods Organic Einkorn Wheat Berries, 16.0-Ounce",Grocery & Gourmet Food,https://www.amazon.com/Jovial-Foods-Organic-Einkorn-16-0-Ounce/dp/B007SM6NWW,1,1
Joseph's Lavash Bread Flax Oat Bran & Whole Wheat Reduced Carb - 4 Square Breads,Grocery & Gourmet Food,https://www.amazon.com/Josephs-Lavash-Bread-Whole-Reduced/dp/B0079OUVF4,1,1
"Portion Control Plate TrimDish With Guide - Take Control Now on Healthy Diet by Measuring Meal, Use Weight Loss Plate",Home & Kitchen,https://www.amazon.com/Portion-Control-Plate-TrimDish-Guide/dp/B00ZDAP6S8/ref=pd_sim_79_15?ie=UTF8&amp;dpID=41-TDpQvg5L&amp;dpSrc=sims&amp;preST=_AC_UL160_SR160,1,1
Sugar Spoon Recipes from the Domino Sugar Bowl Kitchen,Books,https://www.amazon.com/Sugar-Spoon-Recipes-Domino-Kitchen/dp/B001DWAEDW/ref=redir_mobile_desktop?_encoding=UTF8&ref_=mp_s_a_1_1,1,1
"Explore Asia Organic Red Adzuki Bean Spaghetti,8 Ounce (Pack of 6)",Grocery & Gourmet Food,https://www.amazon.com/Explore-Asia-Organic-Adzuki-Spaghetti/dp/B00YBNRX98,1,1
"Sea Tangle Noodle, Kelp Noodles, 12 oz (340 g)",Grocery & Gourmet Food,https://www.amazon.com/dp/B00CPQ1C54/ref=cm_sw_r_cp_api_XyU2ybP3XV819,1,1
8.5OZ ALESSI BALSAMIC VINEGAR (Pack of 1),Grocery & Gourmet Food,https://www.amazon.com/8-5OZ-ALESSI-BALSAMIC-VINEGAR-Pack/dp/B002M2SM0O,1,1
"Vermont Sugar Free Syrup, 12-Ounce Bottles (Pack of 6)",Grocery & Gourmet Food,https://www.amazon.com/Vermont-Sugar-Syrup-12-Ounce-Bottles/dp/B001HXJMXA,1,1
Vitamix Accelerator/Tamper Tool,Home & Kitchen,https://www.amazon.com/dp/B0028Y4CV4/ref=cm_sw_r_other_awd_lj.cxbTWMVXE6,1,1
"4-Cavity Tart, Pie, Bread, Bun, Roll Non-Stick Baking Pan, Divided Nonstick Mini Loaf Cake Bakeware Tin, with Removable Bottom for Easy Release",Home & Kitchen,https://www.amazon.com/4-Cavity-Non-Stick-Nonstick-Bakeware-Removable/dp/B01D3UJ6E4/ref=sr_1_1?ie=UTF8&amp;qid=1470872985&amp;sr=8-1&amp;keywords=divided+baking+sheet,1,1
Zoku Classic Pop Molds,Home & Kitchen,https://www.amazon.com/Zoku-ZK114-Classic-Pop-Molds/dp/B00CDL33Q2/ref=sr_1_6?s=home-garden&amp;ie=UTF8&amp;qid=1501672522&amp;sr=1-6&amp;keywords=popsicle+molds,1,1
"Chocolove Chocolate Bar, 77% Extra Strong Dark, 3.2 Ounce (Pack of 12)",Grocery & Gourmet Food,https://www.amazon.com/Chocolove-Chocolate-Extra-Strong-Ounce/dp/B000LKTFUU,1,1
Soft 'n Style 8 oz. Spray Bottle Set / 3 Piece Set (B28SET),"Health, Household & Baby Care",https://www.amazon.com/gp/product/B001CYC4EI/ref=oh_aui_search_detailpage?ie=UTF8&amp;psc=1,1,1
"Veggetti Pro Table-Top Spiralizer, Quickly Spiral Slice Vegetables into Healthy Veggie Pasta",Home & Kitchen,https://www.amazon.com/Veggetti-Table-Top-Spiralizer-Quickly-Vegetables/dp/B00VQTHRAA/ref=sr_1_1?s=kitchen&amp;ie=UTF8&amp;qid=1453736672&amp;sr=1-1&amp;keywords=veggetti,1,1
Coconut Bacon (2 Pack/Bags) - Enjoy Crunchy Coconut Chips With A Bacon Flavor...,Grocery & Gourmet Food,https://www.amazon.com/Coconut-Bacon-Pack-Bags-Crunchy/dp/B00JKTI3B0,1,1
"Bob's Red Mill Gluten Free Soy Protein Powder, 14 Ounce",Grocery & Gourmet Food,https://www.amazon.com/Bobs-Red-Mill-Isolated-Protein/dp/B00CRAS86E,1,1
"Blue Cheese Powder by Hoosier Hill Farm 1 lb, Gluten Free and hormone free.",Grocery & Gourmet Food,https://www.amazon.com/Cheese-Powder-Hoosier-Hill-Farm/dp/B00CSRY0F4?sa-no-redirect=1,1,1
"Sparkling Ice Strawberry Watermelon, 17 Ounce Bottles (Pack of 12)",Grocery & Gourmet Food,https://www.amazon.com/Sparkling-Spring-Water-Strawberry-Watermelon/dp/B00GZFYANW,1,1
"FiberAdvance Weight Mangement Gummies, 90 Count","Health, Household & Baby Care",https://www.amazon.com/dp/B00AY65TAG/ref=cm_sw_r_cp_apa_5lm2yb4NF1ZP1,1,1
"Stay Fit Deluxe Salad Kit, EZ Freeze",Home & Kitchen,https://www.amazon.com/Stay-Fit-Deluxe-Salad-Freeze/dp/B003N3IF30/ref=pd_sim_k_2?ie=UTF8&amp;refRID=16Y13ZSFB5C95330MHBA,1,1
Walden Farms - Calorie Free Pancake Syrup - 12 oz X 2,Grocery & Gourmet Food,https://www.amazon.com/Walden-Farms-Calorie-Pancake-Syrup/dp/B00U0OEDJU/ref=sr_1_1_a_it?ie=UTF8&amp;qid=1502333329&amp;sr=8-1&amp;keywords=walden+farm+pancake+syrup,1,1
"Ole Mexican High Fiber Low Carb Flour Tortillas, ""8 Count (Pack of 6)",Grocery & Gourmet Food,https://www.amazon.com/Ole-Mexican-Wrap-Xtreme-Fiber/dp/B001SB1X2E,1,1
Chawoorim 12 Owls Silicone Cake Bread Chocolate Jelly Candy Baking Mould Craft Mold,Home & Kitchen,https://www.amazon.com/Chawoorim-12-Owls-Silicone-Chocolate/dp/B010Q3HY0E/ref=sr_1_1?ie=UTF8&amp;qid=1471794483&amp;sr=8-1&amp;keywords=silicone+owl+mold,1,1
Norpro Glass Froth Master,Home & Kitchen,https://www.amazon.com/Norpro-89-Glass-Froth-Master/dp/B0013VALOK/ref=zg_bs_14042381_19?_encoding=UTF8&amp;psc=1&amp;refRID=3S0T3HQ9SQBFNJDHCH9R,1,1
CoolBites Premium Bento Lunch Box - BPA Free Leakproof Multi Compartment Convertible Lunch Container with Built-in Freezable Gel Ice Pack,Amazon Launchpad,https://www.amazon.com/CoolBites-Premium-Bento-Lunch-Built/dp/B017WX70NC/ref=sr_1_1?ie=UTF8&amp;qid=1499881904&amp;sr=8-1&amp;keywords=coolbites,1,1
"Dr. McDougall's Right Foods Vegan Split Pea Soup Gluten Free, 2.5-Ounce Cups (Pack of 6)",Grocery & Gourmet Food,https://www.amazon.com/Dr-McDougalls-Right-Foods-2-5-Ounce/dp/B000FFPXF2/ref=pd_sim_325_6?ie=UTF8&amp;dpID=51ATIwlx6oL&amp;dpSrc=sims&amp;preST=_AC_UL160_SR160,1,1
"Cali'flour Foods Gluten Free, Low Carb Califlower Pizza Crusts - 5 Pack - 10 Total Crusts",Grocery & Gourmet Food,https://www.amazon.com/dp/B01N18DL3K/ref=cm_sw_r_cp_api_yixrzbA187XD1,1,1
"Salbree Microwave Popcorn Popper, Silicone Popcorn Maker, Collapsible Bowl BPA Free (Blue)",Home & Kitchen,https://www.amazon.com/Salbree-Microwave-Popcorn-Silicone-Collapsible/dp/B01G7SGOL2/ref=redir_mobile_desktop?_encoding=UTF8&ref_=psdcmw_1090764_t1_B01NCRU557,1,1
Polar FT4 Heart Rate Monitor,Sports & Outdoors,https://www.amazon.com/Polar-Heart-Rate-Monitor-Unisex/dp/B00B04UH7Q/ref=lp_3407971_1_1?s=exercise-and-fitness&amp;ie=UTF8&amp;qid=1420913546&amp;sr=1-1,1,1
"Hues & Brews 6 Piece 5"" Gold Plated Stars Luxury Spoon Set (Made in Japan)",Home & Kitchen,https://www.amazon.com/dp/B007PJ74SK,1,1
"Dr. McDougall's Right Foods Vegan Split Pea Soup, Lower Sodium, 1.9-Ounce Cups (Pack of 6)",Grocery & Gourmet Food,https://www.amazon.com/Dr-McDougalls-Right-Foods-1-9-Ounce/dp/B0017U08M2/ref=sr_1_9_a_it?ie=UTF8&amp;qid=1486421419&amp;sr=8-9&amp;keywords=dr.,1,1
"Pirate's Booty, Aged White Cheddar, 4-Ounce Bags  (Packaging May Vary) (Pack of 12)",Grocery & Gourmet Food,https://www.amazon.com/Pirates-Booty-Cheddar-4-Ounce-Packaging/dp/B000CONMBS,1,1
"Gourmia GFS-700 Counterman Professional Electric Power Food & Meat Slicer with 7.5"" Blade, Silver",Home & Kitchen,https://www.amazon.com/Gourmia-GFS-700-Counterman-Professional-Electric/dp/B017HX1D8K/ref=redir_mobile_desktop?_encoding=UTF8&psc=1,1,1
UberChef Premium Ultra Sharp Stainless Steel Julienne Peeler & Vegetable Peeler with Cleaning Brush | UC-JP101,Home & Kitchen,https://www.amazon.com/UberChef-Stainless-Julienne-Vegetable-UC-JP101/dp/B00KEVG4L4/ref=sr_1_12?ie=UTF8&amp;qid=1423512852&amp;sr=8-12&amp;keywords=zoodles,1,1
Kikkoman Instant Tofu Miso Soup (Soybean Paste Soup with Tofu) -(9 Pockets in 3 Packs) (3.15 Oz),Grocery & Gourmet Food,https://www.amazon.com/Kikkoman-Instant-Soybean-Paste-Pockets/dp/B000BIQLL8/ref=sr_1_5_s_it?s=grocery&amp;ie=UTF8&amp;qid=1493670029&amp;sr=1-5&amp;keywords=miso+soup,1,1
"Hues & Brews 6 Piece 5"" Gold Plated Stars Luxury Cocktail Fork Set (Made in Japan)",Home & Kitchen,https://www.amazon.com/dp/B007P7JC2S,1,1
Three Ladies Spring Roll Rice Paper Wrappers (Square 22cm),Grocery & Gourmet Food,https://www.amazon.com/Three-Ladies-Spring-Wrappers-Square/dp/B00513BPYQ/ref=sr_1_5?ie=UTF8&amp;qid=1445889953&amp;sr=8-5&amp;keywords=rice+wraps,1,1
"Tamanoi Sushinoko Rice Mix, 2.64-Ounce",Grocery & Gourmet Food,https://www.amazon.com/Tamanoi-Sushinoko-Sushi-Powder-Vinegared/dp/B0009ZGJCY,1,1
Trim Healthy Mama Non-GMO Certified Gluten Free Defatted Peanut Flour 1Lb,Grocery & Gourmet Food,https://www.amazon.com/Trim-Healthy-Mama-Certified-Defatted/dp/B019PDYP7Q/ref=redir_mobile_desktop?_encoding=UTF8&amp%3Bpsc=1&ref_=yo_ii_img,1,1
Newest & Improved Spiralizer Vegetable Slicer Complete Bundle - Best Vegetable Cutter - Zucchini Pasta Noodle Spaghetti Maker,Home & Kitchen,https://www.amazon.com/Spiral-Slicer-Spiralizer-Complete-Bundle/dp/B00NEAO4S2/ref=sr_1_2?s=home-garden&amp;ie=UTF8&amp;qid=1435283871&amp;sr=1-2&amp;keywords=spiralizer,1,1
Digital Scale (Silver),Home & Kitchen,https://www.amazon.com/dp/B003CMYV58/ref=cm_sw_r_awd_OBTIwb8JD3W5M,1,1
ARCTIC ZERO Fit Frozen Desserts - 6 Pack - Chocolate Peanut Butter Creamy Pint,Grocery & Gourmet Food,https://www.amazon.com/ARCTIC-ZERO-Fit-Frozen-Desserts/dp/B002915VF2,1,1
"Traditional Medicinals Organic Throat Coat Tea, 16 Tea Bags (Pack of 6)","Health, Household & Baby Care",https://www.amazon.com/Traditional-Medicinals-Organic-Throat-Coat/dp/B0009F3POO/ref=sr_1_1?s=hpc&amp;ie=UTF8&amp;qid=1453954176&amp;sr=1-1&amp;keywords=throat+coat+tea,1,1
The Fine Life Ideal Olive Oil Mister Air Pressure Only Clog-Free Sprayer Black,Home & Kitchen,https://www.amazon.com/dp/B00ZGF82JA/ref=twister_B00QR1TTSA?_encoding=UTF8&amp;psc=1,1,1
name,category,amazon_link,total_mentions,subreddit_mentions
Wilton Nonstick 12-Cavity Whoopie Pie Pan,Home & Kitchen,https://www.amazon.com/Wilton-Nonstick-12-Cavity-Whoopie-Pie/dp/B004CYELQE,2,1
"Cello Whisps Pure Parmesan Cheese Crisps, 2.12 Ounce",Grocery & Gourmet Food,https://www.amazon.com/Cello-Whisps-Parmesan-Cheese-Crisps/dp/B010LWFX9O/ref=sr_1_3_a_it?ie=UTF8&amp;qid=1484675216&amp;sr=8-3&amp;keywords=cello,2,1
"Frontier Natural Products Peppermint Flavor, A/F, 2-Ounce",Grocery & Gourmet Food,https://www.amazon.com/dp/B000VDRWEI/ref=pd_lpo_sbs_dp_ss_3?pf_rd_p=1944687562&amp;pf_rd_s=lpo-top-stripe-1&amp;pf_rd_t=201&amp;pf_rd_i=B00028QD1U&amp;pf_rd_m=ATVPDKIKX0DER&amp;pf_rd_r=FZN7ED6K407V8WZM438C,1,1
"Watkins - Imitation Caramel Extract, 2 oz",Grocery & Gourmet Food,https://www.amazon.com/gp/product/B0041RGD0E/ref=s9_zgift_hd_bw_b16T3t_g325_i1?pf_rd_m=ATVPDKIKX0DER&amp;pf_rd_s=merchandised-search-20&amp;pf_rd_r=H85CTTF29C63XK27DC5N&amp;pf_rd_t=101&amp;pf_rd_p=27791599-9f51-5b66-959b-fae8be1b5cbe&amp;pf_rd_i=16318021,1,1
"Hikari Organic Miso Paste, White, 17.6 oz",Grocery & Gourmet Food,https://www.amazon.com/gp/product/B00IBNZAEE/ref=pd_lpo_sbs_dp_ss_2?pf_rd_p=1944687702&amp;pf_rd_s=lpo-top-stripe-1&amp;pf_rd_t=201&amp;pf_rd_i=B00474G0BI&amp;pf_rd_m=ATVPDKIKX0DER&amp;pf_rd_r=0DVZTKZ60AQZ9QWYK4YX,1,1
Nuts 'N More High Protein Chocolate Maple Pretzel Peanut Butter (16 oz),"Health, Household & Baby Care",https://www.amazon.com/Nuts-More-Protein-Chocolate-Pretzel/dp/B01K3FWH70/,1,1
name,category,amazon_link,total_mentions,subreddit_mentions
Burton Impact Wrist Guard,Sports & Outdoors,https://www.amazon.com/Burton-Impact-Wrist-Guard/dp/B010HT2H04,1,1
Maxell 109085 Brick Packs,Electronics,https://www.amazon.com/Maxell-UR-60-Blank-Audio-Cassette/dp/B000087NBV,1,1
name,category,amazon_link,total_mentions,subreddit_mentions
Katadyn Hiker Pro Microfilter,Sports & Outdoors,https://www.amazon.com/dp/B002CN82V2/ref=asc_df_B002CN82V25090600/?tag=hyprod-20&amp;creative=394997&amp;creativeASIN=B002CN82V2&amp;linkCode=df0&amp;hvadid=167131408724&amp;hvpos=1o1&amp;hvnetw=g&amp;hvrand=16556324577097334796&amp;hvpone=&amp;hvptwo=&amp;hvqmt=&amp;hvdev=c&amp;hvdvcmdl=&amp;hvlocint=&amp;hvlocphy=9028818&amp;hvtargid=pla-308879821368,1,1
name,category,amazon_link,total_mentions,subreddit_mentions
"Digital Kitchen Scale / Food Scale - Ultra Slim, Multifunction, Easy to Clean, Large Display (grey)",Home & Kitchen,https://www.amazon.com/gp/product/B01JTDG084/ref=oh_aui_detailpage_o00_s00?ie=UTF8&amp;psc=1,3,1
name,category,amazon_link,total_mentions,subreddit_mentions
"Mini Bluetooth Earphone,Eonfine V4.0+EDR Wireless Bluetooth Earbud,Ultra Slim Hands-free Stereo Headset with Mic For iPhone 6 6 6S Plus,Samsung S7 Note 5 (Khaki)",Cell Phones & Accessories,https://www.amazon.com/gp/product/B01FJTJXPE/ref=pd_sbs_107_6?ie=UTF8&amp;pd_rd_i=B01FJTJXPE&amp;pd_rd_r=8CHRRP1CX0SV2ZR9GJVJ&amp;pd_rd_w=IZxCG&amp;pd_rd_wg=HTtts&amp;psc=1&amp;refRID=8CHRRP1CX0SV2ZR9GJVJ,1,1
"The Greatest Book You've Never Read: Why the Bible Is Not Only Exciting, But It Will Change Your Life!",Books,https://www.amazon.com/Greatest-Book-Youve-Never-Read/dp/1467595020,1,1
name,category,amazon_link,total_mentions,subreddit_mentions
"TRENDnet USB to Serial Converter, USB 1.1 to RS-232 Male (9-pin) DB9 Serial Cable, Prolific Chipset, Windows 10/8.1/8/7, Mac OS X 10.6 and Above, 24 inch length, TU-S9",Electronics,https://www.amazon.com/TRENDnet-TU-S9-USB-Serial-Converter/dp/B0007T27H8/ref=sr_1_3?ie=UTF8&amp;qid=1456376473&amp;sr=8-3&amp;keywords=serial+to+usb,5,1
Heavy Duty Steel 2 Ton (4000 lb) Load Leveler for use with Engine Hoist/Crane,All Departments,https://www.amazon.com/Load-Leveler-Engine-Hoist-Crane/dp/B001P5UWUW,1,1
name,category,amazon_link,total_mentions,subreddit_mentions
1.7L Travel Male Bed Pee Urinal Bottle Night Drainage Container Set Trucker Aids,Home & Kitchen,https://www.amazon.com/Travel-Urinal-Drainage-Container-Trucker/dp/B0195W6JX0,1,1
name,category,amazon_link,total_mentions,subreddit_mentions
"CompTIA A+ Certification All-in-One Exam Guide, Ninth Edition (Exams 220-901 & 220-902)",Books,https://www.amazon.com/CompTIA-Certification-Guide-220-901-220-902/dp/125958951X/ref=pd_lpo_sbs_14_img_0?_encoding=UTF8&amp;psc=1&amp;refRID=2DDGDT18ERRTKDJHRPK9,3,1
