name,category,amazon_link,total_mentions,subreddit_mentions
Dragon Ball GT: The Complete Series,Movies & TV,https://www.amazon.com/Dragon-Ball-GT-Sean-Schemmel/dp/B0063RE4X8,2,2
"ENHANCE Kid's LED Night Light Ambient Color Changing Mood Lamp 7.9 inch - Wireless Remote Control , 4 Lighting Modes & Battery or AC Adapter Power - Great for Babies , Infants , Children",Baby,https://www.amazon.com/gp/product/B00NUHNLBU?psc=1&amp;redirect=true&amp;ref_=oh_aui_detailpage_o02_s01,2,2
"Dragon Ball Full Color, Vol. 1",Books,https://www.amazon.com/Dragon-Ball-Full-Color-Vol/dp/1421565927,2,2
Dragon Ball Z: Season 1 [Blu-ray],Movies & TV,https://www.amazon.com/Dragon-Ball-Blu-ray-Sean-Schemmel/dp/B00F9IB1M4,2,2
Dragon Ball  Z - Level 1.1 [Blu-ray],Movies & TV,https://www.amazon.com/Dragon-Ball-Level-1-1-Blu-ray/dp/B005E2YL4U,2,2
Dragon Ball: The Complete Illustrations,Books,https://www.amazon.com/Dragon-Ball-Illustrations-Akira-Toriyama/dp/1421525666/ref=sr_1_1?ie=UTF8&amp;qid=1498659032&amp;sr=8-1&amp;keywords=dragon+ball+art+book,2,2
鳥山明 ドラゴンクエスト イラストレーションズ (愛蔵版コミックス),Books,https://www.amazon.com/dp/4087925080/,,1
FOCUSPOWER F10 Mini Bluetooth Earbud Smallest Wireless Invisible Headphone with 6 Hour Playtime Car Headset with Mic for iPhone and Android Smart Phones(One Pcs),Electronics,https://www.amazon.com/gp/product/B01M2ZOLLP/ref=oh_aui_detailpage_o09_s00?ie=UTF8&amp;psc=1,2,1
"Kirkland Signature Purified Drinking Water, 16.9 Ounce, 40 Count",Grocery & Gourmet Food,https://www.amazon.com/Kirkland-Signature-Purified-Drinking-Water/dp/B00QGMOJ4Y,1,1
Speedo Men's PowerFLEX Eco Solid Brief Swimsuit,"Clothing, Shoes & Jewelry",https://www.amazon.com/dp/B000E6X7OQ/ref=cm_sw_r_cp_awd_lL0ZwbE7VE8FH,1,1
Dragon Ball Z SDCC 2013 Saiyan Scouter Blue Lens Pretend Play,Toys & Games,https://www.amazon.com/Dragon-Ball-Saiyan-Scouter-Pretend/dp/B00E7VQ1KG/ref=pd_sim_236_1?ie=UTF8&amp;dpID=41ZGw98UXCL&amp;dpSrc=sims&amp;preST=_AC_UL160_SR152,1,1
Dragon Ball Z Action Figures Toy Dead Yamcha Dragoll Z Figures HG Bolas De Dragon Ball,Toys & Games,https://www.amazon.com/Dragon-Action-Figures-Yamcha-Dragoll/dp/B01E3OPF62,1,1
Sdcc 2013 Dragon Ball Z Saiyan Scouter With Red Lens,Toys & Games,https://www.amazon.com/Dragon-Ball-Saiyan-Scouter-Red/dp/B00E7VTK40/ref=pd_sim_21_4?ie=UTF8&amp;dpID=41ME-jF3aNL&amp;dpSrc=sims&amp;preST=_AC_UL160_SR112,1,1
Bandai Dragon Ball Z Kai Kyukyoku! DX Chosenshi Scouter Red ver. by LaLShop,Toys & Games,https://www.amazon.com/Bandai-Dragon-Kyukyoku-Chosenshi-Scouter/dp/B00IK7TOJS/ref=pd_sim_21_6?ie=UTF8&amp;dpID=41iP7S5xY1L&amp;dpSrc=sims&amp;preST=_AC_UL160_SR148,1,1
Dragonball Forever: All Bouts and Characters (Doragonbooru fooebaa) (in Japanese),Books,https://www.amazon.com/Dragonball-Forever-Characters-Doragonbooru-Japanese/dp/4088737024,1,1
Dragon Ball Z Vegeta BADMAN Costume Shirt,"Clothing, Shoes & Jewelry",https://www.amazon.com/Dragonball-Vegeta-BADMAN-Costume-Shirt/dp/B00VKH27QC,1,1
"Bandai Shokugan Dragon Ball Styling Bulma ""Dragon Ball"" Action Figure",Toys & Games,https://www.amazon.com/gp/product/B00N2E76YY?psc=1&amp;redirect=true&amp;ref_=oh_aui_detailpage_o04_s00,1,1
"Stand 8""-14""",Toys & Games,https://www.amazon.com/gp/product/B000MBDKKE?psc=1&amp;redirect=true&amp;ref_=oh_aui_detailpage_o00_s00,1,1
Bandai Tamashii Nations FiguartsZero Super Saiyan Vegeta Action Figure,Toys & Games,https://www.amazon.com/Bandai-Tamashii-Nations-FiguartsZero-Saiyan/dp/B00GV2Z9HA/ref=sr_1_7?s=toys-and-games&amp;ie=UTF8&amp;qid=1485489220&amp;sr=1-7&amp;keywords=vegeta+figure,1,1
DRAGON BALL Mug DBZ Vegeta Heat Change - 460 ml,Home & Kitchen,https://www.amazon.com/DRAGON-BALL-Vegeta-Heat-Change/dp/B01BI37YH4/ref=sr_1_20?ie=UTF8&amp;qid=1492872001&amp;sr=8-20&amp;keywords=vegeta+mug,1,1
Banpresto Dragon Ball Z 8-Inch The Son Gohan Master Stars Piece Figure,Toys & Games,https://www.amazon.com/Banpresto-Dragon-8-Inch-Master-Figure/dp/B00QYUCYDG/ref=sr_1_1?ie=UTF8&amp;qid=1444439869&amp;sr=8-1&amp;keywords=master+stars+gohan,1,1
"Ikea 300.815.56 Hemma Cord Set, black",Tools & Home Improvement,https://www.amazon.com/gp/product/B00SLSUYTA/ref=s9_zwish_hd_bw_g60_i1?pf_rd_m=ATVPDKIKX0DER&amp;pf_rd_s=merchandised-search-5&amp;pf_rd_r=1E86SSDQ4XGCE3AFZGH0&amp;pf_rd_t=101&amp;pf_rd_p=2125310302&amp;pf_rd_i=14328101,1,1
Dragon Ball Z: Movie Pack Collection Two (Movies 6-9),Movies & TV,https://www.amazon.com/Dragon-Ball-Movie-Collection-Movies/dp/B005NQ5LOQ/ref=pd_lpo_sbs_74_t_2?_encoding=UTF8&amp;psc=1&amp;refRID=HGRRC4XDS2P31VB0RJPM,1,1
Dragon Ball GT: The Complete Series,Movies & TV,https://www.amazon.com/Dragon-Ball-GT-Complete-Series/dp/B003SPDS7G,1,1
Dragonball Z the Movie - Dead Zone Laserdisc,Movies & TV,https://www.amazon.com/Dragonball-Movie-Dead-Zone-Laserdisc/dp/B00739P9BQ,1,1
Mario Bro: Super Green Yoshi Plush Costume Hat,Toys & Games,https://www.amazon.com/dp/B00895HTOS,1,1
"Dragon Ball Super, Vol. 1",Books,https://www.amazon.com/Dragon-Ball-Super-Vol-1/dp/1421592541,1,1
"Bandai Shokugan Dragon Ball Styling Super Saiyan Goku ""Dragon Ball"" Action Figure",Toys & Games,https://www.amazon.com/Bandai-Shokugan-Dragon-Styling-Saiyan/dp/B00N2E79ZA/ref=sr_1_5?s=toys-and-games&amp;ie=UTF8&amp;qid=1442262050&amp;sr=1-5&amp;keywords=goku+figure,1,1
"Bandai Tamashii Nations FiguartsZERO EX Super Saiyan 3 Son Goku ""Dragon Ball Z"" Action Figure",Toys & Games,https://www.amazon.com/Bandai-Tamashii-Nations-FiguartsZERO-Saiyan/dp/B00OUM1VJI/ref=sr_1_18?s=toys-and-games&amp;ie=UTF8&amp;qid=1442262050&amp;sr=1-18&amp;keywords=goku+figure,1,1
"Bandai Tamashii Nations Dragon Ball Styling Son Goku ""Dragon Ball"" Action Figure",Toys & Games,https://www.amazon.com/Bandai-Tamashii-Nations-Dragon-Styling/dp/B00R3V1NFA/ref=sr_1_6?s=toys-and-games&amp;ie=UTF8&amp;qid=1442262050&amp;sr=1-6&amp;keywords=goku+figure,1,1
Dragon ball Z Dramatic Show Case 1st Season vol.1&2 set of 3 Goku Gohan Cell,Toys & Games,https://www.amazon.com/Dragon-Dramatic-Season-vol-1-Gohan/dp/B01EWJDJFM/ref=redir_mobile_desktop?_encoding=UTF8&amp%3BdpID=41jM1lNmLCL&amp%3BdpPl=1&amp%3Bkeywords=gohan%20figure%20pop&amp%3Bpi=AC_SX236_SY340_QL65&amp%3Bqid=1496811975&amp%3Bref=plSrch&amp%3Bsr=8-16&ref_=mp_s_a_1_16,1,1
"Banpresto Dragon Ball Z 9.8-Inch The Son Goku Master Stars Piece Figure, New Paint Version",Toys & Games,https://www.amazon.com/Banpresto-Dragon-Master-Action-Version/dp/B013268L9U/ref=sr_1_25?s=toys-and-games&amp;ie=UTF8&amp;qid=1442262317&amp;sr=1-25&amp;keywords=goku+figure,1,1
"Banpresto 49454 Dragon Ball Heroes DXF Volume 3 with Card 6.5"" Super Saiyan 4 Son Goku Action Figure",Toys & Games,https://www.amazon.com/Banpresto-49454-Dragon-Heroes-Saiyan/dp/B00VWXHRRS/ref=sr_1_33?s=toys-and-games&amp;ie=UTF8&amp;qid=1442262347&amp;sr=1-33&amp;keywords=goku+figure,1,1
"Banpresto Dragon Ball Z 8.7-Inch Goku Figure, SCulture Big Budoukai 5 Volume 1",Toys & Games,https://www.amazon.com/Banpresto-Dragon-8-7-Inch-SCulture-Budoukai/dp/B00UN7DOQC/ref=sr_1_8?s=toys-and-games&amp;ie=UTF8&amp;qid=1442262050&amp;sr=1-8&amp;keywords=goku+figure,1,1
"Bandai Tamashii Nations Super Saiyan Son Goku ""Dragonball Z"" S.H. Figuarts Action Figure (Discontinued by manufacturer)",Toys & Games,https://www.amazon.com/Bandai-Tamashii-Nations-Dragonball-Figuarts/dp/B002QYNIHU,1,1
Banpresto Dragon Ball Z 9.8-Inch The Son Goku Movie Master Stars Piece Figure,Toys & Games,https://www.amazon.com/Banpresto-Dragon-9-8-Inch-Master-Figure/dp/B00TLMDORY/ref=sr_1_2?s=toys-and-games&amp;ie=UTF8&amp;qid=1442262050&amp;sr=1-2&amp;keywords=goku+figure,1,1
"Banpresto Dragon Ball Z 8.2-Inch Son Goku Figure, SCulture Big Budoukai Volume 1",Toys & Games,https://www.amazon.com/Casual-Son-Goku-SCultures-Champion/dp/B006OFZ1Q8/ref=sr_1_32?s=toys-and-games&amp;ie=UTF8&amp;qid=1442262347&amp;sr=1-32&amp;keywords=goku+figure,1,1
Bandai Tamashii Nations BAN94625 FiguartsZero Vegeta Galick Gun Action Figure,Toys & Games,https://www.amazon.com/Bandai-Tamashii-Nations-BAN94625-FiguartsZero/dp/B00SOKGQBA/ref=sr_1_1?ie=UTF8&amp;qid=1444785283&amp;sr=8-1&amp;keywords=vegeta+galick+gun,1,1
Banpresto Dragon Ball Z Resolution of Soldiers Vol.6 - Super Saiyan Son Gohan Action Figure,Toys & Games,https://www.amazon.com/dp/B06Y1W1BHT,1,1
"MCS Plastic Format Frame for a 11"" x 17"" Photograph, Color; Black",Home & Kitchen,https://www.amazon.com/dp/B000S57QIQ/ref=cm_sw_r_awd_s11LvbMNV3QJF,1,1
"Banpresto Dragon Ball Z Mega World collectible WCF Shenron Figure, 6-Inch",Toys & Games,https://www.amazon.com/Dragon-World-Collectible-Figure-Shenron/dp/B010L8G978/ref=sr_1_1?ie=UTF8&amp;qid=1480058483&amp;sr=8-1&amp;keywords=Shenron,1,1
Dragon Ball Z Best Of Volume 1,CDs & Vinyl,https://www.amazon.com/Dragon-Ball-Best-Of-Volume/dp/B00006I072,1,1
Dragon Ball ultra-World Collectible figure PRINCE VEGETA whole set of 6,Toys & Games,https://www.amazon.com/Dragon-ultra-World-Collectible-figure-PRINCE/dp/B01J2TTW44,1,1
Moddan 45mm Acrylic Star Anime Balls Cosplay - 7 Pieces with Gift Box,Toys & Games,https://www.amazon.com/Moddan-Small-Crystal-Dragon-Cosplay/dp/B01M03BF2X/ref=sr_1_12?ie=UTF8&amp;qid=1480058564&amp;sr=8-12&amp;keywords=dragon+ball+replica,1,1
"Banpresto Dragon Ball Z 10"" Vegetto Master Stars Piece Figure",Toys & Games,https://www.amazon.com/Banpresto-Dragon-Vegetto-Master-Figure/dp/B00OK9CBR2/ref=sr_1_2?ie=UTF8&amp;qid=1480058603&amp;sr=8-2&amp;keywords=Vegito,1,1
Dragon Ball Super: Part One [Blu-ray],Movies & TV,https://www.amazon.com/dp/B071RGX65G,1,1
"Dragon Ball (3-in-1 Edition), Vol. 1: Includes vols. 1, 2 & 3",Books,https://www.amazon.com/Dragon-Ball-3---1-Vol/dp/1421555646,1,1
"Dragon Ball Full Color Freeza Arc, Vol. 2",Books,https://www.amazon.com/Dragon-Ball-Full-Color-Freeza/dp/1421585723?ie=UTF8&amp;qid=1463579908&amp;ref_=tmm_pap_swatch_0&amp;sr=8-3,1,1
"Dragon Ball Full Color Freeza Arc, Vol. 3",Books,https://www.amazon.com/Dragon-Ball-Full-Color-Freeza/dp/1421585731/ref=pd_bxgy_14_img_2?ie=UTF8&amp;refRID=1VNDHWBC4JCXT5MC758P,1,1
"Dragon Ball Z, Vol. 1",Books,https://www.amazon.com/Dragon-Ball-Z-Vol-1/dp/1569319308,1,1
Creative Motion Supernova Color Changing Sphere,Home & Kitchen,https://www.amazon.com/Creative-Motion-Supernova-Changing-Sphere/dp/B000LG1FBG/ref=pd_sim_75_1?ie=UTF8&amp;refRID=0DCFVQFR5WXBNPK35X21,1,1
Dragon Ball Z - Level 1.2 [Blu-ray],Movies & TV,https://www.amazon.com/Dragon-Ball-Level-1-2-Blu-ray/dp/B005E2YL40/ref=pd_sim_mov_1?ie=UTF8&amp;refRID=18JKQK1WPNDW9Z3NJ9BP,1,1
Dr. Slump: The Movies - Theatrical Films 1-5,Movies & TV,https://www.amazon.com/dp/B00KB3PZAQ,1,1
"Bandai Tamashii Nations SH Figuarts Android 16 ""Dragon Ball Z"" Action Figure",Toys & Games,https://www.amazon.com/Bandai-Tamashii-Nations-Figuarts-Android/dp/B00MYZZJY6/ref=sr_1_3?ie=UTF8&amp;qid=1433666592&amp;sr=8-3&amp;keywords=sh+figuarts+broly,1,1
Ripple Junction Dragon Ball Z White Line Goku Adult T-Shirt,"Clothing, Shoes & Jewelry",https://www.amazon.com/dp/B00OWA7Z3Y/ref=cm_sw_r_other_awd_C86SwbHC1PNZ0,1,1
"Banpresto Dragon Ball Z 3.9-Inch Super Saiyan God SS Son Goku Figure, Volume 1",Toys & Games,https://www.amazon.com/Banpresto-Dragon-3-9-Inch-Saiyan-Figure/dp/B011YZJ9EW/ref=sr_1_6?ie=UTF8&amp;qid=1502149476&amp;sr=8-6&amp;keywords=ssgss+goku,1,1
"Banpresto Dragon Ball Z 3.1-Inch Golden Frieza Figure, Volume 2",Toys & Games,https://www.amazon.com/Banpresto-Dragon-3-1-Inch-Golden-Frieza/dp/B013X7RKLI,1,1
Kei Project Dragon ball Z Star Manual Stick Shift Knob With Adapters Fits Most Cars (6 Star),Automotive Parts & Accessories,https://www.amazon.com/Kei-Project-Dragon-Manual-Adapters/dp/B0164U55AY/ref=redir_mobile_desktop?_encoding=UTF8&amp%3Bpsc=1&ref_=yo_ii_img,1,1
Dragon Ball super DXF THE SUPER WARRIORS vol3 Super Saiyan Rose Super Saiyan Vegetto all two,Toys & Games,https://www.amazon.com/gp/product/B06XC5RCZW/ref=oh_aui_detailpage_o00_s00?ie=UTF8&amp;psc=1,1,1
"Dragon Ball, Vol. 1 (VIZBIG Edition)",Books,https://www.amazon.com/Dragon-Ball-Vol-VIZBIG-Edition/dp/1421520591,1,1
Dragon Ball GT: Season 1,Movies & TV,https://www.amazon.com/dp/B001DRF83S/,1,1
Dragon Ball Z: Season 1 (Vegeta Saga),Movies & TV,https://www.amazon.com/Dragon-Ball-Season-Vegeta-Saga/dp/B000KWZ1TI,1,1
"Bandai Tamashii Nations S.H.Figuarts Ultimate Son Gohan ""Dragon Ball Z"" Action Figure",Toys & Games,https://www.amazon.com/Bandai-Tamashii-Nations-S-H-Figuarts-Ultimate/dp/B00WOEDWPU/ref=sr_1_3?ie=UTF8&amp;qid=1472900021&amp;sr=8-3&amp;keywords=son+gohan,1,1
Marcy Roman Chair,Sports & Outdoors,https://www.amazon.com/Marcy-Roman-Chair-Hyperextension-Bench/dp/B000ASB66O/ref=sr_1_1?ie=UTF8&amp;qid=1435080533&amp;sr=8-1&amp;keywords=roman+chair,1,1
Dragon Ball Daizenshu: TV Animation 3 & Movie,Books,https://www.amazon.com/Dragon-Ball-Daizenshu-Animation-Movie/dp/4081020191/ref=sr_1_3?ie=UTF8&amp;qid=1498659179&amp;sr=8-3&amp;keywords=Daizenshuu,1,1
Dragon Ball Daizenshu: Dragon Ball Daijiten,Books,https://www.amazon.com/Dragon-Ball-Daizenshu-Daijiten/dp/4087827577/ref=sr_1_6?ie=UTF8&amp;qid=1498659179&amp;sr=8-6&amp;keywords=Daizenshuu,1,1
Dragon Ball AF Volume 1,Books,https://www.amazon.com/Dragon-Ball-AF-Young-Jijii/dp/150582236X/ref=sr_1_1?ie=UTF8&amp;qid=1461291785&amp;sr=8-1&amp;keywords=dragonball+after+future,1,1
Acrylic Dragonball Replica Ball (Large/3 Stars),Toys & Games,https://www.amazon.com/Acrylic-Dragonball-Replica-Large-Stars/dp/B0154JP920/ref=redir_mobile_desktop?_encoding=UTF8&%2AVersion%2A=1&%2Aentries%2A=0,1,1
Dragon Ball Box Set (Vol. 1-16),Books,https://www.amazon.com/Dragon-Ball-Box-Vol-1-16/dp/142152614X,1,1
"Banpresto Dragon Ball Z 7.9"" SS Son Gohan Master Stars Piece The Son Gohan Figure (Special Color Version)",Toys & Games,https://www.amazon.com/Banpresto-Dragon-Master-Special-Version/dp/B017FI2ACA/ref=sr_1_4?ie=UTF8&amp;qid=1472900021&amp;sr=8-4&amp;keywords=son+gohan,1,1
Dragon Ball Daizenshu: Movies & TV Specials,Books,https://www.amazon.com/Dragon-Ball-Daizenshu-Movies-Specials/dp/4087827569/ref=sr_1_3?ie=UTF8&amp;qid=1498659516&amp;sr=8-3&amp;keywords=dragon+ball+daizenshu,1,1
"Dragon Ball Daizenshu: TV Animation, Part 2",Books,https://www.amazon.com/Dragon-Ball-Daizenshu-Animation-Part/dp/4087827550/ref=sr_1_8?ie=UTF8&amp;qid=1498659516&amp;sr=8-8&amp;keywords=dragon+ball+daizenshu,1,1
Dragon Ball Daizenshu: Story Guide,Books,https://www.amazon.com/Dragon-Ball-Daizenshu-Story-Guide/dp/4087827526/ref=sr_1_2?ie=UTF8&amp;qid=1498659006&amp;sr=8-2&amp;keywords=dragon+ball+guide,1,1
Banpresto Dragon Ball Z Super Genki Dama Special Figure - Son Gokou & Super Saiyan Gokou - 2 Pack Set,Toys & Games,https://www.amazon.com/Banpresto-Dragon-Super-Special-Figure/dp/B01G6DO49C,1,1
Dragonball Super Encyclopedias Vol.1 Story&world Guide (Dragonball Super Encyclopedias),Books,https://www.amazon.com/Dragonball-Super-Encyclopedias-Vol-1-Story/dp/4087824969/ref=sr_1_7?ie=UTF8&amp;qid=1498659006&amp;sr=8-7&amp;keywords=dragon+ball+guide,1,1
OliaDesign Large 75mm Acrylic Star Anime Balls Cosplay,Toys & Games,https://www.amazon.com/Moddan-Large-Acrylic-Anime-Cosplay/dp/B01LYGR6ES/,1,1
Dragon Ball Xenoverse - PlayStation 4,Video Games,https://www.amazon.com/Dragon-Ball-Xenoverse-PlayStation-4/dp/B00KY1HZ80/ref=sr_1_1?ie=UTF8&amp;qid=1430167618&amp;sr=8-1&amp;keywords=xenoverse+ps4,1,1
Dragon Ball Z: Rock the Dragon Collector's Edition,Movies & TV,https://www.amazon.com/Dragon-Ball-Rock-Collectors/dp/B00D7TS972,1,1
"Bandai Tamashii Nations S.H. Figurants Son Gohan ""Dragon Ball"" Action Figure",Toys & Games,https://www.amazon.com/Bandai-Tamashii-Nations-Figurants-Dragon/dp/B003F256T0/ref=sr_1_1?ie=UTF8&amp;qid=1472899824&amp;sr=8-1&amp;keywords=teen+gohan,1,1
Dragon Ball Z Kai: Part One,Movies & TV,https://www.amazon.com/Dragon-Ball-Kai-Part-One/dp/B0036ZA8BM,1,1
Dragon Ball Z: Dragon Box One,Movies & TV,https://www.amazon.com/Dragon-Ball-Box-One/dp/B002KPINF2,1,1
name,category,amazon_link,total_mentions,subreddit_mentions
Bug-A-Salt 2.0 Insect Eradication Gun,"Patio, Lawn & Garden",https://www.amazon.com/Bug-A-Salt-2-0-Insect-Eradication-Gun/dp/B00STSZ77G/ref=sr_1_1?ie=UTF8&amp;qid=1485500855&amp;sr=8-1&amp;keywords=bug+a+salt,7,1
Banpresto Dragon Ball Z Resolution of Soldiers Volume 1 Super Saiyan Goku Figure,Toys & Games,https://www.amazon.com/Banpresto-Dragon-Resolution-Soldiers-Saiyan/dp/B01I5RGWNS,1,1
Dragon Ball Cho Figure Swing Keychain~UDM The Best 14~Destruction Prince Vegeta,Toys & Games,https://www.amazon.com/Dragon-Figure-Keychain~UDM-14~Destruction-Prince/dp/B01ED99C4I/ref=sr_1_1?ie=UTF8&amp;qid=1465264247&amp;sr=8-1&amp;keywords=Majin+Vegeta+keychain,1,1
name,category,amazon_link,total_mentions,subreddit_mentions
DC Universe: Rebirth Deluxe Edition (DC Universe Event),Books,https://www.amazon.com/DC-Universe-Rebirth-Deluxe-Event/dp/1401270727/ref=sr_1_1?ie=UTF8&amp;qid=1497803965&amp;sr=8-1&amp;keywords=rebirth+dc,7,3
Wonder Woman By Greg Rucka Vol. 1,Books,https://www.amazon.com/Wonder-Woman-Greg-Rucka-Vol/dp/1401263321,5,3
Final Crisis (New Edition),Books,https://www.amazon.com/Final-Crisis-New-Grant-Morrison/dp/140124517X,5,3
Batman Vol. 1: The Court of Owls (The New 52),Books,https://www.amazon.com/Batman-Vol-Court-Owls-New/dp/1401235425/ref=sr_1_1?ie=UTF8&amp;qid=1470614418&amp;sr=8-1&amp;keywords=batman+vol+1,8,2
"The Flash, Vol. 1: Move Forward  (The New 52)",Books,https://www.amazon.com/The-Flash-Vol-Move-Forward/dp/1401235549/,7,2
Batman: Batman and Son (New Edition),Books,https://www.amazon.com/Batman-Son-New-Grant-Morrison/dp/1401244025/ref=sr_1_2?ie=UTF8&amp;qid=1465402384&amp;sr=8-2&amp;keywords=batman+,7,2
"Wonder Woman, Vol. 1: Blood (The New 52)",Books,https://www.amazon.com/Wonder-Woman-Vol-Blood-The/dp/140123562X,6,2
The Flash by Mark Waid Book One,Books,https://www.amazon.com/Flash-Mark-Waid-Book-One/dp/1401267351/ref=pd_sim_14_1?_encoding=UTF8&amp;pd_rd_i=1401267351&amp;pd_rd_r=E08KF0FAQGQA6E1HGDM3&amp;pd_rd_w=3vFgM&amp;pd_rd_wg=HV46f&amp;psc=1&amp;refRID=E08KF0FAQGQA6E1HGDM3,6,2
Flashpoint,Books,https://www.amazon.com/Flashpoint-Geoff-Johns/dp/1401233384/,5,2
"JLA: The Deluxe Edition, Vol. 1",Books,https://www.amazon.com/JLA-Deluxe-Vol-Grant-Morrison/dp/1401233147/ref=sr_1_1?ie=UTF8&amp;qid=1496639330&amp;sr=8-1&amp;keywords=JLA+by+Morrison,5,2
"Justice League, Vol. 1: Origin (The New 52)",Books,https://www.amazon.com/Justice-League-Vol-Origin-New/dp/1401237886/ref=sr_1_1?ie=UTF8&amp;qid=1450126023&amp;sr=8-1&amp;keywords=justice+league+origin,5,2
The Flash By Geoff Johns Book One,Books,https://www.amazon.com/Flash-Geoff-Johns-Book-One/dp/1401258735/ref=pd_bxgy_14_img_2?_encoding=UTF8&amp;pd_rd_i=1401258735&amp;pd_rd_r=G44XE5EKH35TR50Y25S1&amp;pd_rd_w=aBtS0&amp;pd_rd_wg=mAnGI&amp;psc=1&amp;refRID=G44XE5EKH35TR50Y25S1,4,2
Batman: Under the Red Hood,Books,https://www.amazon.com/Batman-Under-Hood-Judd-Winick/dp/1401231454,4,2
Green Arrow: Year One,Books,https://www.amazon.com/Green-Arrow-Year-Andy-Diggle/dp/1401217435,4,2
Batman: The Dark Knight Returns 30th Anniversary Edition,Books,https://www.amazon.com/Batman-Dark-Knight-Returns-Anniversary/dp/1401263119/,4,2
Green Lantern: Rebirth,Books,https://www.amazon.com/Green-Lantern-Rebirth-Geoff-Johns/dp/1401227554/ref=sr_1_1?s=books&amp;ie=UTF8&amp;qid=1480613177&amp;sr=1-1&amp;keywords=Green+Lantern,3,2
Blackest Night,Books,https://www.amazon.com/Blackest-Night-Geoff-Johns/dp/1401229530/ref=sr_1_1?s=books&amp;ie=UTF8&amp;qid=1480614077&amp;sr=1-1&amp;keywords=Blackest+Night,3,2
Green Arrow Vol. 1: The Death and Life Of Oliver Queen (Rebirth),Books,https://www.amazon.com/dp/1401267815,3,2
Batman: Arkham Asylum 25th Anniversary,Books,https://www.amazon.com/Batman-Arkham-Asylum-25th-Anniversary/dp/1401251242/ref=sr_1_1?ie=UTF8&amp;qid=1455908276&amp;sr=8-1&amp;keywords=arkham+asylum,3,2
Batgirl Vol. 1: Silent Knight,Books,https://www.amazon.com/Batgirl-Vol-1-Silent-Knight/dp/1401266274/ref=sr_1_1?ie=UTF8&amp;qid=1465624218&amp;sr=8-1&amp;keywords=batgirl+silent+knight,3,2
"Rebirth Omnibus, Vol. 1",Books,https://www.amazon.com/DC-Rebirth-Omnibus-Various/dp/1401267424/,3,2
The Flash By Francis Manapul and Brian Buccellato Omnibus,Books,https://www.amazon.com/Flash-Francis-Manapul-Buccellato-Omnibus/dp/1401261035/ref=redir_mobile_desktop?_encoding=UTF8&amp%3BdpID=61nkCzDcoZL&amp%3BdpPl=1&amp%3Bkeywords=the%20flash%20omnibus&amp%3Bpi=AC_SX236_SY340_QL65&amp%3Bqid=1480633813&amp%3Bref=plSrch&amp%3Bsr=8-1&ref_=mp_s_a_1_1,3,2
Green Arrow: The Longbow Hunters,Books,https://www.amazon.com/Green-Arrow-Longbow-Mike-Grell/dp/1401238629,3,2
Titans Vol. 1: The Return of Wally West (Rebirth) (Titans (Rebirth)),Books,https://www.amazon.com/Titans-Vol-Return-Wally-Rebirth/dp/140126817X/ref=sr_1_1?s=books&amp;ie=UTF8&amp;qid=1497804154&amp;sr=1-1&amp;keywords=titans+rebirth,3,2
The Flash by Grant Morrison and Mark Millar,Books,https://www.amazon.com/dp/1401261027,3,2
Shazam! Vol. 1 (The New 52): From the Pages of Justice League,Books,https://www.amazon.com/Shazam-Vol-1-New-52/dp/1401246990/ref=sr_1_2?ie=UTF8&amp;qid=1424880100&amp;sr=8-2&amp;keywords=Shazam,2,2
"Batman v Superman: Dawn of Justice Multiverse 6"" Wonder Woman Figure",Toys & Games,https://www.amazon.com/Batman-Superman-Justice-Multiverse-Wonder/dp/B014UMYW3Y/ref=sr_1_3?ie=UTF8&amp;qid=1451847185&amp;sr=8-3&amp;keywords=dc+multiverse,2,2
Green Arrow: The Archer's Quest,Books,https://www.amazon.com/dp/1401200443,2,2
Green Arrow: Quiver (New Edition),Books,https://www.amazon.com/dp/1401259421,2,2
Grayson Vol. 1: Agents of Spyral (The New 52),Books,https://www.amazon.com/Grayson-Vol-Agents-Spyral-New/dp/1401252346/ref=sr_1_1?ie=UTF8&amp;qid=1441865452&amp;sr=8-1&amp;keywords=Grayson,2,2
Green Arrow Vol. 1: Hunters Moon,Books,https://www.amazon.com/dp/1401243266,2,2
The Flash Vol. 1: The Dastardly Death of the Rogues: Brightest Day (Flash (DC Comics Unnumbered)),Books,https://www.amazon.com/Flash-Vol-Dastardly-Brightest-Unnumbered/dp/1401231950/ref=redir_mobile_desktop?_encoding=UTF8&amp%3BdpID=61PYyeqZVvL&amp%3BdpPl=1&amp%3Bkeywords=dastardly%20death%20of%20the%20rogues&amp%3Bpi=SY200_QL40&amp%3Bqid=1480633695&amp%3Bref=plSrch&amp%3Bsr=8-1&ref_=mp_s_a_1_1,2,2
BATGIRL VOL. 2: TO THE DEATH,Books,https://www.amazon.com/BATGIRL-2-DEATH-Kelley-Puckett/dp/1401263526/ref=pd_bxgy_14_2?ie=UTF8&amp;refRID=AE6CX5043NQ89ZVDYTWT,2,2
Young Justice Book One,Books,https://www.amazon.com/Young-Justice-Book-Peter-David/dp/1401271162/ref=sr_1_1?ie=UTF8&amp;qid=1496640113&amp;sr=8-1&amp;keywords=young+justice+book+one,2,2
Robin Vol. 1: Reborn,Books,https://www.amazon.com/Robin-Vol-Reborn-Chuck-Dixon/dp/1401258573/,2,2
"Trends International Justice League Minimalist Wall Poster 22.375"" x 34""",Home & Kitchen,https://www.amazon.com/Trends-International-Justice-League-Minimalist/dp/B00TJUMND4/ref=redir_mobile_desktop?_encoding=UTF8&%2AVersion%2A=1&%2Aentries%2A=0,2,2
The Sleeper Omnibus,Books,https://www.amazon.com/dp/1401238033,,1
Y: The Last Man Book One,Books,https://www.amazon.com/dp/140125151X,,1
The Sandman Vol. 1: Preludes & Nocturnes (New Edition),Books,https://www.amazon.com/gp/product/1401225756?keywords=sandman&amp;qid=1450188226&amp;ref_=sr_1_3&amp;s=books&amp;sr=1-3,7,1
The Flash Vol. 1: Lightning Strikes Twice (Rebirth),Books,https://www.amazon.com/Flash-Vol-Lightning-Strikes-Universe/dp/140126784X,6,1
"Leatherman - Wingman Multitool, Stainless Steel",Tools & Home Improvement,https://www.amazon.com/Leatherman-Wingman-Multi-Tool-Stainless-Steel/dp/B005DI0XM4/ref=sr_1_cc_1?s=aps&amp;ie=UTF8&amp;qid=1473853648&amp;sr=1-1-catcorr&amp;keywords=leatherman+multitool,6,1
Omega Men: The End Is Here,Books,https://www.amazon.com/Omega-Men-Here-Tom-King/dp/1401261531/ref=tmm_pap_swatch_0?_encoding=UTF8&amp;coliid=I1C7QOLH7PUTJD&amp;colid=VHFSS9XHG0GD&amp;qid=&amp;sr=,5,1
All Star Superman,Books,https://www.amazon.com/All-Star-Superman-Grant-Morrison/dp/1401232051/ref=sr_1_1?ie=UTF8&amp;qid=1455908319&amp;sr=8-1&amp;keywords=all+star+superman,5,1
Naughty and Nice: The Good Girl Art of Bruce Timm,Books,https://www.amazon.com/Naughty-Nice-Good-Girl-Bruce/dp/1933865407/,4,1
Superman: Birthright,Books,https://www.amazon.com/Superman-Birthright-Mark-Waid/dp/1401202527,4,1
Suicide Squad Vol. 1: Trial by Fire,Books,https://www.amazon.com/Suicide-Squad-Vol-Trial-Fire/dp/140125831X,4,1
Flashpoint: The World of Flashpoint Featuring Batman,Books,https://www.amazon.com/Flashpoint-World-Batman-TP/dp/1401234054,4,1
Batgirl Vol. 1: The Darkest Reflection (The New 52),Books,https://www.amazon.com/Batgirl-Vol-Darkest-Reflection-New/dp/1401238149/ref=sr_1_1?ie=UTF8&amp;qid=1426450866&amp;sr=8-1&amp;keywords=batgirl+volume+1,3,1
Fourth World by Jack Kirby Omnibus,Books,https://www.amazon.com/Fourth-World-Jack-Kirby-Omnibus/dp/1401274757/ref=sr_1_1?s=books&amp;ie=UTF8&amp;qid=1502561621&amp;sr=1-1&amp;keywords=new+gods+omnibus,3,1
DC: The New Frontier,Books,https://www.amazon.com/DC-New-Frontier-Darwyn-Cooke/dp/140126378X/,3,1
Forever Evil,Books,https://www.amazon.com/Forever-Evil-Geoff-Johns/dp/1401253385/ref=sr_1_1?ie=UTF8&amp;qid=1441865582&amp;sr=8-1&amp;keywords=Forever+Evil,3,1
The Flash Vol. 2: The Road to Flashpoint (Flash (DC Comics Unnumbered)),Books,https://www.amazon.com/The-Flash-Vol-Flashpoint-Comics/dp/1401234488/,3,1
The Flash: Rebirth,Books,https://www.amazon.com/Flash-Rebirth-Geoff-Johns/dp/1401230016/,3,1
The Flash Vol. 2: Rogues Revolution (The New 52),Books,https://www.amazon.com/The-Flash-Vol-Revolution-Numbered/dp/1401242731/,3,1
"Batman: No Man's Land, Vol. 1",Books,https://www.amazon.com/Batman-No-Mans-Land-Vol/dp/1401232280,3,1
Wonder Woman By George Perez Vol. 1,Books,https://www.amazon.com/Wonder-Woman-George-Perez-Vol/dp/1401263755/ref=sr_1_1?s=books&amp;ie=UTF8&amp;qid=1465624290&amp;sr=1-1&amp;keywords=wonder+woman+by+george+perez,3,1
Batman Vol. 1: I Am Gotham (Rebirth),Books,https://www.amazon.com/Batman-Vol-Am-Gotham-Rebirth/dp/1401267777,3,1
"John Constantine, Hellblazer, Vol. 1: Original Sins",Books,https://www.amazon.com/John-Constantine-Hellblazer-Vol-Original/dp/1401230067,3,1
