name,category,amazon_link,total_mentions,subreddit_mentions
"Behavior Adjustment Training 2.0: New Practical Techniques for Fear, Frustration, and Aggression in Dogs",Books,https://www.amazon.com/Behavior-Adjustment-Training-2-0-Frustration/dp/1617811742/ref=redir_mobile_desktop?_encoding=UTF8&amp%3BdpID=81KMbIY5D8L&amp%3BdpPl=1&amp%3Bpsc=1&amp%3BrefRID=BMWEKBVTSD1J2PGM787M&ref_=pd_aw_sim_14_3,6,1
BestPet Metal Wire Playpen,Pet Supplies,https://www.amazon.com/BestPet-Playpen-Exercise-24-Inch-30-Inch/dp/B0036WQFQM,1,1
name,category,amazon_link,total_mentions,subreddit_mentions
Pro React,Books,https://www.amazon.com/Pro-React-Cassio-Sousa-Antonio/dp/1484212614/,1,1
name,category,amazon_link,total_mentions,subreddit_mentions
Off to Be the Wizard (Magic 2.0),Books,https://www.amazon.com/dp/1612184715/ref=cm_sw_r_cp_api_7K5txbSJPG8PS,2,1
name,category,amazon_link,total_mentions,subreddit_mentions
"Hope in the Dark: Untold Histories, Wild Possibilities",Books,https://www.amazon.com/Hope-Dark-Untold-Histories-Possibilities/dp/1608465764,1,1
name,category,amazon_link,total_mentions,subreddit_mentions
Landlording: A Handymanual for Scrupulous Landlords and Landladies Who Do It Themselves,Books,https://www.amazon.com/Landlording-Handymanual-Scrupulous-Landladies-Themselves/dp/0932956378/ref=sr_1_1?ie=UTF8&amp;qid=1437613842&amp;sr=8-1&amp;keywords=landlording,2,2
"Power Gear 3-Wire Receptacle Tester, 50542",Tools & Home Improvement,https://www.amazon.com/GE-3-Wire-Receptacle-Tester-50542/dp/B002LZTKIA,8,1
"Kidde KL-2S Two-Story Fire Escape Ladder with Anti-Slip Rungs, 13-Foot",Tools & Home Improvement,https://www.amazon.com/Kidde-Two-Story-Escape-Anti-Slip-13-Foot/dp/B00005OU7B/ref=sr_1_1?ie=UTF8&amp;qid=1442458090&amp;sr=8-1&amp;keywords=fire+ladder,4,1
"Bosch GLM 15 Compact Laser Measure, 50-Feet (Discontinued by Manufacturer)",Tools & Home Improvement,https://www.amazon.com/GLM-15-Compact-Measure-50-Feet/dp/B00LGANH8K,2,1
If You Give a Mouse a Cookie (If You Give...),Books,https://www.amazon.com/If-You-Give-Mouse-Cookie/dp/0060245867/ref=sr_1_cc_1?s=aps&amp;ie=UTF8&amp;qid=1468617732,2,1
"Maglite Heavy-Duty Incandescent 4-Cell D Flashlight, Black",Tools & Home Improvement,https://www.amazon.com/Maglite-Heavy-Duty-Incandescent-4-Cell-Flashlight/dp/B00002N6SI/ref=sr_1_2?ie=UTF8&amp;qid=1470096340&amp;sr=8-2&amp;keywords=maglight,2,1
To Sell Is Human: The Surprising Truth About Moving Others,Books,https://www.amazon.com/Sell-Human-Surprising-Moving-Others/dp/1594631905,1,1
Zillow Talk: The New Rules of Real Estate,Books,https://www.amazon.com/Zillow-Talk-Rules-Real-Estate/dp/1455574740,1,1
Vipertek VTS-195 Heavy Duty Stun Gun with Rechargeable LED Tactical Flashlight - Black,Sports & Outdoors,https://www.amazon.com/VIPERTEK-VTS-195-Rechargeable-Tactical-Flashlight/dp/B00HPQ22XK/ref=sr_1_1?ie=UTF8&amp;qid=1435393348&amp;sr=8-1&amp;keywords=stun+gun+flashlight&amp;pebp=1435393354373&amp;perid=0E3X7CVGHTTTZD1Z40SC,1,1
"The Conversion Code: Capture Internet Leads, Create Quality Appointments, Close More Sales",Books,https://www.amazon.com/Conversion-Code-Capture-Internet-Appointments/dp/1119211883,1,1
ChiChinLighting LED Motion Sensor Light Bulb 6 Watts Warm White PIR LED Light G60 E26 E27 Base,Tools & Home Improvement,https://www.amazon.com/ChiChinLighting-Motion-Sensor-Light-Watts/dp/B008VVWU62/ref=sr_1_6?ie=UTF8&amp;qid=1464792818&amp;sr=8-6&amp;keywords=motion+sensing+light+bulb,1,1
The Complete Guide to Buying and Selling Apartment Buildings,Books,https://www.amazon.com/Complete-Buying-Selling-Apartment-Buildings/dp/0471684058/,1,1
Every Landlord's Tax Deduction Guide,Books,https://www.amazon.com/Every-Landlords-Tax-Deduction-Guide/dp/1413322395/,1,1
Every Landlord's Legal Guide,Books,https://www.amazon.com/Every-Landlords-Legal-Marcia-Stewart/dp/1413322832/,1,1
Leases & Rental Agreements,Books,https://www.amazon.com/Leases-Rental-Agreements-Marcia-Stewart/dp/1413321801/,1,1
"Every Landlord's Guide to Managing Property: Best Practices, From Move-In to Move-Out",Books,https://www.amazon.com/Every-Landlords-Guide-Managing-Property/dp/1413322158/,1,1
name,category,amazon_link,total_mentions,subreddit_mentions
"Passion Lubes, Natural Water-Based Lubricant, 55 Gallon Drum","Health, Household & Baby Care",https://www.amazon.com/Passion-Lubes-Natural-Water-Based-Lubricant/dp/B005MR3IVO/,74,1
"United Surgical Tens 7000 Tens Unit - Tens Machine for Pain Management, Back Pain and Rehabilitation",Industrial & Scientific,https://www.amazon.com/gp/product/B00NCRE4GO/ref=zg_bs_8627079011_1/162-3128250-9983105?ie=UTF8&amp;psc=1&amp;refRID=N78CAN4G3R9YBQ1AVWA5,4,1
Batman: The Man Who Laughs,Books,https://www.amazon.com/Batman-Man-Laughs-Ed-Brubaker/dp/1401216269,3,1
Efashionmx Womens Full Body Cage Harness Bodysuit,"Clothing, Shoes & Jewelry",https://www.amazon.com/Efashionmx-Womens-Full-Harness-Bodysuit/dp/B00VZE46B4,2,1
The Grit Guard Insert (Red) - Fits 12 inch Diameter Bucket,Automotive Parts & Accessories,https://www.amazon.com/dp/B000N3W8J0/ref=cm_sw_r_other_awd_gHiXwb3CZR4M9,2,1
"HTC One M7  Factory Unlocked Cellphone, 32GB, Silver",Cell Phones & Accessories,https://www.amazon.com/HTC-One-Factory-Unlocked-Cellphone/dp/B00CMVLH66/ref=sr_1_1?s=wireless&amp;ie=UTF8&amp;qid=1445922864&amp;sr=1-1&amp;keywords=htc,2,1
"12"" Vintage Roman Numeral Design Wood Clock - Eruner France Paris *Café De La Gare* Colourful French Country Tuscan Style Non-Ticking Silent Wooden Wall Clock (#03, Non-Ticking)",Home & Kitchen,https://www.amazon.com/Vintage-Roman-Numeral-Design-Clock/dp/B00XVQNWFA,1,1
New Light Blue And Pink Sexy Cute Lingerie Babydoll Dress + G-striing Chemise,"Clothing, Shoes & Jewelry",https://www.amazon.com/Light-Lingerie-Babydoll-G-striing-Chemise/dp/B0079V85GY/ref=redir_mobile_desktop?_encoding=UTF8&pc_redir=T1&ref_=redir_mdp_mobile_siteViewPreference,1,1
SwimWays Flood Force Stryker Water Gun - 3 Pack,Toys & Games,https://www.amazon.com/Orange-Purple-Stryker-Blaster-Squirt/dp/B00XDCS8TW,1,1
"Rene Rofe Women's Lace Extreme V Teddy, Black, M/L","Clothing, Shoes & Jewelry",https://www.amazon.com/dp/B006B3T5FQ/ref=cm_sw_r_cp_apa_wJ6IxbQMCPX51,1,1
Casabella Latex Free Heavy Duty Rubber Gloves,Home & Kitchen,https://www.amazon.com/Casabella-Latex-Heavy-Rubber-Gloves/dp/B00556HHSC,1,1
Tracy's Dog 8 Inch Liquid Silicone Realistic Odorless Dildo Fleshlike Penis with Suction Cup (Flesh),"Health, Household & Baby Care",https://www.amazon.com/Tracys-Dog-Silicone-Realistic-Fleshlike/dp/B01FA4EW36/ref=cm_cr_arp_d_product_top?ie=UTF8,1,1
Deck of Nude Models - 54 Coated Playing Cards,Toys & Games,https://www.amazon.com/Deck-Nude-Models-Coated-Playing/dp/B001FVAGFW,1,1
Fever Women's Fingerless Lace Gloves In Display Pack,"Clothing, Shoes & Jewelry",https://www.amazon.com/Fever-Womens-Fingerless-Gloves-98251/dp/B000HG6USS/ref=redir_mobile_desktop?_encoding=UTF8&%2AVersion%2A=1&%2Aentries%2A=0,1,1
name,category,amazon_link,total_mentions,subreddit_mentions
"Crazy Aaron's Thinking Putty, 3.2 Ounce, Super Magnetic Strange Attractor",Toys & Games,https://www.amazon.com/Crazy-Aarons-Thinking-Putty-3-2oz/dp/B001BS3FHU,4,1
Levitating Air Bonsai Pot - Magnetic Levitation Suspension flower and air bonsai pot,"Patio, Lawn & Garden",https://www.amazon.com/Levitating-Air-Bonsai-Pot-Levitation/dp/B01JFBK8HO?ie=UTF8&amp;keywords=air,2,1
"Toysmith Bubble Motion Tumbler, Pack of 1",Toys & Games,https://www.amazon.com/dp/B004USMMVS/ref=cm_sw_r_cp_apa_Ju9Czb7DEFDQW,1,1
Kindling Cracker Firewood Kindling Splitter,"Patio, Lawn & Garden",https://www.amazon.com/dp/B00ZFS960C,1,1
6 inch Liquid Timer with Light (Age 10+) - mesmerizing to watch,Toys & Games,https://www.amazon.com/dp/B011VSZ0VS/ref=cm_sw_r_cp_api_qG8CzbSDFX5PM,1,1
Levitating Air Bonsai Pot - Magnetic Levitation Suspension flower and air bonsai pot,Home & Kitchen,https://www.amazon.com/Levitating-Air-Bonsai-Pot-Levitation/dp/B01EVF8OIO,1,1
In the Land of the Lawn Weenies: and Other Warped and Creepy Tales (Weenies Stories),Books,https://www.amazon.com/In-Land-Lawn-Weenies-Stories/dp/0765345706,1,1
name,category,amazon_link,total_mentions,subreddit_mentions
"Return of the King: LeBron James, the Cleveland Cavaliers and the Greatest Comeback in NBA History",Books,https://www.amazon.com/Return-King-Cleveland-Cavaliers-Greatest/dp/1478971681,2,1
"Open Pit Barbecue Sauce, Original, 18 Ounce (Pack of 6)",Grocery & Gourmet Food,https://www.amazon.com/Open-Pit-Barbecue-Sauce-Original/dp/B0057FTA1S?th=1,1,1
name,category,amazon_link,total_mentions,subreddit_mentions
The Real Madrid Way: How Values Created the Most Successful Sports Team on the Planet,Books,https://www.amazon.com/Real-Madrid-Way-Created-Successful/dp/1942952546/ref=sr_1_1?s=books&amp;ie=UTF8&amp;qid=1486486692&amp;sr=1-1&amp;keywords=real+madrid,2,2
Real Madrid Socks Blue with Gold Trim,"Clothing, Shoes & Jewelry",https://www.amazon.com/gp/product/B01MYHD2FN/ref=oh_aui_detailpage_o00_s00?ie=UTF8&amp;psc=1,1,1
Real Madrid Socks,"Clothing, Shoes & Jewelry",https://www.amazon.com/gp/product/B01N2BIM3Y/ref=oh_aui_detailpage_o00_s00?ie=UTF8&amp;psc=1,1,1
name,category,amazon_link,total_mentions,subreddit_mentions
"Sunscreen Flask, Secret Flask Flask, 2-Pack (8 oz)",Home & Kitchen,https://www.amazon.com/Hidden-Flasks-Disguised-Sunscreen-Complementary/dp/B01A8NTT1O?ie=UTF8&amp;psc=1&amp;redirect=true&amp;ref_=oh_aui_detailpage_o05_s00,1,1
name,category,amazon_link,total_mentions,subreddit_mentions
BEHRINGER U-PHORIA UM2,Musical Instruments,https://www.amazon.com/Behringer-U-PHORIA-UM2-BEHRINGER/dp/B00EK1OTZC/ref=sr_1_4?s=musical-instruments&amp;ie=UTF8&amp;qid=1482371614&amp;sr=1-4&amp;keywords=audio+interface,3,1
VicTsing USB IN-OUT MIDI Cable Converter PC to Music Keyboard Adapter Cord,Musical Instruments,https://www.amazon.com/VicTsing-Cable-Converter-Keyboard-Adapter/dp/B00ACGMOA6/ref=sr_1_4?ie=UTF8&amp;qid=1482371577&amp;sr=8-4&amp;keywords=midi+interface,2,1
[DISCONTINUED] Line 6 POD HD Guitar Desktop Multi-Effects,Musical Instruments,https://www.amazon.com/Line-POD-Guitar-Desktop-Multi-Effects/dp/B004TGVRB2,1,1
name,category,amazon_link,total_mentions,subreddit_mentions
HarperCollins Study Bible - Student Edition: Fully Revised & Updated,Books,https://www.amazon.com/HarperCollins-Study-Bible-Student-Revised/dp/0060786841/,4,1
New American Bible,Books,https://www.amazon.com/Bible-NABRE-American-Bible-Society/dp/1585169919/,1,1
name,category,amazon_link,total_mentions,subreddit_mentions
Blue Microphones Snowball iCE Microphone à condensateur Cardioïde Noir,Musical Instruments,https://www.amazon.com/Blue-Snowball-Condenser-Microphone-Cardioid/dp/B014PYGTUQ?th=1&amp;psc=1,4,1
name,category,amazon_link,total_mentions,subreddit_mentions
"Instant Pot DUO60 6 Qt 7-in-1 Multi-Use Programmable Pressure Cooker, Slow Cooker, Rice Cooker, Steamer, Sauté, Yogurt Maker and Warmer",Home & Kitchen,https://www.amazon.com/Instant-Pot-Multi-Use-Programmable-Pressure/dp/B00FLYWNYQ/ref=sr_1_1?s=kitchen&amp;ie=UTF8&amp;qid=1500240880&amp;sr=1-1&amp;keywords=instant+pot,25,1
Thug Kitchen: The Official Cookbook: Eat Like You Give a F*ck,Books,https://www.amazon.com/Thug-Kitchen-Official-Cookbook-Like/dp/1623363586/,8,1
Wabash Valley Farms Whirley-Pop Stovetop Popcorn Popper,Home & Kitchen,https://www.amazon.com/Wabash-Valley-Farms-Whirley-Pop-Stovetop/dp/B00004SU35,6,1
660 Curries,Books,https://www.amazon.com/660-Curries-Raghavan-Iyer/dp/0761137874/ref=sr_1_1?ie=UTF8&amp;qid=1463968059&amp;sr=8-1&amp;keywords=660+curries,4,1
"WillPowder Sodium Citrate, 16-Ounce Jar",Grocery & Gourmet Food,https://www.amazon.com/WillPowder-Sodium-Citrate-16-Ounce-Jar/dp/B00250Y9Y6,4,1
"The Indian Slow Cooker: 50 Healthy, Easy, Authentic Recipes",Books,https://www.amazon.com/dp/1572841117/ref=cm_sw_r_cp_awd_9lxKwbGTE9HSA,3,1
Deceptively Delicious: Simple Secrets to Get Your Kids Eating Good Food,Books,https://www.amazon.com/Deceptively-Delicious-Simple-Secrets-Eating/dp/006176793X/ref=sr_1_2?s=books&amp;ie=UTF8&amp;qid=1454969677&amp;sr=1-2&amp;keywords=hidden+vegetable+cookbook,2,1
"Norpro Silicone Round Pancake/Egg Rings, 2 Pieces",Home & Kitchen,https://www.amazon.com/gp/product/B001ULC93O,2,1
"Herbox Granular Sodium Free Chicken Bouillon, 3.3-Ounce (Pack of 6)",Grocery & Gourmet Food,https://www.amazon.com/Herbox-Granular-Chicken-Bouillon-3-3-Ounce/dp/B00473P6PA/ref=sr_1_fkmr0_2_a_it?ie=UTF8&amp;qid=1478016052&amp;sr=8-2-fkmr0&amp;keywords=oxo+sodium+free+chicken+bouillon,2,1
"Las Fiestas De Frida y Diego, Recuerdos y Recetas",Books,https://www.amazon.com/Fiestas-Frida-Diego-Recuerdos-Recetas/dp/9683911811/ref=pd_sim_sbs_b_2?ie=UTF8&amp;amp;refRID=02HSVSNTN53S17Y9VXE7,1,1
"Sadaf Special Blend Tea with Cardamom Flavor, 50 Tea Bags",Grocery & Gourmet Food,https://www.amazon.com/Sadaf-Special-Blend-Cardamom-Flavor/dp/B003TYNBHI?th=1,1,1
"Update International (SPH-1004) 4"" Full-Size Anti-Jam Steam Table Pan",Home & Kitchen,https://www.amazon.com/Update-International-SPH-1004-Full-Size-Anti-Jam/dp/B002XYCQC6/ref=sr_1_1?s=kitchen&amp;ie=UTF8&amp;qid=1471992514&amp;sr=1-1&amp;keywords=full+size+hotel+pan,1,1
The Starving Student's Cookbook,Books,https://www.amazon.com/Starving-Students-Cookbook-Dede-Napoli/dp/0446381454/ref=sr_1_4?s=books&amp;ie=UTF8&amp;qid=1462371986&amp;sr=1-4&amp;keywords=starving+students+cookbook,1,1
Herb-ox Bouillon Packets Beef Instant Broth & Seasoning Sodium Free 1.1 Oz Box (Gluten Free) 2 Pack by Herb-Ox,Grocery & Gourmet Food,https://www.amazon.com/Herb-ox-Bouillon-Packets-Seasoning-Herb-Ox/dp/B00U9W71JM/ref=sr_1_fkmr0_2_a_it?ie=UTF8&amp;qid=1478015865&amp;sr=8-2-fkmr0&amp;keywords=oxo+sodium+free+beef+bouillon,1,1
Deluxe Large Cookbook Holder - Acrylic Shield With Cherry Wood Base - Made in the USA,Home & Kitchen,https://www.amazon.com/Deluxe-Large-Cookbook-Holder-Cherry/dp/B0000DE1MV,1,1
"Goya Mojo Criollo Marinade, 24.50-Ounce Bottle (Pack of 2)",Grocery & Gourmet Food,https://www.amazon.com/Goya-Criollo-Marinade-24-50-Ounce-Bottle/dp/B00032CV8O,1,1
Anchovy Style Sprats Fillets by Abba of Sweden (4.4 ounce),Grocery & Gourmet Food,https://www.amazon.com/Anchovy-Style-Sprats-Fillets-Sweden/dp/B005BHYOO0/ref=pd_cp_325_2?_encoding=UTF8&amp;pd_rd_i=B005BHYOO0&amp;pd_rd_r=JMJM7DRA8N5ARMV3XHN7&amp;pd_rd_w=mEmmJ&amp;pd_rd_wg=Lvbw9&amp;psc=1&amp;refRID=JMJM7DRA8N5ARMV3XHN7,1,1
Rose Cooking Wine (Mei Kuei Lu Chiew) - 16.5fl Oz [Pack of 1],Grocery & Gourmet Food,https://www.amazon.com/Rose-Cooking-Wine-Kuei-Chiew/dp/B00886MDGC/ref=sr_1_1_a_it?ie=UTF8&amp;qid=1493215891&amp;sr=8-1&amp;keywords=rose+cooking+wine,1,1
Weber Salt & Gluten Free No MSG Steak Seasoning (7.25 oz),Grocery & Gourmet Food,https://www.amazon.com/Weber-Salt-Gluten-Steak-Seasoning/dp/B00U20W39O/ref=sr_1_1_a_it?ie=UTF8&amp;qid=1478017236&amp;sr=8-1&amp;keywords=weber+salt+free+steak+seasoning,1,1
Ancient Brews: Rediscovered and Re-created,Books,https://www.amazon.com/Ancient-Brews-Rediscovered-Patrick-McGovern/dp/0393253805,1,1
LEM Products 2 1/2 x 20-Inch Non-Edible Fibrous Casing,Sports & Outdoors,https://www.amazon.com/LEM-Products-20-Inch-Non-Edible-Mahogany/dp/B002L7UPUK/,1,1
"Eat Mexico: Recipes from Mexico City’s Streets, Markets & Fondas",Books,https://www.amazon.com/Eat-Mexico-Recipes-Streets-Markets/dp/1909487279,1,1
"Uncorking the Past: The Quest for Wine, Beer, and Other Alcoholic Beverages",Books,https://www.amazon.com/Uncorking-Past-Quest-Alcoholic-Beverages/dp/0520267982,1,1
name,category,amazon_link,total_mentions,subreddit_mentions
One Fish Two Fish Red Fish Blue Fish (I Can Read It All by Myself),Books,https://www.amazon.com/One-Fish-Blue-Read-Myself/dp/0394800133/ref=sr_1_1?ie=UTF8&amp;qid=1488199150&amp;sr=8-1,1,1
name,category,amazon_link,total_mentions,subreddit_mentions
Forklift truck simulator,Video Games,https://www.amazon.com/Forklift-truck-simulator-Pc/dp/B0034G4V1G,1,1
name,category,amazon_link,total_mentions,subreddit_mentions
Manchester United: A Thematic Study,Books,https://www.amazon.com/Manchester-United-A-Thematic-Study/dp/0415333342,1,1
Red: My Autobiography,Books,https://www.amazon.com/Gary-Neville-Red-Autobiography-Hardcover/dp/B00RWSX73A/ref=sr_1_3?ie=UTF8&amp;qid=1433710877&amp;sr=8-3&amp;keywords=gary+neville,1,1
Nanostad Manchester United Old Trafford Stadium 3D Puzzle,Toys & Games,https://www.amazon.com/Nanostad-Manchester-United-Trafford-Stadium/dp/B00G5KCIMM/ref=sr_1_2?ie=UTF8&amp;qid=1453185909&amp;sr=8-2&amp;keywords=old+trafford+puzzle,1,1
name,category,amazon_link,total_mentions,subreddit_mentions
The Quiet Game (Penn Cage),Books,https://www.amazon.com/Quiet-Game-Penn-Cage-Novels/dp/0451180429,1,1
name,category,amazon_link,total_mentions,subreddit_mentions
"Aqueon 06226 Mini Siphon Vacuum Aquarium Gravel Cleaner, 5-Inch",Pet Supplies,https://www.amazon.com/Aqueon-Siphon-Vacuum-Aquarium-Cleaner/dp/B004RK40VY/ref=sr_1_3?s=pet-supplies&amp;ie=UTF8&amp;qid=1469123904&amp;sr=1-3&amp;keywords=gravel+vacuum,3,1
"Just a Geek: Unflinchingly honest tales of the search for life, love, and fulfillment beyond the Starship Enterprise",Books,https://www.amazon.com/Just-Geek-Unflinchingly-fulfillment-Enterprise/dp/0596806310/,1,1
Encyclopedia Brown's record book of weird and wonderful facts,Books,https://www.amazon.com/Encyclopedia-Browns-record-weird-wonderful/dp/0440023297,1,1
Tetra AquaSafe PLUS Water Treatment,Pet Supplies,https://www.amazon.com/Tetra-16163-AquaSafe-Conditioner-33-8-Ounce/dp/B00176CVK8/ref=sr_1_4?s=pet-supplies&amp;ie=UTF8&amp;qid=1469123562&amp;sr=1-4&amp;keywords=water+conditioner,1,1
"Exotic PMS0510 Polished Gravel, Mixed, 5 Pounds, 3/8-Inch",Pet Supplies,https://www.amazon.com/Exotic-PMS0510-Polished-Gravel-Pounds/dp/B006MKZHFU/ref=sr_1_5?s=pet-supplies&amp;ie=UTF8&amp;qid=1469123417&amp;sr=1-5&amp;keywords=aquarium+gravel,1,1
SHEENROAD Aquarium Rubber Slim Heating Plate 15W Tank Shatter Proof Heater (15W-(19-38L)-MH150),Pet Supplies,https://www.amazon.com/SHEENROAD-Aquarium-Rubber-Heating-Shatter/dp/B00X5GPKZG/ref=sr_1_15?s=pet-supplies&amp;ie=UTF8&amp;qid=1469123334&amp;sr=1-15&amp;keywords=10+gallon+heater,1,1
Marina LED Aquarium Kit,Pet Supplies,https://www.amazon.com/Marina-LED-Aquarium-Kit-gallon/dp/B0173I55JM/ref=sr_1_3?ie=UTF8&amp;qid=1469122882&amp;sr=8-3&amp;keywords=10+gallon+tank,1,1
name,category,amazon_link,total_mentions,subreddit_mentions
"Instant Pot DUO60 6 Qt 7-in-1 Multi-Use Programmable Pressure Cooker, Slow Cooker, Rice Cooker, Steamer, Sauté, Yogurt Maker and Warmer",Home & Kitchen,https://www.amazon.com/Instant-Pot-IP-DUO60-Multi-Functional-Pressure/dp/B00FLYWNYQ/ref=sr_1_2?s=kitchen&amp;ie=UTF8&amp;qid=1480365077&amp;sr=1-2&amp;keywords=instapot,25,1
Never Split the Difference: Negotiating As If Your Life Depended On It,Books,https://www.amazon.com/Never-Split-Difference-Negotiating-Depended/dp/0062407805?ie=UTF8&amp;psc=1&amp;redirect=true&amp;ref_=oh_aui_detailpage_o00_s00,4,1
How Doctors Think,Books,https://www.amazon.com/How-Doctors-Think-Jerome-Groopman/dp/0547053649/ref=sr_1_1?ie=UTF8&amp;qid=1468008223&amp;sr=8-1&amp;keywords=how+doctors+think,1,1
Hug Time,Books,https://www.amazon.com/Hug-Time-Patrick-McDonnell/dp/0316182958/ref=sr_1_1_twi_boa_2?s=books&amp;ie=UTF8&amp;qid=1439698653&amp;sr=1-1&amp;keywords=hug+time+board+book,1,1
Stuck,Books,https://www.amazon.com/Stuck-Oliver-Jeffers/dp/0399257373,1,1
GAMT Night Driving Glasses Anti Glare Vision Driver Safety Sunglasses,"Clothing, Shoes & Jewelry",https://www.amazon.com/Driving-Glasses-Vision-Driver-Sunglasses/dp/B011L5T36O/ref=sr_1_31?ie=UTF8&amp;qid=1466889882&amp;sr=8-31&amp;keywords=night+driving+glasses,1,1
Panda Small Compact Portable Washing Machine(10lbs Capacity)XPB45 -Larger Size,Appliances,https://www.amazon.com/dp/B00KY5V4M4/ref=psdc_13397451_t2_B00AW04ZMM,1,1
Not by the Sword: How a Cantor and His Family Transformed a Klansman,Books,https://www.amazon.com/Not-Sword-Cantor-Transformed-Klansman/dp/0803264763,1,1
name,category,amazon_link,total_mentions,subreddit_mentions
Staedtler Triplus Fineliner Black 0.3mm - Pack of Six,Office Products,https://www.amazon.com/Staedtler-Triplus-Fineliner-Black-0-3mm/dp/B009CQKL3Y/ref=sr_1_6?s=office-products&amp;ie=UTF8&amp;qid=1442206558&amp;sr=1-6&amp;keywords=Staedtler+Triplus+Fineliner,2,1
The Pencil,Books,https://www.amazon.com/The-Pencil-Paul-Calle/dp/0891341188,1,1
"Pentel Arts Aquash Pigment Ink Brush, Light Black Ink, Pack of 1 (FRHMNBPA)",Office Products,https://www.amazon.com/Pentel-Aquash-Pigment-Brush-FRHMNBPA/dp/B005JDEX38/,1,1
name,category,amazon_link,total_mentions,subreddit_mentions
Bliss Kiss Simply Peel Latex Peel Off Cuticle Guard for Nail Art | 15 ml (Patent Pending) | Made in the USA,Beauty & Personal Care,https://www.amazon.com/Bliss-Kiss-Simply-Barrier-Pending/dp/B00UB7WX3O/ref=sr_1_2_a_it?ie=UTF8&amp;qid=1482960107&amp;sr=8-2&amp;keywords=simply+kiss,3,3
"Nail Polish Holder Grip & Tip and Nail Art Surprise! The Original, Best Nail Polish Bottle Holder - Anti-Spill Nail Polish Holder - No Mess, Saves Time & Money - Perfect for DIY Nail Art (White)",Beauty & Personal Care,https://www.amazon.com/Grip-Tip-Nail-Polish-Holder/dp/B002FBT6M0,3,2
Konad Nail Art Double Ended Stamper And Scraper,Beauty & Personal Care,https://www.amazon.com/gp/product/B002MZ8BK2/ref=oh_aui_detailpage_o00_s00?ie=UTF8&amp;psc=1,3,2
Pack of 4 - GOGOONLY 50 Clear Tips Fan-shaped Nail Art Display Chart Acrylic False Tips Practice Tool - 200 Tips in Total-BH000472,Beauty & Personal Care,https://www.amazon.com/gp/product/B00SKBXXS2/ref=oh_aui_detailpage_o00_s01?ie=UTF8&amp;psc=1,2,2
"Diamond Gloves Black Advance Nitrile Examination Powder-Free Gloves, Heavy Duty, Small, 100 Count","Health, Household & Baby Care",https://www.amazon.com/gp/product/B00BC14HRS?psc=1&amp;redirect=true&amp;ref_=oh_aui_detailpage_o07_s01,2,2
Temperature Changing UV Soak Off Gel Nail Polish – Professional Grade – Requires UV or LED Nail Lamp – BONUS Downloadable at Home Gel Nail Guide Included,Beauty & Personal Care,https://www.amazon.com/dp/B00LBIQDJM/ref=mp_s_a_1_1?qid=1427822271&amp;sr=8-1&amp;keywords=DIY+hard+nails+cola,2,2
"Great Lakes Gelatin Collagen Hydrolysate Beef, Kosher, 16 oz.",Grocery & Gourmet Food,https://www.amazon.com/Great-Lakes-Gelatin-Collagen-Hydrolysate/dp/B005KG7EDU/ref=sr_1_1_a_it?ie=UTF8&amp;qid=1500585071&amp;sr=8-1&amp;keywords=gelatin,4,1
Sally Hansen Insta-Dri Anti-Chip Top Coat 2755 Clear,Beauty & Personal Care,https://www.amazon.com/Sally-Hansen-Insta-Dri-Anti-Chip-Clear/dp/B000AA5VD6,3,1
SanDisk Cruzer Fit CZ33 16GB USB 2.0 Low-Profile Flash Drive- SDCZ33-016G-B35,Electronics,https://www.amazon.com/SanDisk-Cruzer-Low-Profile-Drive-SDCZ33-016G-B35/dp/B005FYNSZA?sa-no-redirect=1,2,1
"INM Out The Door Top Coat, 0.5 Ounce",Beauty & Personal Care,https://www.amazon.com/INM-Out-Door-Coat-Ounce/dp/B000EVGQ8U/ref=sr_1_2_a_it?ie=UTF8&amp;qid=1503641956&amp;sr=8-2&amp;keywords=inm+out+the+door+top+coat,2,1
Sannysis Nail Stamping Printing Plate Manicure Nail Art Decor Image Stamps Plate,Beauty & Personal Care,https://www.amazon.com/gp/product/B00X6V7BRU/ref=ya_st_dp_summary,2,1
"OldShark 3 in 1 HD Universal Fisheye Lens & Macro Lens & Wide Angle Lens, 360 Degree Rotate Shark Tail Long Clip Cell Phone Camera Lens Kits for iPhone 7/7 Plus, Samsung & Most Smartphones【Upgraded S1】",Cell Phones & Accessories,https://www.amazon.com/OldShark-Upgraded-Version-Samsung-Blackberry/dp/B00UYB0IPW,2,1
PORTWORLD Nail Polish Bottle Shaped 16GB USB 2.0 Flash Drive - Rose,Electronics,https://www.amazon.com/dp/B00N5R500A/ref=cm_sw_r_cp_apap_iCyxHx3EqiU6j,1,1
Malloom 2.8cm Clear Nail Art Stamper Scraper Image Transfer Manicure Tool for DIY,Beauty & Personal Care,https://www.amazon.com/dp/B01A1X8O1C/ref=sr_rp_1_a_it?m=A1BRCE6PO6IPWL&amp;ie=UTF8&amp;qid=1458526798&amp;sr=sr-1&amp;keywords=Clear+stamper,1,1
tweexy The Wearable Nail Polish Holder in Bonbon Pink,Beauty & Personal Care,https://www.amazon.com/dp/B017QRYX1G,1,1
"Holo Pure Powder, Magic Powder, Mirror Powder Holographic CHOOSE BASIC KIT or DELUXE KIT for Nails (Deluxe Holo Pure Kit)",Beauty & Personal Care,https://www.amazon.com/gp/product/B01IWN6DKW/ref=oh_aui_search_detailpage?ie=UTF8&amp;psc=1,1,1
Meolin Bohemian Turquoise Ethnic Boho Open Midi Knuckle Ring Set,"Arts, Crafts & Sewing",https://www.amazon.com/Meolin-Bohemian-Turquoise-Ethnic-Knuckle/dp/B06Y3TKSXB/ref=redir_mobile_desktop?_encoding=UTF8&amp%3BdpID=61D7ZKiKtXL&amp%3BdpPl=1&amp%3Bkeywords=boho%20ring%20set&amp%3Bpi=AC_SX236_SY340_QL65&amp%3Bqid=1499642729&amp%3Bref=plSrch&amp%3Bsr=8-22&ref_=mp_s_a_1_22,1,1
Nail Powder Mirror SELA BEAUTY 12 Colors 12 bottles Magic Mirror Chrome Effect Metallic INCLUDE 1 HOLOGRAPHIC RAINBOW JAR,Beauty & Personal Care,https://www.amazon.com/bottles-Metallic-INCLUDE-HOLOGRAPHIC-RAINBOW/dp/B01K5I3LS4/ref=redir_mobile_desktop?_encoding=UTF8&psc=1,1,1
"Orly Nail Dryer, Sec'n Dry, 0.6 Ounce",Beauty & Personal Care,https://www.amazon.com/Orly-Nail-Dryer-Secn-Ounce/dp/B00F97BMVK/ref=sr_1_1_s_it?s=beauty&amp;ie=UTF8&amp;qid=1503642016&amp;sr=1-1&amp;keywords=orly+sec+n+dry,1,1
ECBASKET Stiletto Nails Acrylic Nail Tips Natural Fake Nails Long Claw Nails For Women Teens Girls 500 PCS With Box,Beauty & Personal Care,https://www.amazon.com/ECBASKET-Stiletto-Nails-Acrylic-Natural/dp/B015O9NG9S/ref=redir_mobile_desktop?_encoding=UTF8&amp%3Bkeywords=ECBASKET-HOT&amp%3Bqid=1491871707&amp%3Bsr=8-5&ref_=mp_s_a_1_5_a_it,1,1
Rainbow Cherry Flavored Candy Canes 12ct,Grocery & Gourmet Food,https://www.amazon.com/Rainbow-Cherry-Flavored-Candy-Canes/dp/B00E9O0094,1,1
Winstonia Third Generation Nail Art Stamping Image Plates Set 20 Pcs - Full Plate Designs for Unlimited Creativity,Beauty & Personal Care,https://www.amazon.com/Winstonia-Third-Generation-Stamping-Plates/dp/B00US684HC,1,1
"LECHAT Perfect Match Mood Gel Polish, Skies The Limit, 0.500 Ounce",Beauty & Personal Care,https://www.amazon.com/Nobility-Perfect-Match-Skies-Limit/dp/B00A84MTWA,1,1
