name,category,amazon_link,total_mentions,subreddit_mentions
"Chessex Dice: Twenty Sided Dice - D20 - Random Group of Twenty Sided Die (You Pick How Many You Want), 6 Dice",Toys & Games,https://www.amazon.com/Chessex-Dice-Twenty-Sided-Random/dp/B00132G3SC/ref=sr_1_17?ie=UTF8&amp;qid=1431614439&amp;sr=8-17&amp;keywords=20+sided+dice,1,1
Princeless Book 1:  Save Yourself,Books,https://www.amazon.com/Princeless-Book-1-Save-Yourself/dp/1450798942,1,1
"Post-it Tabs, 2-Inch Solid, Assorted Colors, 6-Tabs/Color, 5-Colors, 30-Tabs/Pack",Office Products,https://www.amazon.com/dp/B00QL27XMY/ref=cm_sw_r_other_apa_XTQnxb3KHW7XW,1,1
"Tinksky Mini Tiny Purple Glass Cork Bottles Round Flat Vial Wishing Bottle DIY Pendants for Wedding Valentine's Day gift DIY, Arts Crafts, Projects, Party Favors, Pack of 10",Home & Kitchen,https://www.amazon.com/Tinksky-Bottles-Pendants-Valentines-Projects/dp/B01LL5C7FS/ref=sr_1_3?ie=UTF8&amp;qid=1491826735&amp;sr=8-3&amp;keywords=tiny+round+glass+bottles,1,1
Redbeans When the DM Smiles Classic Coffee Mug,Home & Kitchen,https://www.amazon.com/Redbeans-When-Smiles-Classic-Coffee/dp/B0144BP0WS,1,1
126 Polyhedral Dice - 18 colors w/ Complete set of d4 d6 d8 d10 d12 d20 d%,Toys & Games,https://www.amazon.com/dp/B014242Q7Y/ref=cm_sw_r_cp_api_Vf8uxbM1JKKXE,1,1
Expedition to Castle Ravenloft (Dungeons & Dragons d20 3.5 Fantasy Roleplaying Supplement),Books,https://www.amazon.com/Expedition-Ravenloft-Dungeons-Roleplaying-Supplement/dp/078693946X,1,1
Dungeons and Dragons Starter Set,Toys & Games,https://www.amazon.com/Dungeons-and-Dragons-Starter-Set/dp/B00O1S4R74,1,1
Confessions of a Part-time Sorceress: A Girl's Guide to the D&D Game (Dungeons & Dragons),Books,https://www.amazon.com/Confessions-Part-time-Sorceress-Dungeons-Dragons/dp/0786947268/ref=asap_bc?ie=UTF8,1,1
Winsome Wood Bed Tray,Home & Kitchen,https://www.amazon.com/Winsome-Wood-98821-Bed-Tray/dp/B001U88698/ref=sr_1_5?ie=UTF8&amp;qid=1465167421&amp;sr=8-5&amp;keywords=bed+table,1,1
"Reversible Battlemat, 1 1/2""",Toys & Games,https://www.amazon.com/Reversible-Battlemat-1-2/dp/B00IVF4XI6/ref=sr_1_cc_4?s=aps&amp;ie=UTF8&amp;qid=1422785419&amp;sr=1-4-catcorr&amp;keywords=chessex+d,1,1
"Charles Leonard Dry Erase Lapboard Class Pack, Includes 12 each of Whiteboards, 2 Inch Felt Erasers and Black Dry Erase Markers  (35036)",Office Products,https://www.amazon.com/Charles-Leonard-Lapboard-Whiteboards-35036/dp/B00JFKQTPG/ref=sr_1_1?ie=UTF8&amp;qid=1470926321&amp;sr=8-1&amp;keywords=12,1,1
Decision Dice: Your every questions answered (Book-in-a-Box),Books,https://www.amazon.com/Decision-Dice-questions-Book-Box/dp/1859061486,1,1
niceEshop(TM) Women Brown Retro Old Stye Unique Wooden Jewelry Box Case,Home & Kitchen,https://www.amazon.com/niceEshop-Women-Unique-Wooden-Jewelry/dp/B00M172HP6?ie=UTF8&amp;*Version*=1&amp;*entries*=0,1,1
Simply Amazing! Q-Workshop Polyhedral 7-Die Set: GLOW IN DARK Carved Elvish Dice Set (Elven) Black with Glow-in-the-Dark Numbers,Toys & Games,https://www.amazon.com/gp/product/B001926KH0?psc=1&amp;redirect=true&amp;ref_=oh_aui_detailpage_o07_s04,1,1
Table Fables: A collection of tables for the weary game master,Books,https://www.amazon.com/Table-Fables-collection-tables-master/dp/1542678595,1,1
Munchkin Player's Handbook (D20 Generic System),Books,https://www.amazon.com/Munchkin-Players-Handbook-Generic-System/dp/1556346670,1,1
Chessex Pearlescent 7 piece Red Cheater's Dice Set,Toys & Games,https://www.amazon.com/Chessex-Pearlescent-piece-Cheaters-Dice/dp/B00116080E,1,1
Polyhedral Dice,Toys & Games,https://www.amazon.com/Chessex-Polyhedral-Dice/dp/B000RZLOM6,1,1
"Crayola Air Dry Clay 2.5 Lb Bucket, White",Toys & Games,https://www.amazon.com/Crayola-Air-Clay-Bucket-White/dp/B000J07LF8,1,1
Glow 12 Sides Funny Dice for Bachelor Party or Adult Couples Novelty Gift,"Health, Household & Baby Care",https://www.amazon.com/Sides-Position-Bachelor-Couples-Novelty/dp/B013TD1VMU,1,1
Empire of Imagination: Gary Gygax and the Birth of Dungeons & Dragons,Books,https://www.amazon.com/Empire-Imagination-Gygax-Dungeons-Dragons/dp/1632862794/ref=pd_sim_14_1?ie=UTF8&amp;dpID=515zTJXi6UL&amp;dpSrc=sims&amp;preST=_AC_UL160_SR105,1,1
Life and a Half: A Novel (Global African Voices),Books,https://www.amazon.com/Life-Half-Global-African-Voices/dp/0253222877/ref=sr_1_1?s=books&amp;ie=UTF8&amp;qid=1492006328&amp;sr=1-1&amp;keywords=sony+labou+tansi,1,1
500 Game Pawns - 100 Blue Pawns - 100 Red Pawns - 100 Green Pawns - 100 Black Pawns - 100 Yellow Pawns - In DLS Labeled Plastic Grip Storage Container,Toys & Games,https://www.amazon.com/500-Game-Pawns-Labeled-Container/dp/B016TTD7CI/ref=sr_1_2?ie=UTF8&amp;qid=1475690340&amp;sr=8-2&amp;keywords=plastic+pawns,1,1
Woodland Scenics Hot Wire Foam Cutter,Toys & Games,https://www.amazon.com/Horizon-Hobby-Wire-Foam-Cutter/dp/B0006KSMEU,1,1
"Sculpey III Oven Bake Clay Sampler 1oz, 30/pkg",Toys & Games,https://www.amazon.com/Sculpey-30-1-Oven-Sampler-Colors/dp/B0000CGB68/ref=sr_1_2?s=toys-and-games&amp;ie=UTF8&amp;qid=1474393526&amp;sr=1-2&amp;keywords=polymer+clay,1,1
Tales of the Dying Earth,Books,https://www.amazon.com/Tales-Dying-Earth-Jack-Vance/dp/0312874561,1,1
Paxcoo 7 x 7 (49 Pieces) Polyhedral Dice with Pouches for Dungeons and Dragons DND RPG MTG D20 D12 D10 D8 D4,Toys & Games,https://www.amazon.com/Paxcoo-Polyhedral-Pouches-Dungeons-Dragons/dp/B01MDJNE93/ref=sr_1_2?ie=UTF8&amp;qid=1495470883&amp;sr=8-2&amp;keywords=paxcoo+dice,1,1
The Palm-Wine Drinkard and My Life in the Bush of Ghosts,Books,https://www.amazon.com/Palm-Wine-Drinkard-Life-Bush-Ghosts/dp/0802133630/ref=pd_sim_14_1?_encoding=UTF8&amp;pd_rd_i=0802133630&amp;pd_rd_r=D462KAVJHQZR3XWEQ3CE&amp;pd_rd_w=I5mMd&amp;pd_rd_wg=LRjX0&amp;psc=1&amp;refRID=D462KAVJHQZR3XWEQ3CE,1,1
Magic The Gathering: Arena of the Planeswalkers Shadows Over Innistrad Game,Toys & Games,https://www.amazon.com/Magic-Gathering-Planeswalkers-Shadows-Innistrad/dp/B01ALHAFFQ/ref=sr_1_3?ie=UTF8&amp;qid=1494916544&amp;sr=8-3&amp;keywords=Arena+of+the+Planeswalkers,1,1
Scandinavian Folk Belief and Legend (The Nordic Series),Books,https://www.amazon.com/Scandinavian-Belief-Legend-Nordic-Series/dp/0816619670,1,1
"Avery Removable Color Coding Labels, 0.25 Inches, Assorted, Round, Pack of 768 (5795)",Office Products,https://www.amazon.com/Avery-Removable-Coding-Labels-Assorted/dp/B000BMBU9M,1,1
"Ampad 24-032R Evidence Flip Chart Pads Ruled with 1-Inch Squares, 27x34, 50 Sheets Per Pad, 2 Pads Per Pack",Office Products,https://www.amazon.com/Ampad-24-032R-Evidence-1-Inch-Squares/dp/B00006I9X8/ref=sr_1_2?ie=UTF8&amp;qid=1489096347&amp;sr=8-2&amp;keywords=easel+paper+grid,1,1
Ikea Fantasivarld Hand Play Glove Puppet Dragon Dinosaur Green Childrens Soft Toy,Toys & Games,https://www.amazon.com/Ikea-Fantasivarld-Puppet-Dinosaur-Childrens/dp/B00GOHP3J6/ref=sr_1_8?ie=UTF8&amp;qid=1421017995&amp;sr=8-8&amp;keywords=dragon+hand+puppet,1,1
Book of Erotic Fantasy,Books,https://www.amazon.com/Book-Erotic-Fantasy-Gwendolyn-Kestrel/dp/097420451X,1,1
LEGO Series 14 Minifigure Gargoyle,Toys & Games,https://www.amazon.com/dp/B014ERHSQS/ref=cm_sw_r_cp_awd_eTzRwb74J0GAY,1,1
"No Thank You, Evil!",Toys & Games,https://www.amazon.com/Monte-Cook-Games-Thank-Evil/dp/1939979420,1,1
Magic The Gathering: Arena of the Planeswalkers Battle for Zendikar Expansion Pack,Toys & Games,https://www.amazon.com/Magic-Gathering-Planeswalkers-Zendikar-Expansion/dp/B015XXU5KS/ref=sr_1_1?ie=UTF8&amp;qid=1494916544&amp;sr=8-1&amp;keywords=Arena+of+the+Planeswalkers,1,1
12 x 12 Acrylic Mirror Sheet by Laser Creations,Home & Kitchen,https://www.amazon.com/Acrylic-Mirror-Sheet-Laser-Creations/dp/B01MXE417D/ref=sr_1_3?ie=UTF8&amp;qid=1500665449&amp;sr=8-3&amp;keywords=first+surface+mirror,1,1
"50 Pcs 1ml-extra Mini Tiny Clear Glass Jars Bottles with Cork Stoppers, Marrywindix Glass Bottles for DIY, Arts & Crafts, Projects, Decoration, Party Favors",Home & Kitchen,https://www.amazon.com/dp/B004DMAHFY/ref=cm_sw_r_cp_apa_5GQaybN1TKVEA,1,1
"US Toy One Giant Squeaky Circus Carnival Clown Hammer, Assorted Color",Toys & Games,https://www.amazon.com/Toy-Squeaky-Circus-Carnival-Assorted/dp/B00362RW3M/ref=sr_1_6?ie=UTF8&amp;qid=1472913995&amp;sr=8-6&amp;keywords=gavel,1,1
"Universal Small Binder Clips Black/Silver, 144 Each (10200VP)",Office Products,https://www.amazon.com/Universal-Small-Binder-Silver-10200VP/dp/B00B9GTBYA/ref=sr_1_10?s=office-products&amp;ie=UTF8&amp;qid=1475070201&amp;sr=1-10&amp;keywords=binder+clips,1,1
"26"" x 26"" Role Playing Reversible Vinyl Gaming Mat: Melee Mat with 1” Squares and Hexes by Wiz Dice",Toys & Games,https://www.amazon.com/gp/product/B00OCYO8XK/ref=oh_aui_detailpage_o07_s00?ie=UTF8&amp;psc=1,1,1
"AW Pro Rolling Jewelry Makeup Case w/ Drawers Code Lock Aluminum Portable Display 14x9x20"" Black Box",Beauty & Personal Care,https://www.amazon.com/Professional-Rolling-Jewelry-Drawers-Aluminum/dp/B00OK6YPBU/ref=sr_1_6?ie=UTF8&amp;qid=1443029511&amp;sr=8-6&amp;keywords=travel+bag+with+drawers,1,1
12mm Dwarven Metal Copper 7-set,Toys & Games,https://www.amazon.com/12mm-Dwarven-Metal-Copper-7-set/dp/B001898220,1,1
Femitu Miniature Glass Bottle with Cork Empty Sample Jars Small 18x10mm by Femitu,Home & Kitchen,https://www.amazon.com/Bottles-Miniature-Bottle-18x10mm-HeightxDia/dp/B00OMR9ED6/ref=sr_1_3?ie=UTF8&amp;qid=1434776624&amp;sr=8-3&amp;keywords=potion+bottles,1,1
10pcs Realistic Cockroach Lifelike,All Departments,https://www.amazon.com/dp/B018GVG5DK/sr=8-9/qid=1471447919,1,1
"Armour Etch Cream, 10-Ounce","Arts, Crafts & Sewing",https://www.amazon.com/Armour-Etch-15-0200-Cream-10-Ounce/dp/B001BE3UM4/ref=pd_sim_201_2?ie=UTF8&amp;refRID=10W2P9S9ECQVWBQ7KPT3&amp;dpID=51PaTSeV3qL&amp;dpSrc=sims&amp;preST=_AC_UL160_SR160,1,1
"5 Magical Finger Puppets-4 3/4"" Tall.",Toys & Games,https://www.amazon.com/Magical-Finger-Puppets-4-Tall/dp/B00QFUOLCC/ref=sr_1_13?ie=UTF8&amp;qid=1421019616&amp;sr=8-13&amp;keywords=Ikea+dragon,1,1
Chessex Dice: Polyhedral 7-Die Festive Dice Set - Vibrant Color Swirl with Brown Pips,Toys & Games,https://www.amazon.com/Chessex-Dice-Polyhedral-Festive-Vibrant/dp/B00MHXUDU0,1,1
EKIND Model LED Base Stand (Blue light & Black Color),Home & Kitchen,https://www.amazon.com/gp/product/B0194H2QWE/ref=oh_aui_detailpage_o00_s00?ie=UTF8&amp;psc=1,1,1
Plano Large 3 Tray Tackle Box,Sports & Outdoors,https://www.amazon.com/dp/B003JFOZEU/ref=cm_sw_r_other_apa_DeUyzb9AS07Y1,1,1
Chessex Role Playing Play Mat: MEGAMAT Double-Sided Reversible Mat for RPGs and Miniature Figure Games - 34 1/2in x 48in,Toys & Games,https://www.amazon.com/gp/product/B000XQQHK8/ref=s9_simh_gw_p21_d0_i2?pf_rd_m=ATVPDKIKX0DER&amp;pf_rd_s=desktop-1&amp;pf_rd_r=17EG82NSGD6D5C6Q6MQ8&amp;pf_rd_t=36701&amp;pf_rd_p=2079475242&amp;pf_rd_i=desktop,1,1
Design Toscano Horned Dragon Skull Wall Trophy,Home & Kitchen,https://www.amazon.com/dp/B001QYHCDC/ref=asc_df_B001QYHCDC5137299/?tag=hyprod-20&amp;creative=395033&amp;creativeASIN=B001QYHCDC&amp;linkCode=df0&amp;hvadid=167130978369&amp;hvpos=1o1&amp;hvnetw=g&amp;hvrand=12692610430425440773&amp;hvpone=&amp;hvptwo=&amp;hvqmt=&amp;hvdev=c&amp;hvdvcmdl=&amp;hvlocint=&amp;hvlocphy=9009582&amp;hvtargid=pla-275420185817,1,1
GameMastery Flip-Mat: Basic,Books,https://www.amazon.com/GameMastery-Flip-Mat-Basic-Paizo-Staff/dp/1601251556/ref=sr_1_3?ie=UTF8&amp;qid=1421776638&amp;sr=8-3&amp;keywords=Pathfinder+Flip-Mat,1,1
name,category,amazon_link,total_mentions,subreddit_mentions
Grimtooth's Ultimate Traps Collection - Softcover,Books,https://www.amazon.com/Grimtooths-Ultimate-Traps-Collection-Softcover/dp/0996181318,1,1
Manual of the Planes (Dungeon & Dragons d20 3.0 Fantasy Roleplaying),Books,https://www.amazon.com/Manual-Dungeon-Dragons-Fantasy-Roleplaying/dp/0786918500/ref=sr_1_1?s=books&amp;ie=UTF8&amp;qid=1470655697&amp;sr=1-1&amp;keywords=manual+of+the+planes,1,1
"Expedition to Undermountain (Dungeons & Dragons d20 3.5 Fantasy Roleplaying, Adventure)",Books,https://www.amazon.com/Expedition-Undermountain-Dungeons-Roleplaying-Adventure/dp/078694157X/ref=pd_sbs_14_t_0?_encoding=UTF8&amp;psc=1&amp;refRID=Z7227HFP67JX5FN677Z4,1,1
Halls of Undermountain: A 4th Edition Dungeons & Dragons Supplement,Books,https://www.amazon.com/Halls-Undermountain-Dungeons-Dragons-Supplement/dp/0786959940,1,1
Hape Happy Harp Kid's Wooden Musical Instrument,Toys & Games,https://www.amazon.com/Hape-Early-Melodies-Happy-Harp/dp/B00IHZYWE0/ref=sr_1_4?ie=UTF8&amp;qid=1450813269&amp;sr=8-4&amp;keywords=zither,1,1
Roots of Evil (AD&D: Ravenloft Adventure RM1),Books,https://www.amazon.com/Roots-Evil-AD-Ravenloft-Adventure/dp/1560765976/ref=sr_1_1?ie=UTF8&amp;qid=1473037683&amp;sr=8-1&amp;keywords=roots+of+evil+ravenloft+adventure,1,1
name,category,amazon_link,total_mentions,subreddit_mentions
Wolverine: Old Man Logan,Books,https://www.amazon.com/Wolverine-Old-Logan-Mark-Millar/dp/0785131728?sa-no-redirect=1,3,1
"The Coming Storm (Pirates of the Caribbean: Jack Sparrow, No. 1)",Books,https://www.amazon.com/The-Coming-Storm-Pirates-Caribbean/dp/1423100182,1,1
name,category,amazon_link,total_mentions,subreddit_mentions
Dungeons & Dragons Starter Set,Books,https://www.amazon.com/Dungeons-Dragons-Starter-Set-Roleplaying/dp/0786965592/ref=pd_sim_b_3?ie=UTF8&amp;refRID=0Q6ZMZKW7PV0QX9MQ6P8,46,4
Pound-O-Dice,Toys & Games,https://www.amazon.com/Chessex-001LBCHX-Pound-O-Dice/dp/B008C0KXYS/ref=sr_1_4?s=toys-and-games&amp;ie=UTF8&amp;qid=1495403367&amp;sr=1-4&amp;keywords=bag+of+dice,12,3
Sword Coast Adventurer's Guide (D&D Accessory),Books,https://www.amazon.com/Sword-Coast-Adventurers-Guide-Accessory/dp/0786965800/ref=sr_1_1?ie=UTF8&amp;qid=1451719103&amp;sr=8-1&amp;keywords=sword+coast+adventurer,5,3
Player's Handbook (Dungeons & Dragons),Books,https://www.amazon.com/Players-Handbook-Dungeons-Dragons-Wizards/dp/0786965606/ref=pd_bxgy_14_2?ie=UTF8&amp;refRID=0N7WFM1Q9ZGVRBMNC8XW,23,2
Wiz Dice Random Polyhedral Dice in Multiple Colors (100 + Pack) Bundle with Wiz Dice Pouch,Sports & Outdoors,https://www.amazon.com/Random-Polyhedral-Dice-Multiple-Wiz/dp/B009R6J8RY,20,2
Chessex Role Playing Play Mat: Battlemat Double-Sided Reversible Mat for RPGs and Miniature Figure Games (26 in x 23 1/2 in) Squares/Hexes,Toys & Games,https://www.amazon.com/Chessex-Role-Playing-Play-Mat/dp/B0015IQO2O/ref=sr_1_1?s=toys-and-games&amp;ie=UTF8&amp;qid=1431212805&amp;sr=1-1&amp;keywords=battle+mat,9,2
Volo's Guide to Monsters,Books,https://www.amazon.com/gp/product/0786966017/ref=as_li_qf_sp_asin_il_tl?ie=UTF8&amp;tag=rainbow0ad-20&amp;camp=1789&amp;creative=9325&amp;linkCode=as2&amp;creativeASIN=0786966017&amp;linkId=b61036f0c89467114fd84d13e636aba0,4,2
Hoard of the Dragon Queen (D&D Adventure),Books,https://www.amazon.com/Hoard-Dragon-Queen-Adventure-Wizards/dp/0786965649/ref=pd_sim_14_11?ie=UTF8&amp;dpID=51VymphV,3,2
D&D Character Sheets,Books,https://www.amazon.com/Untitled-RPG-Accessory-Wizards-Team/dp/0786966181/,2,2
Dungeon Master's Screen Reincarnated,Books,https://www.amazon.com/Untitled-RPG-Accessory-Wizards-Team/dp/078696619X/,2,2
Dungeon Master's Guide (D&D Core Rulebook),Books,https://www.amazon.com/Dungeon-Masters-Guide-Core-Rulebook/dp/0786965622/ref=pd_bxgy_14_3?ie=UTF8&amp;refRID=0N7WFM1Q9ZGVRBMNC8XW,12,1
Monster Manual (D&D Core Rulebook),Books,https://www.amazon.com/Monster-Manual-Core-Rulebook-Wizards/dp/0786965614/ref=pd_sim_14_3?ie=UTF8&amp;dpID=51SqPlj7h4L&amp;dpSrc=sims&amp;preST=_AC_UL160_SR125,8,1
"EXPO Vis-A-Vis Wet-Erase Overhead Transparency Markers, Fine Point, Assorted Colors, 8-Count",Office Products,https://www.amazon.com/Expo-Vis-A-Vis-Markers-Colored-16078/dp/B00006IFGW/ref=pd_bxgy_21_img_y,4,1
D&D Dungeon Master's Screen (D&D Accessory),Books,https://www.amazon.com/Dungeon-Masters-Screen-Accessory/dp/0786965630/ref=sr_1_cc_1?s=aps&amp;ie=UTF8&amp;qid=1431212776&amp;sr=1-1-catcorr&amp;keywords=d,3,1
Toysmith 36-Piece Guardian Knights Action Figure Set,Toys & Games,https://www.amazon.com/Toysmith-Guardian-Knights-Action-36-Piece/dp/B000YA7FS6/ref=pd_sim_21_1?ie=UTF8&amp;refRID=1J109DKJCMQ6QZJJ83S6,3,1
Chronicles of the Black Company,Books,https://www.amazon.com/Chronicles-Black-Company-Glen-Cook/dp/0765319233/ref=sr_1_3?ie=UTF8&amp;qid=1497121270&amp;sr=8-3&amp;keywords=the+black+company.,3,1
TimMee Legendary BATTLE Fantasy Figures: 24pc 70mm Set - Made in USA,Toys & Games,https://www.amazon.com/TimMee-Legendary-Battle-Fantasy-Figures/dp/B00FQIJEO4/ref=sr_1_24?ie=UTF8&amp;qid=1435888258&amp;sr=8-,2,1
Eberron Campaign Setting (Dungeons & Dragons d20 3.5 Fantasy Roleplaying),Books,https://www.amazon.com/Eberron-Campaign-Setting-Dungeons-Roleplaying/dp/0786932740,2,1
Out of the Abyss (D&D Accessory),Books,https://www.amazon.com/Out-Abyss-D-Accessory/dp/0786965819/ref=pd_sim_14_8?ie=UTF8&amp;dpID=51LOlkLFtVL&amp;dpSrc=sims&amp;preST=_AC_UL160_SR123,2,1
Princes of the Apocalypse (D&D Accessory),Books,https://www.amazon.com/Princes-Apocalypse-D-Accessory/dp/0786965789/ref=pd_sim_14_6?ie=UTF8&amp;dpID=61CrxUH,2,1
The Noteboard Ltd. Noteboard Pocket-Size Dry Erase-Board (NB35X15),Office Products,https://www.amazon.com/Noteboard-Ltd-Pocket-Size-Erase-Board-NB35X15/dp/B00EAOJA4Y?ie=UTF8&amp;psc=1&amp;redirect=true&amp;ref_=ox_sc_sfl_title_9&amp;smid=A19NVE4G6SOT2C,2,1
Basic Fantasy Role-Playing Game 3rd Edition,Books,https://www.amazon.com/gp/product/1503334945,2,1
"Con-Tact Brand Grip Premium Non-Adhesive Non-Slip Shelf and Drawer Liner, 12-Inches by 4-Feet, Black",Home & Kitchen,https://www.amazon.com/Con-Tact-Premium-Non-Adhesive-Non-Slip-12-Inches/dp/B001AH8PLI/ref=sr_1_2?ie=UTF8&amp;qid=1497283869&amp;sr=8-2&amp;keywords=drawer+grip+liner,2,1
"I, Strahd : The Memoirs of a Vampire (Ravenloft Books)",Books,https://www.amazon.com/Strahd-Memoirs-Vampire-Ravenloft-Books/dp/1560766700/ref=pd_sim_sbs_14_1?ie=UTF8&amp;dpID=51pESagNMoL&amp;dpSrc=sims&amp;preST=_AC_UL160_SR119,2,1
"TOPS Standard Easel Pads, 3-Hole Punched, 27 x 34 Inch, 1"" Grid, White, 50 Sheets/Pad, Carton of 2 Pads (7902)",Office Products,https://www.amazon.com/Standard-3-Hole-Punched-Sheets-Carton/dp/B00AQDGJRO/ref=sr_1_1?ie=UTF8&amp;qid=1484509455&amp;sr=8-1&amp;keywords=1+inch+grid+easel+paper,2,1
Tactical Crusader Hand Held Hunting Archery 50LB Pistol Crossbow Gun,Sports & Outdoors,https://www.amazon.com/Hand-Hunting-Archery-PISTOL-CROSSBOW/dp/B0069T38N2/ref=sr_1_2?ie=UTF8&amp;qid=1432044738&amp;sr=8-2&amp;keywords=hand+crossbow,2,1
Rory's Story Cubes,Toys & Games,https://www.amazon.com/Gamewright-318-Rorys-Story-Cubes/dp/B003EIK136,1,1
"Shadows of the Last War (Dungeon & Dragons d20 3.5 Fantasy Roleplaying, Eberron Adventure)",Books,https://www.amazon.com/Shadows-Dungeon-Dragons-Roleplaying-Adventure/dp/0786932767/ref=pd_sim_14_7?_encoding=UTF8&amp;pd_rd_i=0786932767&amp;pd_rd_r=5KYHPJPPSEX6Q47REWGC&amp;pd_rd_w=PJvcq&amp;pd_rd_wg=PVpaj&amp;psc=1&amp;refRID=5KYHPJPPSEX6Q47REWGC,1,1
BOX - WOOD FILIGREE TREE OF LIFE 5x7 W/VELVET,Home & Kitchen,https://www.amazon.com/BOX-WOOD-FILIGREE-TREE-VELVET/dp/B003O4QN7S,1,1
D&D Tomb of Annihilation Dice,Books,https://www.amazon.com/Untitled-RPG-Accessory-Wizards-Team/dp/0786966203/,1,1
"Elmers Multi-Purpose Spray Adhesive, 4-Ounce, Clear",Office Products,https://www.amazon.com/Elmers-Multi-Purpose-Spray-Adhesive-4-Ounce/dp/B00178ORYY/ref=sr_1_5?ie=UTF8&amp;qid=1472015569&amp;sr=8-5&amp;keywords=glue+spray,1,1
Fiskars 12 Inch Recycled SureCut Trimmer  (01-005454),Office Products,https://www.amazon.com/dp/B003SLC3IU/ref=sr_ph_1?ie=UTF8&amp;qid=1472015549&amp;sr=sr-1&amp;keywords=paper+trimmer,1,1
Aidox Angle 5mm Eater Corner Rounder Small,"Arts, Crafts & Sewing",https://www.amazon.com/Aidox-Angle-Eater-Corner-Rounder/dp/B00161Q13C/ref=sr_1_4?ie=UTF8&amp;qid=1472015557&amp;sr=8-4&amp;keywords=corner+rounder,1,1
"Southworth 25% Cotton Linen Coverstock, 8.5 x 11 inches, Ivory, 65 lb, 100 Sheets (Z560CK)",Office Products,https://www.amazon.com/Southworth-Cotton-Coverstock-inches-Z560CK/dp/B00125O92W/ref=sr_1_6?ie=UTF8&amp;qid=1472015710&amp;sr=8-6&amp;keywords=linen+cover+stock,1,1
Golden Universal Tarot Deck,Books,https://www.amazon.com/Golden-Universal-Tarot-Deck-Scarabeo/dp/0738737429/ref=sr_1_1?ie=UTF8&amp;qid=1502045444&amp;sr=8-1&amp;keywords=golden+universal+tarot,1,1
73915 D&D: Spellbook Cards: Arcane Deck,Toys & Games,https://www.amazon.com/73915-Spellbook-Cards-Arcane-Deck/dp/B01MRVJ1TB/ref=pd_sbs_21_1?_encoding=UTF8&amp;pd_rd_i=B01MRVJ1TB&amp;pd_rd_r=7FCRMNQZT6T0Q829MH4A&amp;pd_rd_w=Jl8Eq&amp;pd_rd_wg=vZciB&amp;psc=1&amp;refRID=7FCRMNQZT6T0Q829MH4A,1,1
Dowswin Sealing Wax Antique Sealing Wax Sticks Set without Wicks Retro Spoon and Candles for Postage Letter Retro Vintage Wax Seal Stamp,"Arts, Crafts & Sewing",https://www.amazon.com/gp/product/B01N48LD7U/ref=od_aui_detailpages00?ie=UTF8&amp;psc=1,1,1
"ECR4Kids 14-Drawer Mobile Organizer, Smoke",Industrial & Scientific,https://www.amazon.com/gp/product/B006OHKVXE/ref=oh_aui_detailpage_o01_s01?ie=UTF8&amp;psc=1,1,1
"Jumbo DICE, 7 Different Polyhedral Styles in BLACK with white numbers",Toys & Games,https://www.amazon.com/Jumbo-Different-Polyhedral-Styles-numbers/dp/B00KK0VS06/ref=pd_sim_21_6?ie=UTF8&amp;dpID=51xgVlrlpYL&amp;dpSrc=sims&amp;preST=_AC_UL160_SR148,1,1
Dry Erase 10 inch Dungeon Tiles - Pack of 9,Toys & Games,https://www.amazon.com/Dry-Erase-inch-Dungeon-Tiles/dp/B016H0TNFY,1,1
"Secrets of Sarlona (Dungeons & Dragons d20 3.5 Fantasy Roleplaying, Eberron Supplement)",Books,https://www.amazon.com/Secrets-Sarlona-Dungeons-Roleplaying-Supplement/dp/0786940379,1,1
"Secrets of Xen'drik (Dungeon & Dragons d20 3.5 Fantasy Roleplaying, Eberron Setting)",Books,https://www.amazon.com/Secrets-Xendrik-Dungeon-Dragons-Roleplaying/dp/0786939168,1,1
"Player's Guide to Eberron (Dungeons & Dragons d20 3.5 Fantasy Roleplaying, Eberron Supplement)",Books,https://www.amazon.com/Players-Eberron-Dungeons-Roleplaying-Supplement/dp/0786939125,1,1
"Sharn: City of Towers (Dungeons & Dragons d20 3.5 Fantasy Roleplaying, Eberron Supplement)",Books,https://www.amazon.com/Sharn-Dungeons-Dragons-Roleplaying-Supplement/dp/0786934344,1,1
"Five Nations (Dungeon & Dragons d20 3.5 Fantasy Roleplaying, Eberron Supplement)",Books,https://www.amazon.com/Nations-Dungeon-Dragons-Roleplaying-Supplement/dp/0786936908,1,1
Eberron: Explorer's Handbook,Books,https://www.amazon.com/Explorers-Handbook-Dungeon-Roleplaying-Supplement/dp/0786936916,1,1
"1"" Circle Labels (100 Sheets) - White Matte - 63 Labels Per Sheet",Office Products,https://www.amazon.com/dp/B003BLHHX8?psc=1,1,1
"Castle Keep Dice Tower, 2 Castle Wall DM Screens with Magnetic Initiative Turn Tracker",Toys & Games,https://www.amazon.com/Castle-Screens-Magnetic-Initiative-Tracker/dp/B00P30WJ9W,1,1
The Rise of Tiamat (D&D Adventure),Books,https://www.amazon.com/Rise-Tiamat-Adventure-Wizards-Team/dp/0786965657/ref=pd_sim_14_12?ie=UTF8&amp;dpID=51t97nrPhTL&amp;dpSrc=sims&amp;preST=_AC_UL160_SR123,1,1
SmartDealsPro Set of 100 1 Inch Plastic Learning Counting Counters Game Tokens Mini Poker Chips-Random Color,Sports & Outdoors,https://www.amazon.com/SmartDealsPro-Learning-Counting-Counters-Chips-Random/dp/B00W5MUYI4/ref=sr_1_3?ie=UTF8&amp;qid=1452435199&amp;sr=8-3&amp;keywords=1,1,1
Xanathar's Guide to Everything,Books,https://www.amazon.com/Xanathars-Guide-Everything-Wizards-Team/dp/0786966114/ref=sr_1_1?ie=UTF8&amp;qid=1498581624&amp;sr=8-1&amp;keywords=xanthar,1,1
Tomb of Annihilation (Dungeons & Dragons),Books,https://www.amazon.com/Tomb-Annihilation-Wizards-RPG-Team/dp/0786966106/ref=pd_bxgy_14_2?_encoding=UTF8&amp;pd_rd_i=0786966106&amp;pd_rd_r=2T6QDE3B8F183XQWEQFJ&amp;pd_rd_w=GRDEH&amp;pd_rd_wg=0VbWn&amp;psc=1&amp;refRID=2T6QDE3B8F183XQWEQFJ,1,1
Critical Hit Deck 3001 (two pack),Toys & Games,https://www.amazon.com/Paizo-Publishing-Critical-Deck-3001/dp/B00TOW2N32/ref=sr_1_fkmr2_3?ie=UTF8&amp;qid=1475686677&amp;sr=8-3-fkmr2&amp;keywords=D,1,1
Critical Fumble Deck,Toys & Games,https://www.amazon.com/Paizo-Publishng-Inc-3004-Critical/dp/1601252366/ref=pd_bxgy_21_img_2?ie=UTF8&amp;psc=1&amp;refRID=CACE985TBR48ANMP0EZC,1,1
"Wooden Cubes – 1” Baby Wood Square Blocks – For Puzzle Making, Crafts, And DIY Projects – 50 Pieces by Woodpecker Crafts","Arts, Crafts & Sewing",https://www.amazon.com/Wooden-Cubes-Square-Projects-Woodpecker/dp/B00DNN5HOK,1,1
Gale Force 9 D&D Tyranny of the Dragons DM Screen Board Games,Toys & Games,https://www.amazon.com/Dungeons-Dragons-Tyranny-Screen-GF973701/dp/B00P83JGZY/ref=sr_1_cc_2?s=aps&amp;ie=UTF8&amp;qid=1431212776&amp;sr=1-2-catcorr&amp;keywords=d,1,1
"Axe Sickle 1 inches (50-pcs / 100-pcs / 200-pcs) Natural Schima superba unfinished round wood,These round wood coins The limitations are endless!(50-pcs)","Arts, Crafts & Sewing",https://www.amazon.com/100-pcs-200-pcs-Natural-unfinished-limitations/dp/B01CSV14JE/ref=sr_1_1?ie=UTF8&amp;qid=1476977705&amp;sr=8-1&amp;keywords=one+inch+wood+discs,1,1
"Martha Stewart Crafts Punch, 1-Inch Circle","Arts, Crafts & Sewing",https://www.amazon.com/Martha-Stewart-Crafts-1-Inch-Circle/dp/B002BTSEM4/ref=sr_1_1?ie=UTF8&amp;qid=1476977751&amp;sr=8-1&amp;keywords=one+inch+hole+punch,1,1
Storm King's Thunder (Dungeons & Dragons),Books,https://www.amazon.com/Storm-Kings-Thunder-Dungeons-Dragons/dp/0786966009/ref=sr_1_1?ie=UTF8&amp;qid=1473716564&amp;sr=8-1&amp;keywords=storm+kings+thunder,1,1
"Quartet Magnetic Dry Erase Markers 6PK, Fine Point, Assorted Colors, ReWritables (51-659312Q)",Office Products,https://www.amazon.com/Quartet-Magnetic-Assorted-ReWritables-51-659312Q/dp/B0006VQBTW/ref=pd_sim_229_4?ie=UTF8&amp;refRID=010CCB77QNSYKPZJDWSE,1,1
"Mead Index Cards, Ruled, 3 x 5 Inch, White, 100 Per Pack (63350)",Office Products,https://www.amazon.com/Mead-Index-Cards-Ruled-63350/dp/B0010XUO52/ref=lp_490741011_1_1?s=office-products&amp;ie=UTF8&amp;qid=1437875828&amp;sr=1-1,1,1
"Universal Paper Clips, Smooth, Size No. 1, Silver, 100/BX, 10 Boxes/Pack",Office Products,https://www.amazon.com/Universal-72210-Smooth-Finish-Pack-UNV72210/dp/B0039YCSI6/ref=sr_1_1?s=office-products&amp;ie=UTF8&amp;qid=1437875979&amp;sr=1-1&amp;keywords=paper+clips,1,1
